title,genre,url,summary
SoulCalibur,fighting,https://www.metacritic.com/game/dreamcast/soulcalibur,"This is a tale of souls and swords, transcending the world and all its history, told for all eternity... The greatest weapons-based fighter returns, this time on Sega Dreamcast. Soul Calibur unleashes incredible graphics, fantastic fighters, and combos so amazing they'll make your head spin!"
Tekken 3,fighting,https://www.metacritic.com/game/playstation/tekken-3,"An ancient evil force has reawakened, attacking in secret and feeding on the souls of mighty warriors. To lure it out of hiding will take the greatest fighting contest the world has ever seen...Tekken 3. Some are fighting for revenge, some for honor, Ultimately, all are fighting for their lives and the fate of all mankind."
Street Fighter IV,fighting,https://www.metacritic.com/game/playstation-3/street-fighter-iv,"Street Fighter IV features a mix of returning favourites such as Ryu, Ken, Chun-Li and Guile along with new characters created exclusively for this game such as Crimson Viper, Abel, El Fuerte, and Rufus. Characters and environments are rendered in high definition 3D, while the game is played in the classic Street Fighter 2D perspective with additional 3D camera flourishes. Six-button controls for the game return, with a host of new special moves and features integrated into the input system. Street Fighter IV also incorporates state of the art online match making and worldwide online gameplay. Mixing classic genre-defining game mechanics the franchise is known and loved for with all-new, never-before-seen gameplay systems, Street Fighter IV brings a brand new fighting game to fans the world over. With the inclusion of Capcom's latest advancements in new generation technology, Street Fighter IV promises to deliver an extraordinary experience that will re-introduce the world to the time-honoured art of virtual martial arts. New special moves that go beyond any Street Fighter fan's wildest imagination, including Focus attacks, Super Combos, and the revenged-fueled Ultra Combo system. Classic Street Fighter characters recreated for a new generation of gamers, including the original cast of Street Fighter II. New brawlers: female super-spy Crimson Viper, lucha libre wrestler El Fuerte, mixed martial artist Abel and more. New gameplay elements provide new challenges for both newcomers and the most seasoned Street Fighter pro. Online gameplay features, including instantaneous online challenges, versus mode, tournament mode, and world wide online gameplay. [Capcom]"
Virtua Fighter 4,fighting,https://www.metacritic.com/game/playstation-2/virtua-fighter-4,"Two new characters (Lei Fei and Vanessa Lewis) join 11 VF veterans, each with their own unique styles based on real martial arts. New counters and defensive moves allow players to switch up their stances and fighting styles mid-bout. Train a computer-controlled character through sparring and an easy-to-use rewards system, then pit your character against a friend's or challenge the arcade mode. [Sega]"
Super Smash Bros. Brawl,fighting,https://www.metacritic.com/game/wii/super-smash-bros-brawl,"[Metacritic's 2008 Wii Game of the Year] Super Smash Bros. Brawl is the next installment in the Smash Bros. series for the company's Wii console. Among the new characters playable in the game are Meta Knight, the sword-wielding nemesis of Kirby; Pit, the angelic archer from Kid Icarus; Zero Suit Samus, the powerful Metroid series heroine minus her versatile armor; and Wario, who demonstrates a noxious attack of gastronomic proportions. Also Snake, the gritty soldier from Konami's hugely popular Metal Gear series. [Nintendo]"
Street Fighter Alpha 3,fighting,https://www.metacritic.com/game/playstation/street-fighter-alpha-3,Street Fighter Alpha 3...scores a triple K.O.!
Street Fighter IV,fighting,https://www.metacritic.com/game/xbox-360/street-fighter-iv,"Street Fighter IV features a mix of returning favourites such as Ryu, Ken, Chun-Li and Guile along with new characters created exclusively for this game such as Crimson Viper, Abel, El Fuerte, and Rufus. Characters and environments are rendered in high definition 3D, while the game is played in the classic Street Fighter 2D perspective with additional 3D camera flourishes. Six-button controls for the game return, with a host of new special moves and features integrated into the input system. Street Fighter IV also incorporates state of the art online match making and worldwide online gameplay. Mixing classic genre-defining game mechanics the franchise is known and loved for with all-new, never-before-seen gameplay systems, Street Fighter IV brings a brand new fighting game to fans the world over. With the inclusion of Capcom's latest advancements in new generation technology, Street Fighter IV promises to deliver an extraordinary experience that will re-introduce the world to the time-honoured art of virtual martial arts. New special moves that go beyond any Street Fighter fan's wildest imagination, including Focus attacks, Super Combos, and the revenged-fueled Ultra Combo system. Classic Street Fighter characters recreated for a new generation of gamers, including the original cast of Street Fighter II. New brawlers: female super-spy Crimson Viper, lucha libre wrestler El Fuerte, mixed martial artist Abel and more. New gameplay elements provide new challenges for both newcomers and the most seasoned Street Fighter pro. Online gameplay features, including instantaneous online challenges, versus mode, tournament mode, and world wide online gameplay. [Capcom]"
SoulCalibur II,fighting,https://www.metacritic.com/game/gamecube/soulcalibur-ii,"Open the next chapter in world of Soul Calibur. Soul Calibur II features seven distinctive gameplay modes including: Arcade, Versus, Time Attack, Survival, Team Battle, Practice, and the console exclusive Weapon Master. Collect up to 200 different weapons and battle characters with their own styles, strengths, and abilities. In addition to the 13 fighters, each platform has unique special fighters: Link for GameCube, Heihachi for PS2, and Spawn for Xbox. Prove yourself through soul and sword."
Virtua Fighter 4: Evolution,fighting,https://www.metacritic.com/game/playstation-2/virtua-fighter-4-evolution,"Challenge a steady stream of opponents with varying ranks and skill levels, with the impression that you're playing online against human opponents with different styles. Along with this illusion of online play, Virtua Fighter 4 has also been expanded upon, including the roster, the character customization features, the visuals, the training mode, and even the arcade mode. With the different tournaments and two new characters to explore, VF4: Evolution will put your fighting skills to the ultimate test."
SoulCalibur II,fighting,https://www.metacritic.com/game/playstation-2/soulcalibur-ii,"A new page in history has begun as the most highly-anticipated fighting game ever finally arrives! The greatest 3-D weapons-based fighter will provide non-stop action, excitement and surprises as you go one-on-one against your favorite challengers. 13 historic fighters plus all new combatants including Necrid, specially designed by Todd McFarlane Productions, Inc. Unique special guest fighters for each platform include Link (GameCube), Heihachi (PS2), and Todd McFarlane's Spawn (Xbox). 7 exciting modes of play including Arcade, Vs, Time Attack, Survival, Team Battle, Practice, and Weapon Master. Collect 200 different weapons in the all-new mission-complete Weapon Master mode. [Namco]"
Super Street Fighter IV,fighting,https://www.metacritic.com/game/playstation-3/super-street-fighter-iv,"The follow-up to Street Fighter IV further redefines the fighting game genre with classic 2D Street Fighter fighting action, a host of new and returning characters, more advanced online gameplay, new ultra combos and much more. Super Street Fighter IV features the full roster of 25 characters from Street Fighter IV such as Ryu, Ken, Crimson Viper, Abel, El Fuerte, and Rufus, while adding about eight characters new to the world of Street Fighter IV. The impressive new roster includes classic combatants from previous Street Fighter games like T. Hawk as well as all-new characters such as the mysterious and deadly female fighter, Juri. Super Street Fighter IV adds new Ultra Combos and advancements to the state of the art online matchmaking and online gameplay introduced in Street Fighter IV with numerous additional features. Super Street Fighter IV takes many of the groundbreaking features introduced in Street Fighter IV and refines everything to deliver the ultimate vision of Street Fighter to fans the world over. [Capcom]"
Super Smash Bros. Melee,fighting,https://www.metacritic.com/game/gamecube/super-smash-bros-melee,"Nintendo's all-star cast of combatants is back in Super Smash Bros. Melee, along with a new batch of brawlers ready to tear it up. The sequel to Super Smash Bros. keeps the same basic premise: Characters duke it out in interactive environments, using special attacks and various items to knock each other into the abyss. Some new defensive techniques add an even deeper level of complexity to the combat. In addition to traditional battle royale matches, players can select all-new ways to play like Coin mode and Tournament mode."
SoulCalibur II,fighting,https://www.metacritic.com/game/xbox/soulcalibur-ii,"Open the next chapter in world of Soul Calibur. Soul Calibur II features seven distinctive gameplay modes including: Arcade, Versus, Time Attack, Survival, Team Battle, Practice, and the console exclusive Weapon Master. Collect up to 200 different weapons and battle characters with their own styles, strengths, and abilities. In addition to the 13 fighters, each platform has unique special fighters: Link for GameCube, Heihachi for PS2, and Spawn for Xbox. Prove yourself through soul and sword."
Super Smash Bros. for Wii U,fighting,https://www.metacritic.com/game/wii-u/super-smash-bros-for-wii-u,Duke it out with your favorite Nintendo characters in Super Smash Bros. for the Nintendo Wii U.
Super Street Fighter IV,fighting,https://www.metacritic.com/game/xbox-360/super-street-fighter-iv,"The follow-up to Street Fighter IV further redefines the fighting game genre with classic 2D Street Fighter fighting action, a host of new and returning characters, more advanced online gameplay, new ultra combos and much more. Super Street Fighter IV features the full roster of 25 characters from Street Fighter IV such as Ryu, Ken, Crimson Viper, Abel, El Fuerte, and Rufus, while adding about eight characters new to the world of Street Fighter IV. The impressive new roster includes classic combatants from previous Street Fighter games like T. Hawk as well as all-new characters such as the mysterious and deadly female fighter, Juri. Super Street Fighter IV adds new Ultra Combos and advancements to the state of the art online matchmaking and online gameplay introduced in Street Fighter IV with numerous additional features. Super Street Fighter IV takes many of the groundbreaking features introduced in Street Fighter IV and refines everything to deliver the ultimate vision of Street Fighter to fans the world over. [Capcom]"
DOA2: Hardcore,fighting,https://www.metacritic.com/game/playstation-2/doa2-hardcore,"This third version of Tecmo's acclaimed fighter ""Dead or Alive 2,"" ported to the Dreamcast ealier in the year, is a visual feast for PS2 gamers with the addition of new costumes, levels, hidden characters, amped-up graphics."
Street Fighter IV,fighting,https://www.metacritic.com/game/pc/street-fighter-iv,"At the completion of the second World Warrior Tournament, the Shadaloo crime syndicate was left in ruins, its grandmasters defeated and scattered to the winds. Now, the mysterious Seth, CEO of the S.I.N. Corporation, has set up yet another tournament and invited a blend of old friends and new faces to battle again for the title of the world's strongest. With 25 characters (including the original 12 street fighters), a blend of 2D and 3D graphics, and the new focus-attack system, Street Fighter has returned with a vengeance."
Marvel vs. Capcom 2,fighting,https://www.metacritic.com/game/dreamcast/marvel-vs-capcom-2,"The world's most insane tag-team fantasy fighter is bigger than ever! An unprecedented 56 characters include the debut of Jill from Resident Evil, Servbots from Mega Man and Cable from Marvel Comics fame. Experience arcade perfect fighting with 3 on 3 tag-team battles, unbelievable control and hyper-fast animation. Pick a fight with legendary Capcom characters and Super Heroes from the Marvel Universe and prepare to be amazed."
WWF SmackDown! 2: Know Your Role,fighting,https://www.metacritic.com/game/playstation/wwf-smackdown!-2-know-your-role,"Prepare for the most outrageous WF experience ever created. Brawl in the ring, backstage, in the VIP room, the parking lot of the new WF New York. Let your fury rage in the new Tornado Tag Team mode. If that's not hardcore enough, pull out the tables, ladders or chairs and really get nasty."
Tekken 2,fighting,https://www.metacritic.com/game/playstation/tekken-2,More than a sequel. The undisputed #1 fighting game on the planet.
WWF No Mercy,fighting,https://www.metacritic.com/game/nintendo-64/wwf-no-mercy,"Jump into the ring with the biggest, baddest jambronis around and experience brutal WWF action never before seen in a console game! Over 65 WWF superstars, all-new Ladder matches, and all-new Double-Team moves, like the Dudley 3D Deathdrop! Take on the entire Federation in Survival Mode. Take the action out of the ring in 10 different backstage areas!"
Infinity Blade II,fighting,https://www.metacritic.com/game/ios/infinity-blade-ii,Infinity Blade II is the second game in this fantasy action adventure role-playing game series for the iPhone 4S and iPad.
Virtua Fighter 5 Online,fighting,https://www.metacritic.com/game/xbox-360/virtua-fighter-5-online,"Virtua Fighter 5 features an all-star cast of 17 fighters, including characters from the previous iterations along with two new characters named El Blaze and Eileen. El Blaze is a Mexican fighting champion who defeats opponents with his quick Lucha Libre fighting style. Eileen, originally from China, uses a Monkey Kung-Fu fighting style that she learned from her grandfather, a former Kung-Fu master. Players are able to customize their characters by selecting from four uniquely patterned costumes and a wide range of attachable items that can be placed onto each fighter’s various body parts. Virtua Fighter 5 delivers fast-paced, adrenaline-pumping action as players head into battle, taking on a host of popular characters. Players not only achieve victory by defeating highly-skilled opponents, but also by competing for prizes which earn them in-game money allowing them to buy many items at in-game shop. These items allow players to customize their ultimate warrior and become the top Virtua Fighter. In addition, the game introduces ""Offensive Move"", a new maneuver that allows players to easily approach opponents from the side, adding a more strategic element to the battle. [Sega]"
Ultimate Fighting Championship,fighting,https://www.metacritic.com/game/dreamcast/ultimate-fighting-championship,"The Ultimate Fighting Championship (UFC) is the premier mixed martial arts event in the world. There are no flying chairs or unrealistic moves. Spectators expect and demand to see true-to-life combat. Now, the ultimate fighting event comes to the Dreamcast as the most realistic fighting game ever created."
Tekken 5,fighting,https://www.metacritic.com/game/playstation-2/tekken-5,"Classic Tekken fighters like Nina Williams, Marshall Law and Paul Phoenix match fists with 3 Iron Fist Tournament newcomers: Asuka Kazama, Raven and Feng Wei. Face off in lush, interactive environments. Hurl your opponent into destructible objects and walls to deal massive damage. Dig in to the most customizable Tekken game ever. Earn fight money and use your winnings to outfit your characters with shades, hats, alternate costumes, secret items and more. Battle your way through an intense, action-adventure side-story. Rebuilt from the ground up, Tekken 5's graphics engine delivers the most exquisite visuals yet to PS2 3D fighting fans. Stunning CG ending movies reward victorious combatants. [Namco]"
Super Street Fighter II Turbo HD Remix,fighting,https://www.metacritic.com/game/xbox-360/super-street-fighter-ii-turbo-hd-remix,"[Xbox Live Arcade] The original MMA series is back! Super Street Fighter II Turbo HD Remix receives a whole new look while improving on the innovative fighting system of the original game. Updated with 1080p HD redrawn art, widescreen support and remixed music, SSFHD Remix offers a unique experience appealing to new fans and Street Fighter purists alike. Play at home versus a friend or test your skills online. A new Remixed mode incorporates new techniques for your favorite characters, and the original Super Street Fighter II Turbo mode is built-in for those who want to revisit the game's old school gameplay. [Capcom]"
Mortal Kombat Komplete Edition,fighting,https://www.metacritic.com/game/xbox-360/mortal-kombat-komplete-edition,"Mortal Kombat Komplete Edition delivers the critically acclaimed game, all previously released downloadable content (DLC), plus digital downloads of the 2011 release of Mortal Kombat: Songs Inspired by the Warriors album with a bonus track, and the 1995 Mortal Kombat film on the PlayStation®Store or Xbox Live Zune. The DLC includes fan-favorite warriors Skarlet, Kenshi and Rain, as well as the infamous dream stalker Freddy Krueger. The game also offers 15 Klassic Skins and three Klassic Fatalities (Scorpion, Sub-Zero and Reptile). Mortal Kombat: Songs Inspired by the Warriors is a collection of electronic music inspired by the game and is executive produced by JFK (of the DJ/ production duo MSTRKRFT and Death From Above 1979)."
Tekken: Dark Resurrection,fighting,https://www.metacritic.com/game/psp/tekken-dark-resurrection,"TEKKEN: Dark Resurrection arrives on the PSP. New characters Lili and Dragunov join the classic cast such as Jin, Heihachi, Paul and Law in the battle to be crowned King of the Iron Fist Tournament. An all-new intro movie lets you dive into the midst of the world of TEKKEN, this time with ad-hoc multiplayer mode to fight against friends as well as more items to customize your favorite characters. The beauty of TEKKEN is re-created on the handheld console, delivering one of the most realistic graphics on a handheld platform. A variety of destructible objects pump up the action on 19 stages. Play as one of over 30 characters, including classics Jin, Heihachi, Paul, Law and more. New characters Lili and Dragunov join the classic cast with all-new fight styles and moves. Collecting victories to lead your character to become king rewards you with ending movies for each character. Use your fight money to customize your characters – with more than double the items seen in TEKKEN 5. Using Wi-Fi connectivity of the PSP platform, you can battle against your friends – take your customized, original character against theirs and let the battle unfold. Mini-games provide a little breather from heart-pumping fighting action for more fun against friends. [Namco]"
Super Street Fighter II Turbo HD Remix,fighting,https://www.metacritic.com/game/playstation-3/super-street-fighter-ii-turbo-hd-remix,"[Downloadable Game] One of the most popular games of the early '90s is reborn! Super Street Fighter II Turbo HD Remix, originally developed by Capcom for the arcade, makes its downloadable debut on the Xbox LIVE Arcade and PLAYSTATION Network. Capcom stays true to the foundation of the popular game by utilizing the original game code, while creating a fresh upgraded experience with new artwork and high resolution 1080p graphics. All of the art has been completely redrawn and created by UDON Comics, which currently publishes the official Street Fighter comic and is responsible for the new contemporary look of the Street Fighter franchise. Features all eighteen of the original Super Street Fighter II Turbo characters including Ryu, Guile, M. Bison and Akuma. One to two player head-to-head play either offline or online. Single player vs. CPU. Player vs. player over the same console. Player vs. player online. Training mode helps fighters hone their skills. Numerous online features: In-game voice chatting between players; Matchmaking flexibility through multiple options; Personal and friends statistics tracking; Worldwide rankings and leaderboards. [Capcom]"
BlazBlue: Calamity Trigger,fighting,https://www.metacritic.com/game/playstation-3/blazblue-calamity-trigger,"In the 13th hierarchical city, Kagutsuchi, the Librarium regulates the amazing power of Armagus, a fusion of magic and technology. Currently they are after a wanted criminal named Ragna The Bloodedge, also known as Death, who wants to destroy the Librarium. Due to Ragna possessing a powerful form of Armagus known as the Azure Grimoire, people far and wide are after not only his bounty, but his grimoire as well. This is where our story begins. BlazBlue Key Features: The first hi-res 2D fighter from the creators of the Guilty Gear series! Experience the beauty of high-resoluti on, hand-drawn sprites on 3D backgrounds, all in glorious high-definition. Online Battle Action. Get ready to take the action online and battle the best players from all over the world! Console Exclusive Modes. BlazBlue features the following console-only modes: Arcade, Vs, Practice, and a completely fleshed-out Story Mode that tells the tales of each character. Over 10 unique combatants to choose from! Choose a character that represents your own fighting style, like the lightning-fast Taokaka or the wickedly powerful Tager. Drive your way to victory! Use the unique ""Drive Attacks"" specific to each character to decimate your opponent. Depending on the character, control the elements like wind and ice, or even absorb the life force from your opponents. A plethora of offensive and defensive options at your disposal! Take advantage of Barriers, Counter Assaults, Rapid Cancels, and Distortion Drives to turn the tide of battle! [Akys Games]"
Power Stone 2,fighting,https://www.metacritic.com/game/dreamcast/power-stone-2,"The world's most revolutionary fighting game does it again! Power Stone 2 takes go-anywhere, grab-anything combat, and introduces awesome new innovations to the hit arcade fighting series. Now, up to four players wage insane battles in fully interactive, multi-level stages. Master over 120 different items used in battle - weapons, vehicles traps, power-upsand more! As if chaotic swashbuckling battles weren't enough, combine forces with other players to battle monstrous bosses to win the game!"
Infinity Blade,fighting,https://www.metacritic.com/game/ios/infinity-blade,"Project Sword is a fantasy action adventure RPG for the iPhone, iPad, and iPod Touch."
Dead or Alive 3,fighting,https://www.metacritic.com/game/xbox/dead-or-alive-3,"Dead or Alive returns to take fighters to the next level. The third installment of the series features new characters, interactive environments, and all-new lighting effects. Explore the many expansive levels in single-player mode or battle against up to four players in multiplayer mode. The destructible environments, kinetic tag-battle feature, and all-new fighters make Dead or Alive 3 a worthy entry in the series."
BlazBlue: Continuum Shift,fighting,https://www.metacritic.com/game/playstation-3/blazblue-continuum-shift,"BlazBlue: Continuum Shift inherits all the key features of its predecessor while adding a few twists of its own. Tsubaki, ?-12 and Hazama will join the ranks of the veterans, who will be reborn with additional moves added to their arsenals. With new modes like Beginner Mode and Tutorial Mode, even fighting game beginners can pull off combos like the pros and dive right into the action. [Aksys Games]"
Guilty Gear X2,fighting,https://www.metacritic.com/game/playstation-2/guilty-gear-x2,"Guilty Gear X2 revives the fighting tournament designed to find humans skilled enough to thwart the Gear threat. Take over 20 playable fighters, with 6 outrageous new characters. Use electrifying new moves and features, like Psych Burst, Faultless Defense, the all-new Burst Gauge system and more. Devastate your opponent with an arsenal of eye-popping, jaw-dropping moves and combos, including trademarks like Overdrive Attack, Gatling Combo, Roman Cancel and signature Instant Kills for each character! [Sammy]"
UFC Undisputed 3,fighting,https://www.metacritic.com/game/playstation-3/ufc-undisputed-3,"The critically acclaimed and best-selling MMA videogame franchise returns to take players inside the Octagon with UFC Undisputed 3, delivering intense UFC action focused on brutal toe-to-toe combat, impressive visual presentation and increased accessibility."
