title,genre,url,summary
Deadpool,fighting,https://www.metacritic.com/game/pc/deadpool,"Deadpool's oratory: ""There are a few important things I need to say before you crack into my insanely sweet game. (Oof. Here we go again.) I'm a mercenary with an accelerated healing factor. I've been described as unstable, which is just plain coo-coo. (Wait, do sane people say coo-coo?) I'm gonna battle for the safety of humans and mutants. (And even mumans.) Be prepared for just about anything. (Holla!) • I made sure to capture all my good sides, so I made my game a third-person action-shooter. (Yep, you get to look at my heinie.) • Keep a look out cuz some of my X-Men pals (Whoa, what pals?!) are making an appearance. (Hope you don't mind picking hair out of your tacos.) • I'm really good at killing, so I made it a blast stringing together combos, and totally eviscerating my enemies. (Ev-is-cer-a-ting!) • I brought my skills and a buttload of my favorite things. Katanas (check), guns (bang!) explosives (boom), duct tape (quack) and of course, yours truly - ME! (Checkmate!)"""
The King of Fighters XII,fighting,https://www.metacritic.com/game/xbox-360/the-king-of-fighters-xii,"The legendary 3-on-3 fighting game series that united rival brawlers from SNK Playmore's classic arcade franchises celebrates its 15th Anniversary in style with the release of The King of Fighters XII. For the first time in its history, this epic martial arts showdown has undergone a complete graphical overhaul. The antiquated character sprites used over the past 14 years have been dropped in favor of all-new, high-resolution fighters fluidly animating across painstakingly detailed, 100% hand-drawn backgrounds. [SNK Playmore]"
Kengo: Master of Bushido,fighting,https://www.metacritic.com/game/playstation-2/kengo-master-of-bushido,"The mind is a powerful weapon. So is the sword. When combined, they create the ultimate force. To be a Samurai master, you must silence one and make fierce the other. The rhythm of battle awaits you. Now, go young apprentice, and earn your glory."
Legends of Wrestling II,fighting,https://www.metacritic.com/game/xbox/legends-of-wrestling-ii,"Legends of Wrestling II takes you through the wrestling hall of fame with the top grapplers that are battling for squared-circle supremacy. Play as your favorite wrestler--including Hulk Hogan, Andre ""The Giant,"" and Bret ""Hitman"" Hart--each with signature entrances, taunts, and moves. A new storyline and career mode let you battle for the respect of promoters and fans while fighting for the heavyweight championship crown. The game also features tag-team tournaments, a $15,000 Body Slam Challenge, and a variety of match types."
TNA iMPACT!,fighting,https://www.metacritic.com/game/xbox-360/tna-impact!,"TNA iMPACT! is geared towards a quick paced, high-impact style of play, with less emphasis on submission moves. It also features straightforward, intuitive controls, with ""accurate"" and ""detailed"" character models. Actual scans of the wrestlers were used for the game in place of hand-painted textures to include small details, such as skin textures. Wrestling maneuvers are captured from actual TNA wrestlers in extensive motion capture sessions. Finishers are accessed by building up an ""Impact! meter"" displayed on the screen, the same place a color-coded damage indicator shows the condition of characters. The game also features mini-games for escaping pin attempts and submission holds. TNA's exclusive Ultimate X and King of the Mountain are playable match types alongside the more standard singles, tag team and Fatal Four-Way matches. The game is playable online, and supports tournaments. Eight different venues—including TNA's main home, the Florida Impact! Zone, and arenas in Japan and England—are be available to house matches, with the Impact! Zone having an increased ringside area for play and hotspots for player interaction. The game also features top wrestling talent such as Abyss, Kurt Angle, Christian Cage, Jeff Jarrett, Booker T, Samoa Joe, AJ Styles, Sting and more to deliver all of the excitement and action of the television show. [Midway]"
WWF Road to Wrestlemania,fighting,https://www.metacritic.com/game/game-boy-advance/wwf-road-to-wrestlemania,"For those who can overlook a little lack of polish, WWF: Road to Wrestlemania is an excellent addition to the wrestling enthusiast's game library."
Rumble Roses XX,fighting,https://www.metacritic.com/game/xbox-360/rumble-roses-xx,"The vixens of wrestling are back. Sure Rumble Roses XX delivers the visual ""enhancements"" that you would expect for a next generation game, but this is more than just another pretty face. Get in the ring and unload submission holds, reversals, and an increased number of other new moves to take down your opponent. Go online and team up with another beauty in the all-new Tag Team mode or compete in a free-for-all to determine who is Queen in the all-new Battle Royal mode. Fight fair or fight dirty - humiliation is the name of the game. The first and only all-female wrestling experience for the Xbox 360. New gameplay modes include Tag Team, Battle Royal, Elimination and more. New moves: A wider variety of moves and combinations offer a more realistic wresting experience. Compete online as a team or go head-to-head. Choose from more than 20 wrestlers each with a variety of costume changes, and new moves. [Konami]"
Mortal Kombat Arcade Kollection,fighting,https://www.metacritic.com/game/xbox-360/mortal-kombat-arcade-kollection,"Mortal Kombat Arcade Kollection will offer fans the chance to play through the games in their original arcade state and rediscover all their favorite characters, fatalities and environments as well as relive some of the franchise’s most memorable secrets. In addition, this new collection will feature online play, leaderboards, achievements and trophies."
Godzilla: Save the Earth,fighting,https://www.metacritic.com/game/playstation-2/godzilla-save-the-earth,"In the single-player game, G-Force scientists have cracked Godzilla's genetic code from samples obtained during the Vortaak invasion. Scientists have refined the code to grow super-enriched ""Godzilla-Matter"" -- a virtually indestructible substance with the exact physical properties as Godzilla's radioactive back spikes. The Vortaak learn of the Godzilla Matter and strike Monster Island in an attempt to steal G-Cells and seize control of Earth's monsters. As Godzilla, the player awakens and fights to stop the UFOs from stealing G-Cells, and to free his fellow monsters from captivity. Throughout the game's missions, Vorticia sends waves of monsters, UFOs, mind-controlled military and earth-threatening devices at Godzilla, who must fight to defeat the enemies and find the hidden G-Cells before the UFOs can steal them. The epic battle for Earth will range across the globe in more than a dozen massive, destructible city environments, including San Francisco, Los Angeles, Tokyo, Osaka and New York. Features a variety of online multiplayer options for up to four players where gamers can smash, bash and trash opposing monsters and cities in gargantuan online melees. Player will be able to go head-to-head, three- or four-player free-for-all, or team up for two-on-two combat. Godzilla will face off against more than 18 classic Toho movie monsters, each carefully designed to recreate the authentic film look and feel. Monsters include Godzilla 2000 and 90s, King Ghidorah, Gigan, Mothra, SpaceGodzilla, Biollante and many more. [Atari]"
The King of Fighters NeoWave,fighting,https://www.metacritic.com/game/xbox/the-king-of-fighters-neowave,"KOF Neowave features 12 three-man teams made up of some of the greatest characters from SNK's 11-year history, including the Women Fighters Team (Mai, King and Yuri) and the Fatal Fury Team (Terry, Joe, and Andy). NEOWAVE features three modes of play - Super Cancel, Guard Break, and Max2. A new ""Heat Mode"" lets players power up their attacks in exchange for a gradual loss of health. Xbox Live support featuring head-to-head fighting and Tournament Mode. A total of 43 characters including 7 Bonus characters. 12 of the most dangerous fighting teams ever assembled. Pick your team and fight it out in the original 3-on-3 battle format. Beautifully rendered background graphics. Activate ""Heat Mode"" to power-up your attacks. Revives the evacuation rolling maneuver and thrust attacks. Over-the-top Super Special Moves. 3 modes of play: Super Cancel, Guard Break and Max2. Link a Special Move with a Super Attack in the Super Cancel Mode to cause extreme damage."
Saint Seiya: Sanctuary Battle,fighting,https://www.metacritic.com/game/playstation-3/saint-seiya-sanctuary-battle,"SAINT SEIYA - Sanctuary Battle immerses players in the most popular drama from Saint Seiya: the Sanctuary, as Seiya and his companions fight side by side to defeat the gold saints of the twelve palaces and protect Athena. As players complete quests and progress through the twelve levels, they can inflict tremendous damage on their foes with fast-paced Cosmo power-up attacks. [Namco Bandai UK]"
Deadpool,fighting,https://www.metacritic.com/game/xbox-360/deadpool,"Deadpool speaks: ""There are a few important things I need to say before you crack into my insanely sweet game. (Oof. Here we go again.) I'm a mercenary with an accelerated healing factor. I've been described as unstable, which is just plain coo-coo. (Wait, do sane people say coo-coo?) I'm gonna battle for the safety of humans and mutants. (And even mumans.) Be prepared for just about anything. (Holla!) • I made sure to capture all my good sides, so I made my game a third-person action-shooter. (Yep, you get to look at my heinie.) • Keep a look out cuz some of my X-Men pals (Whoa, what pals?!) are making an appearance. (Hope you don't mind picking hair out of your tacos.) • I'm really good at killing, so I made it a blast stringing together combos, and totally eviscerating my enemies. (Ev-is-cer-a-ting!) • I brought my skills and a buttload of my favorite things. Katanas (check), guns (bang!) explosives (boom), duct tape (quack) and of course, yours truly - ME! (Checkmate!)"""
WWE SmackDown vs. Raw 2008,fighting,https://www.metacritic.com/game/ds/wwe-smackdown-vs-raw-2008,"WWE SmackDown! vs. Raw 2008 lets players take the fight into their own hands with the debut of Superstar Fighting Styles. The game features eight unique styles, each having its own strategy and exclusive attributes. A brand new Struggle Submission System gives players intuitive and natural control over their WWE Superstars by using the game's popular analog controls. Realism and strategy are at the forefront, as players now control the amount of pressure they apply to their opponents. In addition, WWE SmackDown! vs. Raw 2008 features a significant Extreme Championship Wrestling (ECW) presence, including a variety of Superstars, arenas and weapons. The game is also packed with significant updates requested by fans, including new rosters, more environmental hotspots, a combined Season and General Manager Mode experience, improved out-of-ring action, enhanced online community support and much more. The Nintendo DS version of the video game offers a unique game play experience, including touch screen control over Superstars, situation-based fighting with unique holds and a full year of nonstop action in WWE Season Mode. [THQ]"
Galactic Wrestling: Featuring Ultimate Muscle,fighting,https://www.metacritic.com/game/playstation-2/galactic-wrestling-featuring-ultimate-muscle,"(Known in Japan as ""Kinniku Man Generations"") Bandai and the Aki Corporation brings you the sequel to last year's ""Ultimate Muscle: Legends Vs. New Generation"" for the GameCube. Slam your foes with outrageous super galactic moves! Pile on the mayhem, up to 4 players at a time! More than 45 wrestlers to choose from. KO the competition to unlock hidden wrestlers. 6 muscle-busting game modes including Tag Team and Battle Royal! Catch it now on the Fox Box! [Bandai]"
Acceleration of SUGURI X-Edition,fighting,https://www.metacritic.com/game/playstation-3/acceleration-of-suguri-x-edition,"In Acceleration of Suguri X Edition, players take on the role of a scorned robot to maneuver through arcade storylines and battle other robots."
Bloody Roar Extreme,fighting,https://www.metacritic.com/game/xbox/bloody-roar-extreme,"Punch, kick and smash your way to the top in the deadliest beast-warrior fighting tournament of all time! Choose one of 14 fierce fighters, and transform into its ""Hyper-Beast"" alter-ego to defeat all challengers. The action comes to life on the Xbox with high-resolution graphics and spectacular special effects running at a blazing 60 frames per second."
Gundam: Battle Assault,fighting,https://www.metacritic.com/game/playstation/gundam-battle-assault,"Gundam Battle Assault isn't a good enough game to live on its own - the fighting is competent, but hardly compelling for any length of time, and the story mode is completely uninteresting."
Dual Blades,fighting,https://www.metacritic.com/game/game-boy-advance/dual-blades,Dual Blades is better for those seeking vicarious thrills or a game that friends can play without hours of basic instruction.
One Must Fall: Battlegrounds,fighting,https://www.metacritic.com/game/pc/one-must-fall-battlegrounds,"Battlegrounds is the first on-line, 3D, multiplayer fighting game. OMF:BG represents a serious change in the philosophy of making fighting games. Instead of 2 players facing off in a small space, Battlegrounds features up to sixteen simultaneous players in huge arenas, fighting in team battles or all-out brawls! Our goal is to free you, the player, from the restrictions of the past, and allow you to fight the way you've always wanted to. Just like your favourite martial-arts movies, you can go toe-to-toe with several opponents, use nearby objects as weapons, and integrate terrain and hazards into your fighting strategy. But... We've missed an important detail: you get to do all this while piloting a huge robot. [Diversions]"
Deadpool,fighting,https://www.metacritic.com/game/playstation-3/deadpool,"Deadpool's address: ""There are a few important things I need to say before you crack into my insanely sweet game. (Oof. Here we go again.) I'm a mercenary with an accelerated healing factor. I've been described as unstable, which is just plain coo-coo. (Wait, do sane people say coo-coo?) I'm gonna battle for the safety of humans and mutants. (And even mumans.) Be prepared for just about anything. (Holla!) • I made sure to capture all my good sides, so I made my game a third-person action-shooter. (Yep, you get to look at my heinie.) • Keep a look out cuz some of my X-Men pals (Whoa, what pals?!) are making an appearance. (Hope you don't mind picking hair out of your tacos.) • I'm really good at killing, so I made it a blast stringing together combos, and totally eviscerating my enemies. (Ev-is-cer-a-ting!) • I brought my skills and a buttload of my favorite things. Katanas (check), guns (bang!) explosives (boom), duct tape (quack) and of course, yours truly - ME! (Checkmate!)"""
PowerUp Heroes,fighting,https://www.metacritic.com/game/xbox-360/powerup-heroes,"Leveraging the Kinect technology, PowerUpHeroes is the ultimate super power-infused full-body fighting game. Players control each move in combat by using their entire body to launch projectiles, dodge strikes and counter deadly attacks. Players can unleash super assaults on their opponents in a two-player cosmic showdown online. Additional modes include local two-player versus and four-player tournament."
Chaos Code,fighting,https://www.metacritic.com/game/playstation-3/chaos-code,"High speed new style 2D fighting game 'CHAOS CODE' is finally here on PlayStation3 system! Otaku fighter 'HIKARU', mysterious gothic girl 'CELIA', italian chinese chef 'BRAVO' and many more unique characters are waiting for you to join the battle! Create your own style with 'SKILL SELECT SYSTEM' and reveal the truth behind 'CHAOS CODE' before your rivals!"
X-Men: Next Dimension,fighting,https://www.metacritic.com/game/playstation-2/x-men-next-dimension,"Next Dimension plunges players into a powerful enemy's plot to rid the world of mutants. Leaving traditional arena-based fighting games in its wake, X-MEN: Next Dimension is the only console fighter that carries epic superhero showdowns across expansive 3-D levels. Players fight as 24 different X-MEN characters through interactive environments replete with combat-induced damage. [Activision]"
Capcom Fighting Evolution,fighting,https://www.metacritic.com/game/xbox/capcom-fighting-evolution,"Characters from Street Fighter and other Capcom series come together for intense two-on-two battles in Capcom Fighting Evolution. Now you can play as a diverse cast of players, as well as additional hidden characters from each of the following titles: Street Fighter II, Darkstalkers, Street Fighter III, Red Earth, and Street Fighter Alpha. Each character maintains his or her unique fighting style from his or her respective title, so players must strategically use each character's combat system to defeat an opponent."
Naruto Shippuden: Ultimate Ninja Heroes 3,fighting,https://www.metacritic.com/game/psp/naruto-shippuden-ultimate-ninja-heroes-3,"Naruto Shippuden: Ultimate Ninja Heroes 3 puts players’ fighting spirits to the test with intense and frantic battles while using one of more than 50 characters. New characters include Young Kakashi and Obito Uchiha from the Naruto Shippuden special, Kakashi Chronicles. For the first time in the series’ history, Naruto Shippuden: Ultimate Ninja Heroes 3 expands upon the series’ trademark fighting engine and updates it for four-player brawls. Team up with a partner to unleash a devastatingly powerful Jutsu team attack on opponents, or interrupt an enemy’s Ultimate Jutsu to help or hinder another player. [Namco Bandai Games]"
Naruto: Ninja Destiny,fighting,https://www.metacritic.com/game/ds/naruto-ninja-destiny,"Players can now take their ninja battles on the road with NARUTO: Ninja Destiny, the first 3D head-to-head NARUTO fighter for the Nintendo DS. Any aspiring ninja can unleash powerful jutsu and take advantage of items to brawl his way to victory against 16 different characters. Dual-screen combat will allow fierce battles to unfold on the top screen while power ups can be strategically unleashed on the touch screen for fast, frenetic action. Core fighting game fans and casual gamers alike will find plenty to enjoy, thanks to a combo move system that is both intuitive to pick-up and challenging to master. Featuring scenes, characters, and storylines from up to the 140th episode of the hit animated television series currently airing on Cartoon Network, NARUTO: Ninja Destiny offers an intense single-player story and versus mode, along with wireless multiplayer combat. [Tomy]"
The King of Fighters Collection: The Orochi Saga,fighting,https://www.metacritic.com/game/psp/the-king-of-fighters-collection-the-orochi-saga,"The first ever collection of THE KING OF FIGHTERS, consisting of 5 complete games. KOF 94, 95, 96, 97, 98. [SNK Playmore]"
Rave Master,fighting,https://www.metacritic.com/game/gamecube/rave-master,"Now you can fight as your favorite character from Rave Master, the animated series. In Rave Master, you must defeat your enemies with your arsenal of weapons, attack combos, and special moves. The game features single-player challenges, a story edit mode, and a four-player versus mode. Immerse yourself in the visual and audio effects taken directly from the animated show."
Guilty Gear Dust Strikers,fighting,https://www.metacritic.com/game/ds/guilty-gear-dust-strikers,"The no holds barred, sci-fi fighting franchise is reborn on the Nintendo DS. Guilty Gear Dust Strikers features all 21 Guilty Gear characters from previous versions (including SolBadbuy, Potemkin, May, Dizzy and others) in a battle that takes place on multiple levels across both DS screens. Navigate different types of floors and traps as you battle against the computer or via wireless multi-player connections. 6 modes of play including Arcade, Story, VS Battle and mini games. Customize the Robo-Ky character with various move sets in the Robo-Ky factory mode. Battle your friends in 4-player wireless versus matches where the last person standing moves on. Master 10 mini-games like Billiards, Arm-Wrestling and Sword Practice that unlock more Robo-Ky moves. Beware of poison, fire, thunder and bomb traps set to damage unaware opponents. Special moves like Psych Burst, Dust Attack and Roman Cancel all return in Guilty Gear Dust Strikers. [Majesco]"
Medabots AX: Metabee Ver.,fighting,https://www.metacritic.com/game/game-boy-advance/medabots-ax-metabee-ver,Every four years the greatest Medafighters around the world come together for the World Robattle Tournament. Join Ikki and Metabee as they take on the toughest Medafighters and their Medabots to prove who is the best of the best! But beware...rumor has it the menacing band of crooks known as the Rubberobo Gang is out to steal the prize!
WarTech: Senko no Ronde,fighting,https://www.metacritic.com/game/xbox-360/wartech-senko-no-ronde,"WarTech: Senko no Ronde thrusts the player into a distant future where humanity has colonized countless new galaxies and Earth has become a planet mined for its natural resources. A violent war has erupted as nations struggle for world domination. Rounder Mechs fill the skies as the fate of the world is determined through aerial combat. Fast Paced Arcade Fighting - Combine an almost limitless arsenal of special moves, power ups, and attack drones to unleash the most lethal combos. Challenge friends in head-to-head two-player or battle against the world's best players online and test your skills to improve your Xbox LIVE ranking. Choice of Rounder Mech Suits – Each of the eight Rounder Mechs feature two distinct variations, as well as an unlockable in-game B.O.S.S. mode, for 24 variations in all. Go blow-for-blow against the other Rounder Mechs, but be prepared, because at any moment you could find yourself battling an even deadlier enemy. [Ubisoft]"
Dragon Ball: Raging Blast 2,fighting,https://www.metacritic.com/game/playstation-3/dragon-ball-raging-blast-2,"Dragon Ball Z fans can rest assured that the destructible environment, and character trademark attacks and transformations will be true to the series. These include signature Pursuit Attacks which enable players to initiate attack combo strings, juggling your opponent in a string of devastating strikes throughout the environment. Additionally, Dragon Ball: Raging Blast 2 will sport the new Raging Soul System which enables characters to reach a special state, increasing their combat abilities to the ultimate level. Sporting more than 90 characters, 20 of which are brand new to the Raging Blast series, new modes, and additional environmental effects, Dragon Ball: Raging Blast 2 is the next evolution in the home console series."
Legends of Wrestling II,fighting,https://www.metacritic.com/game/gamecube/legends-of-wrestling-ii,"Legends of Wrestling II takes you through the wrestling hall of fame with the top grapplers that are battling for squared-circle supremacy. Play as your favorite wrestler--including Hulk Hogan, Andre ""The Giant,"" and Bret ""Hitman"" Hart--each with signature entrances, taunts, and moves. A new storyline and career mode let you battle for the respect of promoters and fans while fighting for the heavyweight championship crown. The game also features tag-team tournaments, a $15,000 Body Slam Challenge, and a variety of match types."
WWE SmackDown vs. Raw 2008,fighting,https://www.metacritic.com/game/wii/wwe-smackdown-vs-raw-2008,"WWE SmackDown! vs. Raw 2008 lets players take the fight into their own hands with the debut of Superstar Fighting Styles. The game features eight unique styles, each having its own strategy and exclusive attributes. A brand new Struggle Submission System gives players intuitive and natural control over their WWE Superstars by using the game's popular analog controls. Realism and strategy are at the forefront, as players now control the amount of pressure they apply to their opponents. In addition, WWE SmackDown! vs. Raw 2008 features a significant Extreme Championship Wrestling (ECW) presence, including a variety of Superstars, arenas and weapons. The game is also packed with significant updates requested by fans, including new rosters, more environmental hotspots, a combined Season and General Manager Mode experience, improved out-of-ring action, enhanced online community support and much more. [THQ]"
Legends of Wrestling II,fighting,https://www.metacritic.com/game/playstation-2/legends-of-wrestling-ii,"Features over 65 of the greatest ring warriors ever including the icon Hulk Hogan, Andre ""The Giant"", Rowdy Roddy Piper, Bruno Sammartino, Bret ""Hitman"" Hart, Sid Vicious, ""Big Poppa Pump"" Scott Steiner, Jerry ""The King"" Lawler, and many more! Cranium-crushing match types, such as 6- and 8-man Elimination Bouts, Cage, Battle Royal, Ladder, Table and 3- and 4-way dances. Never-before-seen $15,000 Body Slam Challenge with Big John Studd. [Acclaim]"
