title,genre,url,summary
Virtual-On: Oratorio Tangram Ver.5.66,fighting,https://www.metacritic.com/game/xbox-360/virtual-on-oratorio-tangram-ver566,"[Xbox Live Arcade; Also known as ""Virtual On""] The arcade classic CYBER TROOPERS VIRTUAL-ON ORATORIO TANGRAM comes to Xbox LIVE Arcade! Keeping the classic mech fighting style, Virtual-On returns enhanced with intense HD graphics and a thrilling 1-on-1 online multiplayer battle mode. Giant mechs: Enjoy all the thrills of the classic arcade mech fighter in the comforts of your home on Xbox LIVE Arcade. Full roster: Choose from 15 playable Virtuaroids, each highly stylized with unique characterstics and moves. Multiplayer: Online multiplayer mode allows players to battle head-to-head with friends from around the world. Fast action: Fast visceral action is heightened by the intense HD graphics. Customization: The unique ""color editing"" feature lets you customize your Virtuaroid in the style of your choice. [Sega]"
Godzilla: Destroy All Monsters Melee,fighting,https://www.metacritic.com/game/gamecube/godzilla-destroy-all-monsters-melee,"Legendary monsters battle among Earth's cities to determine the planet's fate. In Godzilla: Destroy All Monsters Melee, you can play as Godzilla or any of his longtime rivals as they fight hand-to-hand, at close range, and with special moves. Each massive beast has different physical attributes and special projectile weapons. You'll fight in cities such as Tokyo and San Francisco--all featuring real building destruction and physics. For multiplayer fighting mayhem, you can bring three of your friends into the battle."
Dragon Ball Z: Budokai Tenkaichi 2,fighting,https://www.metacritic.com/game/playstation-2/dragon-ball-z-budokai-tenkaichi-2,"Combining action, fighting and light role-playing game elements, Dragon Ball Z: Budokai Tenkaichi 2 sends players into a rich story mode that spans the entire Dragon Ball, DBZ, and Dragon Ball GT series. The game takes the acrobatic and intense 3D flying and fighting dynamic made popular in the first game and takes it to a new level with over 100 playable characters, 15 vast and vibrant 3D destructible environments, and nine different game modes, including intense single and multiplayer battles. Team up with Z-Warriors to complete exciting missions, ripped right from the TV show (the player can play with two warriors while in battle, and can switch warriors during the battle). Over 100 DBZ warriors, including many that have never been seen in previous DBZ games. Improved camera system, explosive environmental damage, and in-game transformations. The complete DBZ mythology, from Dragon Ball To Dragon Ball GT. Post customizable character codes to the Internet. [Atari]"
WWE Road to WrestleMania X8,fighting,https://www.metacritic.com/game/game-boy-advance/wwe-road-to-wrestlemania-x8,"If you like the WWE, you'll probably enjoy WWE Road to WrestleMania X8."
Divekick,fighting,https://www.metacritic.com/game/pc/divekick,"DIVEKICK is a game of intense depth, strategy, and action have all been packed into just two buttons."
Fire Pro Wrestling 2,fighting,https://www.metacritic.com/game/game-boy-advance/fire-pro-wrestling-2,"If you've never tried the Fire Pro series and you're someone who enjoys fighting or wrestling games, you really owe it to yourself to experience Fire Pro Wrestling 2."
WWE SmackDown vs. Raw 2009,fighting,https://www.metacritic.com/game/psp/wwe-smackdown-vs-raw-2009,"WWE SmackDown vs. Raw 2009 upholds the franchise’s commitment to delivering the definitive videogame simulation of live WWE programming. The Xbox 360, PLAYSTATION 3 system, PlayStation 2 system and PSP system versions of the game unleash a brand new tag team experience, allowing players to build momentum and attributes, eliminate opponents with high impact double teams and finishers, as well as get the “hot tag” for the win. The franchise's renowned creation system offers a brand new Create-A-Finisher option, while a new Road to WrestleMania Mode paves the way to WWE’s biggest event of the year and lets players experience co-op storylines for the first time. WWE SmackDown vs. Raw 2009 also extends the virtual WWE gameplay experience with robust online capabilities, including the highly anticipated debut of downloadable content. [THQ]"
Marvel vs. Capcom Origins,fighting,https://www.metacritic.com/game/playstation-3/marvel-vs-capcom-origins,"MARVEL VS. CAPCOM ORIGINS offers both the one-on-one gameplay of Marvel Super Heroes with its unique Infinity Gem system and the two-on-two carnage of the original Marvel vs. Capcom: Clash of Super Heroes, featuring a tag system, assists, and the wild Duo Team Attack. Bringing forth a host of features never before seen in these games, MARVEL VS. CAPCOM ORIGINS features GGPO-enhanced online play with 8-player lobbies and spectator mode, HD graphical upgrades, dynamic challenges and replay saving."
Samurai Shodown II,fighting,https://www.metacritic.com/game/xbox-360/samurai-shodown-ii,"[Xbox Live Arcade] The classic fighting game Samurai Shodown II comes to Xbox Live Arcade in all its action-packed glory. Haohmaru is attacked by a sinister assailant. This would-be assassin has been clearly manipulated by an evil force, and promises with his last breath to own Haohmaru's soul. Haohmaru's mentor and fencing master insists that Haohmaru stay away from the evil forces and avoid confrontation, but this he cannot do. The two share a few drinks to celebrate their reunion after a long separation, but at dawn, Haohmaru slips out unannounced to embark on his journey. An audacious smile plays on his lips. New fighting techniques: Learn to parry, roll, duck, and hop. Sixteen unique playable characters are included. Choose your favorite and rise to the top. [Microsoft]"
Naruto: Clash of Ninja Revolution 2,fighting,https://www.metacritic.com/game/wii/naruto-clash-of-ninja-revolution-2,"NARUTO: Clash of Ninja Revolution 2 provides players with quality fighting game mechanics and a fast-paced gameplay experience on Wii. Set after Sasuke leaves the Leaf Village to gain more power from Orochimaru, the title offers a slew of playable characters, including those developed especially for the storyline. Clash of Ninja Revolution 2 features destructible stages and four-player multiplayer battles, along with gameplay modes and characters not yet seen on the Clash of Ninja series. [D3Publisher]"
Dragon Ball Z: Budokai Tenkaichi 2,fighting,https://www.metacritic.com/game/wii/dragon-ball-z-budokai-tenkaichi-2,"Combining action, fighting and light role-playing game elements, Dragon Ball Z: Budokai Tenkaichi 2 sends players into a rich story mode that spans the entire Dragon Ball, DBZ, and Dragon Ball GT series. The game takes the acrobatic and intense 3D flying and fighting dynamic made popular in the first game and takes it to a new level with over 100 playable characters, 15 vast and vibrant 3D destructible environments, and nine different game modes, including intense single and multiplayer battles. Team up with Z-Warriors to complete exciting missions, ripped right from the TV show (the player can play with two warriors while in battle, and can switch warriors during the battle). Over 100 DBZ warriors, including many that have never been seen in previous DBZ games. Improved camera system, explosive environmental damage, and in-game transformations. The complete DBZ mythology, from Dragon Ball To Dragon Ball GT. Post customizable character codes to the Internet. [Atari]"
Super Dragon Ball Z,fighting,https://www.metacritic.com/game/playstation-2/super-dragon-ball-z,"From the producer of the acclaimed Street Fighter II game comes Super DBZ, a new, highly intense DBZ fighting experience unlike any other Dragon Ball Z game. Super DBZ features an all new DBZ fighting system plus intense combos for super damage. With multiple unique special attacks and fighting styles for all 18 characters, Super DBZ gives players a more hard-core 3D fighting experience in the air or on the ground, complete with enough super-fast combination moves and dynamic battle scenes to satisfy any DBZ buff. [Atari]"
WWE SmackDown vs. Raw 2011,fighting,https://www.metacritic.com/game/wii/wwe-smackdown-vs-raw-2011,"WWE SmackDown vs. Raw 2011 will empower players more than ever to to define their gameplay experiences in a dynamic and ever-changing WWE. Along the way, gameplay scenarios will change based on player decisions, allowing for more spontaneous WWE action in and out of the ring. Players will also enjoy a greater level of interactivity and have increased control of their destinies in the game's popular Road to WrestleMania story-driven mode."
Mortal Kombat vs. DC Universe,fighting,https://www.metacritic.com/game/xbox-360/mortal-kombat-vs-dc-universe,"For the first time ever Scorpion, Sub-Zero and the Mortal Kombat warriors battle with Batman, Superman and other popular DC Universe Super Heroes. Choose your side and challenge your opponents with a new fighting system including Freefall Kombat and Klose Kombat along with dynamic multi-tiered environments. Plus, pick your favorite character from MK or DCU and pursue a fighting adventure in the new single player mode with an intertwined storyline and two unique perspectives. [Midway]"
Dragon Ball Z: Burst Limit,fighting,https://www.metacritic.com/game/xbox-360/dragon-ball-z-burst-limit,"Dragon Ball Z: Burst Limit is the first game of the Dragonball Z series to hit the next generation consoles. During each battle, find conditions to create new dramatic scenes. After the battles, watch a unique story unfold each time you play. There is also a stronger element of offence and defence, due to added energy saving and fighting techniques. Competition grows with the ability to play online in both the co-op and vs. modes. During each battle, find conditions to create new scenes and watch a unique story unfold at the end of each game. Experience visuals and movement reminiscent of the anime due to Z3 shading technology and detailed effects. Increased speed of charge and release on the field, free movement around the field, and increased speed and power of attacks. Use of special skills will no longer drain energy. The lower your energy, the stronger you get, making for a possible turnaround of the battle. Each character in the game has his own ""Fatal Blow"". If the player successfully attacks his opponent, this would be a finishing move, but if not, it will put the player in the disadvantageous situation, and he must battle with no Fatal Blow for the rest of the battle. [Atari]"
Dragon Ball Z: Budokai Tenkaichi 3,fighting,https://www.metacritic.com/game/wii/dragon-ball-z-budokai-tenkaichi-3,"Dragon Ball Z: Budokai Tenkaichi 3 delivers an extreme 3D fighting experience, improving upon last year's game with over 150 playable characters, enhanced fighting techniques, beautifully refined effects and shading techniques, making each character's effects more realistic, and over 20 battle stages. In addition, an improved control system for the Wii will allow players to easily mimic signature moves and execute devastating energy attacks as they are performed in the Dragon Ball Z animated series. In addition to the unprecedented number of characters and improved Wii control system, the environments have also been enhanced to feature day and night stages. The power of the moon in the night stages gives players additional ways to transform their characters and lets fans recreate some of their favorite memories from the show. [Atari]"
WWE '12,fighting,https://www.metacritic.com/game/playstation-3/wwe-12,WWE '12 is the next iteration in this wrestling series with Smackdown vs Raw being no more.
Naruto: Clash of Ninja,fighting,https://www.metacritic.com/game/gamecube/naruto-clash-of-ninja,"Naruto: Clash of Ninja is a 3D fighting game based on the Japanese manga, Naruto. Take control of your favorite Naruto characters, including Naruto, Sasuke, Sakura, and more as you battle it out to determine who the greatest ninja is. Cel-shaded graphics parallel the style set forth in the cartoon, while special character-specific moves add to the feeling of authenticity."
Fate/Unlimited Codes,fighting,https://www.metacritic.com/game/psp/fateunlimited-codes,[Playstation Network] Fate/Unlimited Codes is a 3D fighting game based on the visual novel Fate/stay night.
X-Men: Mutant Academy 2,fighting,https://www.metacritic.com/game/playstation/x-men-mutant-academy-2,"Train with Professor X to unleash your super-powers and polish your combat skills. Master all-new, over-the-top moves-including aerial combat-as you fight through the ranks of mutants and prove you have what it takes to earn X-MEN status. Plus, get a behind-the-scenes look at X-MEN the Movie concept sketches, costumes and more!"
Dragon Ball Z: Budokai Tenkaichi,fighting,https://www.metacritic.com/game/playstation-2/dragon-ball-z-budokai-tenkaichi,"Everything before it was just training. Dragon Ball Z: Budokai Tenkaichi combines fighting and flying in wide open, destructible 3D environments. In the air, on the ground or under water, DBZ Budokai Tenkaichi gives players the ability to battle with unprecedented power and freedom. Experience the intensity of DBZ fighting in an all-new way by combining melee combat, energy attacks and 3D flight with fully interactive recreation of the Dragon Ball universe. With its intense battles, high-speed flight and deep storyline, DBZ Budokai Tenkaichi offers players a ""superhero"" experience of epic proportions - it's the DBZ game fans have been waiting for. [Atari]"
Mortal Kombat II,fighting,https://www.metacritic.com/game/playstation-3/mortal-kombat-ii,"[Downloadable Game] Get Over Here! Come re-live all the fatalities that made Mortal Kombat II a classic. Brought back and available for download on the PS3, play as 1 of 12 characters as you venture through realms, such as The Dead Pool, Kombat Tomb or Kahn's Lair. Battle all of your favorite villains such as Shao Kahn or Shang Tsung and unlock hidden characters including Noob Saibot. Decide your enemies' fate with three different special endings and prepare to Finish Him! [Sony Online Entertainment]"
The King of Fighters '97,fighting,https://www.metacritic.com/game/ios/the-king-of-fighters-97,"Revisit this fighting gem, by playing one of its legendary (and sometimes hidden) teams, and behold the numerous endings the game has to offer! Put an end to the evil Orochi's resurrection scheme, and finally settle the score between Kyo Kusanagi and Iori Yagami!"
Mortal Kombat: Armageddon,fighting,https://www.metacritic.com/game/wii/mortal-kombat-armageddon,"Exclusive to the Wii: Players can take their fighting action to a whole new level with all special moves and fatalities executed via the Wii-mote. In addition, not only can gamers enjoy all aspects of Armageddon with the Wii-mote, but the GameCube and Classic Controller as well. Appearing for the first time on consoles, Armageddon features an enhanced Endurance Mode, allowing gamers to test their true fighting stamina. Select from more than 60 characters from the Entire Mortal Kombat Fighting Universe: From Liu Kang to Shang Tsung to Shao Kahn, Mortal Kombat: Armageddon features more playable fighters than any other Mortal Kombat game to date. For the first time in a Mortal Kombat game players can use a Kreate-A-Fighter feature to create and define their fighter's look, abilities and personality with a deep level of customization and take that unique fighter online. Fans now have the ability to create their own custom fatalities by stringing together a series of attacks via a series of button combos; those that prove worthy can take their very own death moves online to showcase to the world. [Midway]"
Godzilla: Destroy All Monsters Melee,fighting,https://www.metacritic.com/game/xbox/godzilla-destroy-all-monsters-melee,"Legendary monsters battle among Earth's cities to determine the planet's fate. In Godzilla: Destroy All Monsters Melee, you can play as Godzilla or any of his longtime rivals as they fight hand-to-hand, at close range, and with special moves. Each massive beast has different physical attributes and special projectile weapons. You'll fight in cities such as Tokyo and San Francisco--all featuring real building destruction and physics. For multiplayer fighting mayhem, you can bring three of your friends into the battle."
Dragon Ball Z: Burst Limit,fighting,https://www.metacritic.com/game/playstation-3/dragon-ball-z-burst-limit,"Dragon Ball Z: Burst Limit is the first game of the Dragonball Z series to hit the next generation consoles. During each battle, find conditions to create new dramatic scenes. After the battles, watch a unique story unfold each time you play. There is also a stronger element of offence and defence, due to added energy saving and fighting techniques. Competition grows with the ability to play online in both the co-op and vs. modes. During each battle, find conditions to create new scenes and watch a unique story unfold at the end of each game. Experience visuals and movement reminiscent of the anime due to Z3 shading technology and detailed effects. Increased speed of charge and release on the field, free movement around the field, and increased speed and power of attacks. Use of special skills will no longer drain energy. The lower your energy, the stronger you get, making for a possible turnaround of the battle. Each character in the game has his own ""Fatal Blow"". If the player successfully attacks his opponent, this would be a finishing move, but if not, it will put the player in the disadvantageous situation, and he must battle with no Fatal Blow for the rest of the battle. [Atari]"
WWE '12,fighting,https://www.metacritic.com/game/xbox-360/wwe-12,WWE '12 is the next iteration in this wrestling series with Smackdown vs Raw being no more.
WWE Legends of WrestleMania,fighting,https://www.metacritic.com/game/xbox-360/wwe-legends-of-wrestlemania,"WWE Legends of WrestleMania embraces the leading sports entertainment organization's rich history to relive, rewrite or recreate the definitive elements of WWE from the Eighties and Nineties. Players relive the entertaining lives of more than 40 larger-than-life Legends and have control over Legendary Managers, each of whom play crucial roles in match outcomes. The game's new grapple-based fighting system captures the high-energy action and drama seen in vintage WWE matches, while a historically accurate representation of past WWE telecasts sets the stage, including dynamic visual treatments, signature ring entrances, renowned commentators and notable venues. WWE Legends of WrestleMania also includes a WrestleMania Tour Mode that allows players to participate in key matches from multiple WrestleMania events, a Create-A-Legend system to develop the Legends of tomorrow, as well as online functionality for players to compete on the biggest stages in WWE history. [THQ]"
Fighting Vipers,fighting,https://www.metacritic.com/game/xbox-360/fighting-vipers,"Fight with pieces of flair in the return of Fighting Vipers, the classic arcade game from AM2 that was later playable on the Sega Saturn. Choose one of 9 crazy characters--including Grace the roller blader and Raxel the metal guitarist-- and break your opponent's costume-based armor to inflict maximum damage. Take advantage of all-new online modes to battle friends across the world. Features include: True to its arcade form with all-new online modes All 9 original characters, each with their own unique costume and hobby Enclosed arenas, enabling special wall attacks Online versus mode for head-to-head matches Online Room match mode for up to six players."
WWE SmackDown vs. Raw 2008,fighting,https://www.metacritic.com/game/playstation-2/wwe-smackdown-vs-raw-2008,"WWE SmackDown! vs. Raw 2008 lets players take the fight into their own hands with the debut of Superstar Fighting Styles. The game features eight unique styles, each having its own strategy and exclusive attributes. A brand new Struggle Submission System gives players intuitive and natural control over their WWE Superstars by using the game's popular analog controls. Realism and strategy are at the forefront, as players now control the amount of pressure they apply to their opponents. In addition, WWE SmackDown! vs. Raw 2008 features a significant Extreme Championship Wrestling (ECW) presence, including a variety of Superstars, arenas and weapons. The game is also packed with significant updates requested by fans, including new rosters, more environmental hotspots, a combined Season and General Manager Mode experience, improved out-of-ring action, enhanced online community support and much more. [THQ]"
Bloody Roar 3,fighting,https://www.metacritic.com/game/playstation-2/bloody-roar-3,"Take control of one of 14 ""werebeasts"" (i.e., werewolf, wereleopard, werebunny, and the mythic weremole!) in this 3D fighter and attempt to punch, kick, and tear the living guts out of your opponents."
Shrek: Hassle at the Castle,fighting,https://www.metacritic.com/game/game-boy-advance/shrek-hassle-at-the-castle,
WWE All Stars,fighting,https://www.metacritic.com/game/3ds/wwe-all-stars,"WWE All Stars will deliver one of the greatest rosters ever assembled in a wrestling-centric videogame. Renowned WWE Legends will align with today's most prominent Superstars, inviting players to generate fantasy matches and ultimately determine the greatest competitors of all time. In addition, each Legend and Superstar will boast a distinctive and highly stylized appearance, adding to the overall atmosphere and intrepid attitude exuding from the on-screen action."
Digimon Rumble Arena 2,fighting,https://www.metacritic.com/game/gamecube/digimon-rumble-arena-2,"Digimon Rumble Arena 2 lets you play as and against your favorite Digimon characters. The game features all the popular Digimon from all four seasons of the TV show, plus secret Digimon. Each Digimon has a signature move that can earn Digipoints and, with enough Digipoints, you can Digivolve and destroy your opponents. In locations ranging from icy glaciers to fields of fire, you can conquer the Digimon in single-player mode or compete against three of your friends in multiplayer brawls."
Draglade,fighting,https://www.metacritic.com/game/ds/draglade,"In Draglade, it's not just about how hard you hit or fast you move, it's also how well you can groove. An innovative mix of music and fighting means you will have to use your rhythm as well as your reflexes if you want to overcome your foes and show everyone that you’re a Draglade master. In the world of Draglade, Grapping has become the world's premier spectator sport. Scientists will discover how to turn atmospheric Matter into energy. Soon thereafter, a means of harnessing this energy – G-Cons – will allow for the conversion of this power into a weapon called a ""Glade"". When a Glade hits something, the Glade emits a sound. Fighters and entertainers quickly realized the potential of Grapping, as the music generated by the clashing Glades in combat provided an experience that couldn't be matched in any other sport. In this world overcome by Grapping fever, four young indie Grappers – Hibito, Guy, Kyle, and Daichi – will strive to reach the ranks of the Major Grappers. [Atlus USA]"
Battle Fantasia,fighting,https://www.metacritic.com/game/xbox-360/battle-fantasia,An all new fighting game from the creators of the Guilty Gear Series. Challenge the best fighters from around the world via Xbox Live. Unleash deadly combinations with Heat Up mode and turn the tide with the GACHI battle mechanic. Experience Battle Fantasia's world through the eyes of twelve different characters.
WWE SmackDown vs. Raw 2008,fighting,https://www.metacritic.com/game/xbox-360/wwe-smackdown-vs-raw-2008,"WWE SmackDown! vs. Raw 2008 lets players take the fight into their own hands with the debut of Superstar Fighting Styles. The game features eight unique styles, each having its own strategy and exclusive attributes. A brand new Struggle Submission System gives players intuitive and natural control over their WWE Superstars by using the game's popular analog controls. Realism and strategy are at the forefront, as players now control the amount of pressure they apply to their opponents. In addition, WWE SmackDown! vs. Raw 2008 features a significant Extreme Championship Wrestling (ECW) presence, including a variety of Superstars, arenas and weapons. The game is also packed with significant updates requested by fans, including new rosters, more environmental hotspots, a combined Season and General Manager Mode experience, improved out-of-ring action, enhanced online community support and much more. [THQ]"
JoJo's Bizarre Adventure: All-Star Battle,fighting,https://www.metacritic.com/game/playstation-3/jojos-bizarre-adventure-all-star-battle,JoJo's Bizarre Adventure: All-Star Battle gives players the feeling that they are participating in vivid and colorful battles straight from the pages of the manga.
Ultimate Muscle: The Kinnikuman Legacy - The Path of the Superhero,fighting,https://www.metacritic.com/game/game-boy-advance/ultimate-muscle-the-kinnikuman-legacy---the-path-of-the-superhero,"His unwilling arrival on Earth comes conspicuously close to the legendary Muscle League Champions' embarrassing beating at the hands of the d.M.p, a devious new breed of evil wrestling super villains. The Muscle League has recruited King Muscle's own son to reinvigorate their falling fortunes! And they've enlisted and trained a whole new generation of heroes to take on the diabolical d.M.p and save the planet!!"
Divekick,fighting,https://www.metacritic.com/game/playstation-vita/divekick,"Divekick revolves around two characters, Dive and Kick, where the action is controlled by two buttons, dive and kick."
