title,genre,url,summary
Injustice: Gods Among Us - Ultimate Edition,fighting,https://www.metacritic.com/game/pc/injustice-gods-among-us---ultimate-edition,"What if our greatest heroes became our greatest threat? Injustice: Gods Among Us Ultimate Edition features DC Comics icons such Batman, Cyborg, The Flash, Harley Quinn, Nightwing, Solomon Grundy, Superman and Wonder Woman, in a dark tale of power and corruption. Heroes and villains engage in epic battles on a massive scale in a world where the line between good and evil has been blurred."
Mortal Kombat: Deadly Alliance,fighting,https://www.metacritic.com/game/playstation-2/mortal-kombat-deadly-alliance,"Deadly Alliance features a completely new fighting system. Each warrior has three unique fighting styles including hand-to-hand and deadly-weapon combat adding a whole new strategy to Mortal Kombat fighting. Full 3D movement with extremely realistic fighting effects are included, with ripped clothing, bruises, sweat-dripping and blood. Brutal Fatalities are back with gruesome and bloody detail first time seen on next-generation systems. Character-specific ""special attacks"" such as Scorpion's deadly spear move are also here. Over 20 new and old favorite characters . Returning: Johnny Cage, Kung Lao, Raiden, Sonya, Scorpion and more. New: Female Sub-Zero, Moloch, Mavado and more. [Midway]"
BlazBlue: Continuum Shift Extend,fighting,https://www.metacritic.com/game/xbox-360/blazblue-continuum-shift-extend,"With the devious all new playable character Relius Clover, new story scenarios, new gameplay modes, and competitively balanced action, BlazBlue: Continuum Shift EXTEND makes a grand return."
Tekken 6,fighting,https://www.metacritic.com/game/playstation-3/tekken-6,"Spanning over a 14 year legacy, Tekken is among the most popular and well-known gaming brands in the world with the entire franchise selling more than 32 million units to date. Displayed in HD detail, a new era begins in the sixth King of the Iron Fist Tournament complete with intense gameplay modes as well as new features and environments. TEKKEN 6 sees the return of many familiar faces as well as new characters to create the largest line-up the series has ever seen. With a growing roster of fighters, each equipped with their own deadly techniques, moves and attack combinations, TEKKEN 6 will be the best King of Iron Fist Tournament yet. Adding to the already rich gaming experience, a deeper character customization feature will only further enhance the incredible fighting intensity as players go mano-y-mano. Players can also take the battle online for classic match-ups and to compete for world domination. [Namco Bandai Games]"
Dissidia: Final Fantasy,fighting,https://www.metacritic.com/game/psp/dissidia-final-fantasy,"Cosmos, the goddess of harmony. Chaos, the god of discord. Reigning from distant realms, the two gods had gathered warriors from all lands to lead them in savage war. Cosmos and Chaos were of equal strength. It was believed the conflict would last forever. However, the balance is now broken. Those who answered Chaos's call created an inexhaustible force. And under vicious attack without relent, the warriors fighting for Cosmos started to fall one by one. The conflict that has continued for eons is now about to end in Chaos's favor. The world has been torn asunder, sinking into a vortex of disorder. As for the few surviving warriors… their fates have yet to be determined. All-new battle system: Action-based battle system combines all-out brawling alongside RPG-based character development in an original system developed by the creators of the KINGDOM HEARTS series. Ultimate cast of characters: Fan-favorite heroes and villains from the entire FINAL FANTASY series come together in one game for the first time in a remarkable new tale with fully-voiced CG movies and real-time events. Fantasy match: Players select their favorite FINAL FANTASY characters, sided with either Cosmos or Chaos, to set the stage for their fantasy match. Series staple battle features: Accessible through “EX Burst”, players can experience gameplay faithful to the originals through memorable battle features such as ""Limit Break"" and ""Overdrive"". In addition, longtime fans of the series can enjoy the ability to summon Aeons and options such as the “command battle” system. Community: Continue the experience by trading Friend Cards, creating items and sharing AI characters with other players and even engage in virtual AI battles made possible by the PSP system ad hoc mode. [Square Enix]"
WWE Day of Reckoning,fighting,https://www.metacritic.com/game/gamecube/wwe-day-of-reckoning,"Hit the ropes against WWE's top superstars in WWE Day of Reckoning, which features an all-new story mode filled with deception and betrayal. As your own created wrestler, you can rise up the ranks from the ""minor leagues"" of sports entertainment all the way to prime-time WWE programming. You can choose your favorite WWE Divas and go head-to-head in a Bra & Panties match. Each wrestling star, including Legends, can target specific body parts to wear down opponents."
Def Jam: Fight for NY: The Takeover,fighting,https://www.metacritic.com/game/psp/def-jam-fight-for-ny-the-takeover,"Def Jam Fight for NY: The Takeover, the prequel to ""Def Jam Vendetta,"" let's you experience the ultimate hip hop fighting game anywhere you go. Playing as the hottest artists and celebrities in Hip Hop including Busta Rhymes, Carmen Electra, Lil' Kim, Ludacris, Method Man, Redman, Snoop Dogg, and Xzibit, you'll be able to unravel the events that lead to Def Jam Vendetta and find out how D-Mob got to rule NYC. Featuring new fighting moves and new venues, where players can gain respect by winning fights and rising among the ranks of the crew. Players can create their own fighter with gear from Def Jam University, Phat Farm, Brand Jordan, Ecko Unlimited, Enyce, Rocawear, Sean John, State Property, Reebok, and more. For the first time ever players can battle in 1-on-1 death matches using PSP's wireless functionality. [Electronic Arts]"
Ultimate Marvel vs. Capcom 3,fighting,https://www.metacritic.com/game/xbox-360/ultimate-marvel-vs-capcom-3,Ultimate Marvel vs. Capcom 3 adds 12 new characters to the roster as well as adding a Spectator mode for fans to watch players fight.
Tekken 4,fighting,https://www.metacritic.com/game/playstation-2/tekken-4,"Tekken 4 marks the return of Namco's premier fighting franchise. Tekken strikes back with new jaw-dropping graphics, game play mechanics, and fearsome fighters. Newcomers engage old favorites in interactive, multi-leveled arenas. New strategies in fighting are introduced with the addition of walls, terrain effects, position changes, and enhanced side-stepping. Expanded game modes such as Training, Team Battle and the new Tekken Force provide the player with a deeper game play experience. [Namco]"
WWE SmackDown vs. Raw 2009,fighting,https://www.metacritic.com/game/wii/wwe-smackdown-vs-raw-2009,"WWE SmackDown vs. Raw 2009 for Wii builds upon its inaugural offering by significantly expanding its match type options, giving players more ways to enjoy the platform's unique pick-up-and-play experience. The game also takes full combat sports entertainment to the next level by giving players more Superstar control with interactive entrances and victory scenes. WWE SmackDown vs. Raw 2009 for Wii also includes a wide variety of new weapons, the debut of online gameplay and much more. [THQ]"
Guilty Gear X,fighting,https://www.metacritic.com/game/playstation-2/guilty-gear-x,"A beautiful high-resolution 2D fighter featuring 14 wildly different combatants and an odd variety of weapons that redefine the term ""unconventional."""
Street Fighter X Tekken,fighting,https://www.metacritic.com/game/pc/street-fighter-x-tekken,"""Street Fighter"" is best known for its well-polished 2D game play, and ""Street Fighter IV"" is an exemplary addition to the series. And now, based on the ""Street Fighter IV"" engine, the ""TEKKEN"" characters will be stepping into the ring to fight. Featuring two on two ""Tag Team Fighting"", and together with Battle and Training Modes, this title will push the series beyond its limits."
Super Smash Bros.,fighting,https://www.metacritic.com/game/nintendo-64/super-smash-bros,"It's a Bumpin', Bruisin', Brawlin' Bash! The many worlds of Nintendo collide in the ultimate showdown of strength and skill! Up to four players can choose their favorite characters - complete with signature attacks - and go at it in Team Battles and Free-For-Alls. Or venture out on your own to conquer the 14 stages in single-player mode. Either way, Super Smash Bros. is a no-holds-barred action-fest that will keep you coming back for more!"
WWE SmackDown vs. Raw 2010,fighting,https://www.metacritic.com/game/wii/wwe-smackdown-vs-raw-2010,"Featuring unparalleled creation tools, a robust Superstar roster, key franchise improvements and a few surprises, WWE SmackDown vs. Raw 2010 delivers the empowering freedom to create, customize and share gameplay experiences. It’s the player’s world now. [THQ]"
WWE '13,fighting,https://www.metacritic.com/game/xbox-360/wwe-13,"WWE '13 features the franchise's Creation Suite, enabling players to develop and customize Superstars, entrances, arenas, finishing moves, storylines, highlight reels and more, as well as share and download creations with others from around the world. Furthermore, they compete with an array of WWE Superstars and Attitude Era luminaries from a large roster, including cover Superstar CM Punk, Stone Cold Steve Austin, Sheamus, Undertaker, Mankind, Chris Jericho, Big Show and Mark Henry."
Super Street Fighter IV: Arcade Edition,fighting,https://www.metacritic.com/game/xbox-360/super-street-fighter-iv-arcade-edition,"Super Street Fighter IV Arcade Edition features a roster of 39 characters, with 4 new characters added."
WWE SmackDown vs. Raw 2009,fighting,https://www.metacritic.com/game/playstation-3/wwe-smackdown-vs-raw-2009,"WWE SmackDown vs. Raw 2009 upholds the franchise’s commitment to delivering the definitive videogame simulation of live WWE programming. The Xbox 360, PLAYSTATION 3 system, PlayStation 2 system and PSP system versions of the game unleash a brand new tag team experience, allowing players to build momentum and attributes, eliminate opponents with high impact double teams and finishers, as well as get the “hot tag” for the win. The franchise's renowned creation system offers a brand new Create-A-Finisher option, while a new Road to WrestleMania Mode paves the way to WWE’s biggest event of the year and lets players experience co-op storylines for the first time. WWE SmackDown vs. Raw 2009 also extends the virtual WWE gameplay experience with robust online capabilities, including the highly anticipated debut of downloadable content. [THQ]"
Skullgirls,fighting,https://www.metacritic.com/game/xbox-360/skullgirls,"Skullgirls is a fast 2-D fighting game that puts you in control of fierce warriors in a Dark Deco world. New game systems test the skills of veteran fighting game fans while also making the genre enjoyable and accessible to newcomers. A modern take on classic arcade fighters with a hand-drawn high-definition twist, Skullgirls is an action-packed competition complete with complex combos and an intriguing backstory."
Dissidia 012: Duodecim Final Fantasy,fighting,https://www.metacritic.com/game/psp/dissidia-012-duodecim-final-fantasy,Check out new tales of these new warriors and an enhanced battle system.
WWE SmackDown vs. Raw 2007,fighting,https://www.metacritic.com/game/psp/wwe-smackdown-vs-raw-2007,"A brand new Analog Control System makes fighting more realistic than ever with intuitive movement and new elements of control. An enhanced Season Mode provides multiple branching storylines and unprecedented levels of player choice. In and out of the ring, dozens of user-controlled environmental hotspots let players take advantage of anything at their disposal to inflict damage on opponents in new and unique ways. Additionally, new high impact combination moves let players take the power of WWE Superstars into their own hands. Experience the intensity of WWE fans in a brand new, fully loaded interactive fighting area. Players can take advantage of multiple weapons, environmental damage and grabbing signs and weapons from the crowd. WWE SmackDown vs. RAW 2007 offers multiple enhancements, including incredible high definition graphics, updated rosters for both RAW and SmackDown, an expanded General Manager Mode, online multiplayer game play with voice chat support and more. [THQ]"
WWE SmackDown vs. Raw 2009,fighting,https://www.metacritic.com/game/playstation-2/wwe-smackdown-vs-raw-2009,"WWE SmackDown vs. Raw 2009 upholds the franchise’s commitment to delivering the definitive videogame simulation of live WWE programming. The Xbox 360, PLAYSTATION 3 system, PlayStation 2 system and PSP system versions of the game unleash a brand new tag team experience, allowing players to build momentum and attributes, eliminate opponents with high impact double teams and finishers, as well as get the “hot tag” for the win. The franchise's renowned creation system offers a brand new Create-A-Finisher option, while a new Road to WrestleMania Mode paves the way to WWE’s biggest event of the year and lets players experience co-op storylines for the first time. WWE SmackDown vs. Raw 2009 also extends the virtual WWE gameplay experience with robust online capabilities, including the highly anticipated debut of downloadable content. [THQ]"
Awesomenauts,fighting,https://www.metacritic.com/game/pc/awesomenauts,"The game features the most awesome mercenaries in the galaxy in their fight for territorial supremacy. Awesomenauts brings Russian monkeys with jetpacks, giant robots, and lots of other mighty aliens to the two-dimensional console battlefield. Combining classic platforming-action with modern online multiplayer functionality, the action-packed gameplay offers everything the 16-bit generation and modern gamers love."
Injustice: Gods Among Us,fighting,https://www.metacritic.com/game/playstation-3/injustice-gods-among-us,"Injustice: Gods Among Us kicks off a new fighting game series that begins to weave an original tale featuring a cast of favorite DC Comics icons such as Batman, Harley Quinn, Solomon Grundy, Superman, The Flash, Wonder Woman and others. Set in a world where the distinction between good and evil is often unclear, players pit heroes and villains in grandiose battles on a massive scale."
Marvel vs. Capcom Origins,fighting,https://www.metacritic.com/game/xbox-360/marvel-vs-capcom-origins,"MARVEL VS. CAPCOM ORIGINS offers both the one-on-one gameplay of Marvel Super Heroes with its unique Infinity Gem system and the two-on-two carnage of the original Marvel vs. Capcom: Clash of Super Heroes, featuring a tag system, assists, and the wild Duo Team Attack. Bringing forth a host of features never before seen in these games, MARVEL VS. CAPCOM ORIGINS features GGPO-enhanced online play with 8-player lobbies and spectator mode, HD graphical upgrades, dynamic challenges and replay saving."
Fire Pro Wrestling Returns,fighting,https://www.metacritic.com/game/playstation-2/fire-pro-wrestling-returns,"The popular Fire Pro Wrestling series is famous for its unparalleled gameplay depth and unmatched customization options, and Fire Pro Wrestling Returns is the biggest and best title yet. Having been widely imported for years by hardcore wrestling fans, this will be the first time that the North American audience will get to experience this amazing series in their native language. A huge variety of match types, everything from Singles to Battle Royal to Electrified Barbed Wire Ropes Exploding Deathmatch! A complete arsenal of wrestling moves and holds. No other wrestling game has such a complete list of moves available. The deepest custom wrestler creator anywhere allows players to create and save hundreds of wrestlers, each with their own unique look, moves and AI! The ability to create your own referee, ring, logo, and even belt allows players to recreate any dream match they can think of! Match Maker mode lets players set up their own wrestling show, earn money, and attempt to lure bigger talent to their matches. [Agetec]"
Mortal Kombat: Armageddon,fighting,https://www.metacritic.com/game/xbox/mortal-kombat-armageddon,"The fury of Mortal Kombat has brought the realms to the brink of total destruction. Every warrior has been summoned to this last epic battle, where survival depends on their ability to... FIGHT!"
EA Sports MMA,fighting,https://www.metacritic.com/game/playstation-3/ea-sports-mma,"EA SPORTS MMA promises to feature the most authentic, intense and broad mixed martial arts experience to date - complete with a vast array of top fighters and fighting styles from around the world. [Electronic Arts]"
Dead or Alive 5 Ultimate,fighting,https://www.metacritic.com/game/playstation-3/dead-or-alive-5-ultimate,"DEAD OR ALIVE 5 ULTIMATE is the definitive DEAD OR ALIVE 5 package, with new content aimed to bring players the best 3D DoA fighting experience to date. The addition of modes from DEAD OR ALIVE 5 PLUS, including ""Details Plus"" and a tutorial mode, will allow novice and expert fighters to refine their fighting style with precision."
SoulCalibur V,fighting,https://www.metacritic.com/game/xbox-360/soulcalibur-v,"Developed by the Project Soul team, SOULCALIBUR V begins 17 years after the events of SOULCALIBUR IV with new heroes and returning warriors clashing in a showdown between good and evil. The tale of Patroklos, son of Sophitia Alexandra, unfolds as his family's destiny intertwines with the Soul swords. With the series' 8-way run, allowing for true 3D movement during matches, a refined battle system, and fine graphics, SOULCALIBUR V might be for anyone looking for a knock-down, drag-out fight."
Rhythm Spirit,fighting,https://www.metacritic.com/game/ios/rhythm-spirit,"RHYTHM SPIRIT - the world’s first rhythm-fighting game! Watch the trailer: http://www.youtube.com/watch?v=3Qvma0jHi8Q Join Toshi, a wandering swordsman who unwittingly receives a strange, fearsome power from a mysterious fox spirit. He soon finds himself embroiled in a bizarre and bitter conflict between the demons and deities of an ancient land. Steeped in Eastern folklore, Rhythm Spirit is a story-based, action-oriented rhythm game in which you battle opponents using musical cues. Unlike most rhythm games, which tend to focus on dancing or instruments, Rhythm Spirit incorporates real-time action and fighting mechanics to create a new type of game experience. Jump, duck, slash and block, as you and your opponent battle it out to a completely original, “zen remix” soundtrack. Ten exquisite tracks feature a unique fusion of electronic dance music and traditional Japanese instruments. Rhythm Spirit is a genre-bending experience that can’t be missed! **Features** -Innovative, rhythm-fighting gameplay -Storyline and characters drawn from Eastern mythology -Animated movies and dialogue scenes -10 levels and a variety of different game modes -Multiple difficulties to accommodate rhythm gamers of all skill levels -Tons of unlockable trophies -Original, Asian-inspired soundtrack featuring techno, trance, drum n’ bass and more -Ninjas!"
The King of Fighters XIII: Steam Edition,fighting,https://www.metacritic.com/game/pc/the-king-of-fighters-xiii-steam-edition,"With a roster featuring over 30 hand-drawn fighters, a number of detailed stages bursting with life, over a half dozen play modes, a refined fighting engine built for speed and complete with new moves and supers, a vastly improved Online mode, and a host of other additions, tweaks, and enhancements, THE KING OF FIGHTERS XIII represents a rebirth for one of gaming's longest tenured franchises and one of the most popular fighting brands ever."
Naruto Shippuden: Ultimate Ninja Storm 3,fighting,https://www.metacritic.com/game/playstation-3/naruto-shippuden-ultimate-ninja-storm-3,"Ultimate Ninja STORM 3 promises to unleash a tornado of ninja action and adventure that the franchise is known for, with over eighty playable characters, advanced online modes and enhanced fighting mechanics that allow anyone to become a ninja master."
Ultimate Muscle: Legends vs New Generation,fighting,https://www.metacritic.com/game/gamecube/ultimate-muscle-legends-vs-new-generation,"As evil villains return to take over the world, a battle ensues between old and new superheroes. The wise trainer of both generations, Meat, has decided to pit the two generations against each other to decide which generation is the strongest of all time. In this epic battle, you can play as 20 different characters, each with different wrestling skills and signature finishing moves. Customize your character and play in Story mode or Versus and Tournament mode against three of your friends."
The King of Fighters XIII,fighting,https://www.metacritic.com/game/playstation-3/the-king-of-fighters-xiii,"With a roster featuring over 30 hand-drawn fighters, a number of detailed stages bursting with life, over a half dozen play modes, a refined fighting engine built for speed and complete with new moves and supers, a vastly improved Online mode, and a host of other additions, tweaks, and enhancements, THE KING OF FIGHTERS XIII represents a rebirth for one of gaming's longest tenured franchises and one of the most popular fighting brands ever."
Arcana Heart,fighting,https://www.metacritic.com/game/playstation-2/arcana-heart,"Beyond our world lies that of the Elemental beings, the Arcana. These mighty spirits offer their abilities to the Maidens, those rare humans who are able to communicate with them. Long ago, our worlds were connected. However, the two worlds unexpectedly split apart, and a dimensional boundary was formed between them, separating our world from the Arcana. Seeking to harness their energy, the mysterious Mildred Avalon is trying to form a rift in the boundary and merge the worlds once more. Should her plan succeed, life on our world will never be the same again. Only the Maidens, with the help of their Arcana, can prevent her from bringing an end to all humanity. An all-girl fighting spectacular. Battles heat up with 11 beautiful female fighters to choose from. Customize your fighter's skills. Arcana add new attack and defense skills. Build your combat strategy by selecting from 11 different Arcana to pair with your fighter. Supreme vertical action. Take your fighting skyward! Huge battle maps let you rain down punishment on your opponent with air dashes and homing techniques to create devastating aerial combos. Includes the original Arcana Heart and the remixed Arcana Heart FULL, and offers four different modes: arcade, story, versus, and training, as well as a gallery mode filled with unlockable extras. [Atlus USA]"
The Last Blade 2: Heart of the Samurai,fighting,https://www.metacritic.com/game/dreamcast/the-last-blade-2-heart-of-the-samurai,"More than a dozen Samurai blade masters are summoned to compete in a challenge that has only one victor - and no other survivors. The Last Blade 2 Heart of the Samurai recreates 1864 Japan in all its feudal glory . Players are swept into 1-on-1 death matches against the living and the dead in a quest to bring honor to their master's clan. Each character wields their favorite weapon with a deadly accuracy that is sure to leave the players breathless - all in a split second! Practice each of the lightning-quick moves to perfection, or else prepare to be counted amongst those slain in battle."
Guilty Gear XX Accent Core,fighting,https://www.metacritic.com/game/playstation-2/guilty-gear-xx-accent-core,"This latest iteration in the Guilty Gear series returns with its trademark high-resolution graphics along with an entirely retuned fighting system, new stages, new characters, graphics, voices and the ability to create matches between old and new characters in the Generations Mode. Over 20 deadly combatants to choose from, including 2 new characters. All of your favorite characters have returned with new moves and an alternate EX version of each. Accent Core also introduces 2 reinvented fighters, A.B.A and Order-Sol that have never been seen outside of Japan. Refined fighting game system with 3 new gameplay systems. Accent Core’s Force Break, Throw Escape and Slash Back systems give all the fighters’ new defensive and offensive capabilities. New backgrounds, character voices and an introductory animation have been added for a fresh Guilty Gear experience. Multiple modes of mayhem. Hone your fighting skills in 5 different modes: Arcade, Medal of Millionaire, Versus, Survival and Training. [Aksys Games]"
Mortal Kombat: Deception,fighting,https://www.metacritic.com/game/gamecube/mortal-kombat-deception,"Mortal Kombat: Deception takes the series to the next level with multiple fatalities per character, interactive backgrounds, and new game modes. For the first time in the Mortal Kombat series, you can play a free-roaming Konquest mode, board games, and a puzzle game, in addition to the enhanced one-on-one fighting mode. Mortal Kombat: Deception supports online play for both the PS2 and Xbox Live and features online matches and tournaments as well as online gameplay capabilities for both the board game and puzzle modes."
BlazBlue: Continuum Shift II,fighting,https://www.metacritic.com/game/psp/blazblue-continuum-shift-ii,"BlazBlue: Continuum Shift II contains the complete set of single player features from the console version, such as Arcade, Story Attack, Training, and Story mode, and also has an ad-hoc Network mode for multiplayer play. This impressive list of features is topped off with new content created solely for the handheld version, including extra story material and brand new modes such as Legion 1.5 and Abyss Mode."
