title,description,genres,meta_score,user_score,developer,platform,release_date,rating
SENSE: A CYBERPUNK GHOST STORY,"Dystopian sci-fi gets a survival horror twist!

Inspired by classic adventure games and the origins of the survival horror genre, Sense A Cyberpunk Ghost Story celebrates the slow, cerebral creep of dread instead of relying on over-the-top action or jump scares. With careful attention to pacing, atmosphere and storytelling, this futuristic tale seamlessly blends 2.5D exploration and problem solving with suspenseful ghost encounters that act as paranormal glitches in our own reality.

In Neo Hong Kong, 2083, a young woman named Mei Lin Mak is dragged into a maelstrom of supernatural horror. As she peers into the century old mystery, Mei is forced to question her perception of reality and her trust of her cybernetic eyes. Under the neon lights of a cyberpunk cityscape, the ruins of the Chong Sing Apartments hide a bloody secret illuminated by the traditions of Chinese folklore and innovations of the industrial future. If there is any hope of escaping this nightmare, Mei Lin must explore this complex, piecing together stories of 14 lost souls and discovering the truth of her own family curse.

Features:

* Survive the horror using adventure mechanics and exploration.
* Experience a beautiful, erotic hand-painted art style with Eastern and Western influences.
* Unlock additional outfits, some of which alter interactions throughout the game.
* Keep track of the immersive lore with a convenient journal feature.
* Discover multiple New Game+ modes, alternate endings and hidden extras!
* Get in the mood with a visceral cinema-length soundtrack.","Genre(s): Adventure, Visual Novel",N/A,tbd,Suzaku,PlayStation Vita,"Apr 27, 2021",M
SERAPHIM,Seraphim is a fast-paced arcade shooter featuring fully 3D artwork. Cosmic constructs are coming from all directions and your goal is to destroy them and survive as long as you can. Compare your highest scores and aim for the heavens!,"Genre(s): Action, Shooter, Static, Shoot-'Em-Up, Top-Down",N/A,tbd,Studio Ravenheart,PlayStation Vita,"Jul 22, 2014",N/A
SETP SEQ,N/A,"Genre(s): Miscellaneous, Application",N/A,tbd,Ainanoha,PlayStation Vita,"Feb 10, 2015",N/A
SEVERED,"Severed follows the saga of a distraught warrior, who is lost in a fantastical world, as she knits together pieces of her story from both the past and the future. As the heroine, players will embark on a journey through a surreal, nonlinear world by using a gesture-based combat mechanic to defeat enemies in this first-person adventure. During their journey, players will unlock new abilities, discover secrets of the land, and grow in power as they master both offensive and defensive techniques.","Genre(s): Fantasy, Action Adventure, General",82,8.0,DrinkBox Studios,PlayStation Vita,"Apr 26, 2016",T
SHADOW NINJA RUSH,N/A,"Genre(s): Action, Platformer, 2D",N/A,tbd,LostVision Gamestudio,PlayStation Vita,"Mar 17, 2015",N/A
SHAKE SPEARS!,"Shake Spears is a game of GLORY, HONOR, and FAME! Become a valiant knight and enter tournaments to compete for the heart of a beautiful lady. Travel through four worlds of wonder, win battles in 20 cities, and beat challenging bosses in this epic game. It's time to become a hero for the ages!

Take out opponents with well-aimed strikes in knightly competitions of strategy and precision! Only a steady hand and a trusty steed can guarantee your victory! Upgrade your skills, armor, and weapons, and remember to use a dash of magic to overcome your enemies. Will you answer the call of destiny and become the most honored knight in the land?","Genre(s): Action, Sports, General, Individual, Other",N/A,4.0,"Alawar Entertainment, Inc",PlayStation Vita,"Jan 13, 2015",E10+
SHAKEDOWN HAWAII,"Vblank's open world action heads to the tropics, in Shakedown: Hawaii. From the boardroom to the streets, Shakedown parodies big business and the white collar crimes that go alongside. Build your empire, monopolize the markets, and collaterally re-zone the island's destructible sandbox.","Genre(s): Action Adventure, Open-World",N/A,6.0,Vblank Entertainment Inc.,PlayStation Vita,"May 7, 2019",T
SHANTAE: HALF-GENIE HERO,"Shantae: Half-Genie Hero is a belly dancing, hair-whipping HD adventure from WayForward, makers of Ducktales Remastered, Adventure Time, and Contra 4.","Genre(s): Action, Platformer, Platformer, 2D, 2D",82,8.1,WayForward,PlayStation Vita,"Dec 20, 2016",T
SHANTAE: HALF-GENIE HERO - PIRATE QUEEN'S QUEST,"Download this exciting new storyline featuring the bodacious buccaneer, Risky Boots! Play the role of the villainous pirate queen as she travels Sequin Land in search of the components she needs to crush Sequin Land once and for all! Collect Pirate Gear, solve brand new puzzles, and battle your rival, Half-Genie Shantae in a final showdown like no other! Don't miss out on this epic new installment of Shantae: Half-Genie Hero!","Genre(s): Action, Platformer, 2D",N/A,tbd,WayForward,PlayStation Vita,"Aug 29, 2017",N/A
SHEEP IN HELL,"You're a wolf and you've been bad. That's why you've been put in the deepness of a hell plagued with your most hated enemies: the sheep! But they're not normal sheep. No... They're possessed demonic sheep and won't hesitate to try to kill you!

So run! Defend yourself! Because, after all, a wolf is by nature a predator, not a prey.

Break through the dungeons, solve challenges and escape this hell... If you can!","Genre(s): Action, General",N/A,tbd,David Corominas,PlayStation Vita,"Oct 28, 2014",N/A
SHIKKOKU,N/A,"Genre(s): Action, Shooter, Shooter, Scrolling, Scrolling",N/A,tbd,"Aquadia Co., Ltd.",PlayStation Vita,"Sep 17, 2013",N/A
SHINOBIDO 2: REVENGE OF ZEN,"Players will step into the role of Zen, a master ninja, through a thrilling dynamic storyline of betrayal and intrigue in Shinobido 2: Tales of the Ninja (working title).","Genre(s): Action Adventure, Historic, General, Historic",55,6.6,Acquire,PlayStation Vita,"Feb 21, 2012",M
SHIREN THE WANDERER: THE TOWER OF FORTUNE AND THE DICE OF FATE,"Legend has it that Reeva, god of Destiny, holds sway over the past, present, and future. Said to dwell in the mysterious Tower of Fortune, Reeva decides the fates of all mankind with a trio of magic dice. Lead Shiren The Wanderer and his sidekick Koppa in their quest to conquer the Tower of Fortune. [Playstation.com]","Genre(s): Role-Playing, Roguelike",79,8.3,Spike Chunsoft,PlayStation Vita,"Jul 26, 2016",E10+
SHIRO-KURO HAKKIRI TSUKERU KUMA,N/A,"Genre(s): Miscellaneous, Puzzle, General",N/A,tbd,Booby Trap,PlayStation Vita,"Dec 12, 2012",N/A
SHOOTING *FEATURED,N/A,"Genre(s): Action, General, Shooter, Shooter, Scrolling, Scrolling, Shoot-'Em-Up, Vertical",N/A,tbd,TEASOFT,PlayStation Vita,"Aug 14, 2013",N/A
SHOOTING RANGE BY THORNBURY SOFTWARE,"Shooting Range by Thornbury Software LLC test your shooting skill in our carnival!

Shooting Range by Thornbury Software is a carnival style shooting gallery where you test your shooting skills in the time you're allowed for each level.","Genre(s): Sports, Individual, Other",N/A,tbd,Thornbury Software,PlayStation Vita,"Jun 16, 2015",N/A
SHOVEL KNIGHT,"Shovel Knight is a sweeping classic action adventure game with awesome gameplay, memorable characters, and an 8-bit retro aesthetic. It's a hot mashup of new and old! You play as the eponymous Shovel Knight, a small knight with a huge quest. Shovel Knight has come to this land with two goals: to defeat the evil Enchantress and quest for his lost beloved. He wields a Shovel Blade: a multipurpose weapon whose techniques have now been lost to the ages. Always honest and helpful, Shovel Knight is a shining example of the code of Shovelry: Slash Mercilessly and Dig Tirelessly!

But, between Shovel Knight and his beloved stands a cadre of villainous knights. These terrible foes, known as The Order of No Quarter, have been dispatched to prevent Shovel Knight from reaching the Enchantress, and will pursue their mission at any cost. If you love games with perfect platforming, beautiful art, infectious music, crazy bosses, humor and levity, and real heart... Shovel Knight is for you!","Genre(s): Action, Platformer, 2D",92,8.3,Yacht Club Games,PlayStation Vita,"Apr 21, 2015",N/A
SHOVEL KNIGHT: KING OF CARDS,"Hear Ye, Hear Ye! Make way for Shovel Knight: King of Cards, the grandest adventure in the Shovel Knight: Treasure Trove saga!

Step into the gilded boots of King Knight as you leap, Shoulder Bash, and twirl your way to a kingdom of your own in this regal prequel.

Gather cards, take on challengers, and build a deck in the all-new card game, Joustus! Travel through strange worlds, gather new subjects, best the Joustus Judges, and become King of Cards!

World-class platforming, exquisite visuals, a story with heart, action-packed stages, masterful music, glorious new bosses, and more await you in Shovel Knight: King of Cards.","Genre(s): Action, Platformer, 2D",N/A,tbd,Yacht Club Games,PlayStation Vita,"Dec 10, 2019",N/A
SHOVEL KNIGHT: PLAGUE OF SHADOWS,"Shovel Knight: Plague of Shadows is a free expansion for Shovel Knight, a sweeping classic action adventure game that won over 70 Game of the Year Awards in 2014. You play as Plague Knight, the villainous master of alchemy, in a quest all his own. Using his maniacal scientific mind, Plague Knight is seeking to concoct Serum Supernus, the Ultimate Potion. However, to retrieve these ingredients, he must extract them from his former allies… the villainous knights of the Order of No Quarter! World class platforming, music, storytelling, and art all return in Shovel Knight: Plague of Shadows; an explosive quest with a new play style, new story, new bosses, and more!","Genre(s): Action, Platformer, 2D",N/A,7.7,Yacht Club Games,PlayStation Vita,"Sep 17, 2015",N/A
SHOVEL KNIGHT: SPECTER OF TORMENT,"Shovel Knight: Specter of Torment is the action-packed prequel to Shovel Knight! Take control of Specter Knight, servant to the Enchantress, in a quest to recruit a cadre of knights and create the Order of No Quarter. With his scythe and preternatural agility at the ready, he can glide across the ground, clamber up walls, and command an arsenal of curious weapons.

If he carries out his duties, Specter Knight may have a chance at regaining his lost humanity and breaking his chains of servitude. But what cruel tricks might the Enchantress have up her sleeve?","Genre(s): Action, Platformer, 2D",N/A,tbd,Yacht Club Games,PlayStation Vita,"Apr 25, 2017",N/A
SHOVEL SHUFFLE,N/A,"Genre(s): Miscellaneous, Puzzle, General",N/A,tbd,Chair Warming Facility,PlayStation Vita,"Mar 11, 2014",N/A
SHU,N/A,"Genre(s): Action, Platformer, 2D",N/A,tbd,Coatsink Software,PlayStation Vita,"May 30, 2017",N/A
SHUTSHIMI,"Shütshimi is a randomized shoot'em up about a muscle-bound fish with memory problems defending the seven seas. Defeat or navigate through waves of enemies, collecting new upgrades every 10 seconds that change up the gameplay as you battle your way through each of the game's bosses.","Genre(s): Action, Shooter, Shoot-'Em-Up, Horizontal",82,6.3,Neon Deity Games,PlayStation Vita,"Aug 25, 2015",N/A
SHUTTLE QUEST 2000,"As the pilot of the unique 'Battle Shuttle' join the fight against the evil General Xzarod and save the galaxy in this RETRO Action-RPG-Shooter!

- Battle in 30 story missions over six chapters
- Fight 6 giant Megaship bosses
- Collect resources and use them to craft new items
- Equip weapons and drones in one of thousands combinations
- Meet all sorts of characters on 'Shuttle Station 8'
- Play unlimited random missions with 'Custom Flight Plans'","Genre(s): Action, General, Shooter, Shoot-'Em-Up, Horizontal",N/A,tbd,Thomas Hopper,PlayStation Vita,"Aug 7, 2013",N/A
SID MEIER'S CIVILIZATION REVOLUTION 2+,N/A,"Genre(s): Strategy, Turn-Based, General",N/A,7.5,2K Games,PlayStation Vita,"Mar 29, 2016",N/A
SIGI: A FART FOR MELUSINA,"Join Knight Sigi as he runs, jumps, and battles in a flatulent quest to save Melusina, the love of his life. Take down hordes of goofy enemies and crazy bosses, and make your way to the top of Mount Stinkup.","Genre(s): Action, Platformer, 2D",N/A,tbd,pixel.lu,PlayStation Vita,"Sep 7, 2018",T
SILENT HILL: BOOK OF MEMORIES,Silent Hill: Book of Memories brings the Silent Hill series onto the Next Generation Portable.,"Genre(s): Action Adventure, Horror, Horror, Survival",58,5.0,WayForward,PlayStation Vita,"Oct 16, 2012",M
SILENT HILL: BOOK OF MEMORIES - EXPANSION PACK,"Download the new Silent Hill: Book of Memories Expansion Pack! Includes 10 new character classes, 10 new weapons, 14 new artifacts, 5 new Valtiel missions, 2 new forsaken rooms, 15 new story notes, 2 new enemy types, 4 new trophies, and 15 new character accessories!","Genre(s): Action Adventure, Horror, Survival",N/A,tbd,WayForward,PlayStation Vita,"Mar 19, 2013",M
SILVER ZOMBIE,N/A,"Genre(s): Action Adventure, Horror, Survival",N/A,tbd,Juan Felipe BELON PEREZ,PlayStation Vita,"Jul 15, 2014",N/A
SIMPLE CALCURATOR,N/A,"Genre(s): Miscellaneous, Application",N/A,tbd,Masaaki Sasaki,PlayStation Vita,"Mar 3, 2015",N/A
SIMPLE DICE ROLLER,N/A,"Genre(s): Miscellaneous, General",N/A,tbd,Justin Knight,PlayStation Vita,"Sep 30, 2014",N/A
SIMPLE PONG,N/A,"Genre(s): Action, General",N/A,tbd,ZeShirky,PlayStation Vita,"Oct 28, 2014",N/A
SINE MORA,"Co-developed by Grasshopper Manufacture and Digital Reality, and published by Microsoft Studios, Sine Mora is a dieselpunk shoot 'em up that provides a unique take on the genre, where time is the ultimate factor. Mixing classic shooter sensibilities with next-gen presentation, Sine Mora is a gorgeous shmup that appeals to both hardcore and casual gamers alike. Coming exclusively to Xbox LIVE Arcade, Sine Mora features over 60 combinations of planes, characters and time manipulation devices to complete every beautifully-crafted stage with scaling difficulty. All of this is set to an epic score of soaring heights, composed by Akira Yamaoka, acclaimed for his works on Shadows of the Damned and the Silent Hill series.","Genre(s): Action, Shooter, Shooter, Scrolling, Scrolling, Shoot-'Em-Up, Vertical, Horizontal",85,7.2,Digital Reality,PlayStation Vita,"Nov 20, 2012",N/A
SIR EATSALOT,"The kingdom of Gluttington was at peace… until one day, Hysterica poisoned the Isotonic Waters with sour lemonade. That evil witch! The kingdom’s crops are withering, but this plague has yet to befall all the lands. There is still hope! King Dietan III dispatches his greatest, bravest, stoutest knight to save the kingdom from certain ruin: Sir Eatsalot.","Genre(s): Action, Platformer, 2D",N/A,8.3,Deisling & Rider GbR,PlayStation Vita,"Apr 3, 2018",E10+
SIRALIM,"You are the king (or queen!) of the thriving kingdom of Siralim. It is your duty to protect your kingdom and its people from the dangers lurking beyond your castle's walls. Summon hundreds of unique creatures to fight by your side as you adventure through randomly generated dungeons and complete randomly generated quests. Find rare treasure and use it to upgrade your castle, empower your creatures, learn new spells, and much more.","Genre(s): Role-Playing, Japanese-Style",N/A,tbd,Thylacine Studios,PlayStation Vita,"Feb 9, 2016",N/A
SIRALIM 2,"Siralim 2 is an old-school monster catching RPG. Summon and customize hundreds of creatures to fight for you as you battle your way through endless dungeons. Find rare treasure and use it to upgrade your castle, empower your creatures, craft powerful artifacts, learn new spells, and much more.","Genre(s): Role-Playing, Japanese-Style",N/A,tbd,Thylacine Studios,PlayStation Vita,"Mar 14, 2017",N/A
SIT-UP TRAINING,N/A,"Genre(s): Miscellaneous, Exercise / Fitness",N/A,tbd,ZHANG BO,PlayStation Vita,"Apr 8, 2014",N/A
SIXTY SECOND SHOOTER DELUXE,"In sixty second shooter you'll be given one minute to deal as much destruction as possible. The enemy hordes are relentless, so only the sharpest wits and the fastest reflexes will prevail. Will you press your luck and fly to the deep levels where the truly treacherous foes await? The clock is always ticking in this fast-paced dual-stick shooter.

Thankfully, our intrepid scientists at Happion Laboratories have developed all-new weapons to help you in those sixty seconds of hell. Use missiles to build a large chain bonus or lure your opponents into deadly remote-detonating bombs. With these tools at your disposal, you can develop all kinds of strategies to make that minute last a lifetime!

Created by Jamie Fristrom, game developer behind the critically acclaimed and award-winning games Spider-Man 2 and Schizoid.","Genre(s): Action, Shooter, Shooter, Static, Static, Shoot-'Em-Up, Top-Down",N/A,tbd,Happion Laboratories,PlayStation Vita,"Oct 31, 2012",N/A
SKELETON RIDER,N/A,"Genre(s): Sports, Alternative, Biking",N/A,tbd,iSquared Games,PlayStation Vita,"Jul 9, 2014",N/A
SKETCHCROSS,Sketchcross is a logic puzzler based on the nonogram ruleset. Think a mix between crosswords and sudoku.,"Genre(s): Puzzle, Logic",65,tbd,Spiky Fish Games,PlayStation Vita,"Apr 28, 2015",N/A
SKULLGIRLS: 2ND ENCORE,"Skullgirls 2nd Encore is a beautiful, fast-paced 2D fighting game that puts players in control of fierce warriors in an extraordinary Dark Deco world. Each of the 14 wildly original characters features unique gameplay mechanics and plenty of personality.

Skullgirls 2nd Encore is the perfect fighting game for casual and competitive fighting game fans alike. Casual players will enjoy the fully voiced story mode, gorgeous animation and soundtrack by Michiru Yamane, while hardcore players will appreciate its balance, cross-platform multiplayer, and support for PlayStation3 system fight sticks.

Use of PSN and SEN account are subject to the Terms of Service and User Agreement and applicable privacy policy (see terms at sonyentertainmentnetwork.com/terms-of-service & sonyentertainmentnetwork.com/privacy-policy). *Online multiplayer also requires a PlayStationPlus subscription.","Genre(s): Action, Fighting, 2D",76,7.7,Lab Zero Games,PlayStation Vita,"Apr 5, 2016",T
SKY FORCE ANNIVERSARY,"The legendary shoot-em-up is here to celebrate its 10-year anniversary in super-destructive style.

Harnessing the intensity of classic arcade games combined with modern visuals, Sky Force Anniversary offers a stunning scrolling shooter experience with an incredible new social gameplay element.

Over a decade ago, IGN said, ""Put simply, Sky Force is amazing."" Scoring an incredible 9.5 out of 10. And now i'ts back. Bigger, bolder and more intense than ever.

This 10th anniversary edition adds incredible depth to the series through stunning 3D graphics, intuitive controls and a powerful upgrade system that'll keep you blasting for hours on end.","Genre(s): Action, Shooter, Shoot-'Em-Up, Vertical",N/A,6.1,Infinite Dreams,PlayStation Vita,"Sep 6, 2016",N/A
SKYLIGHT FREERANGE,N/A,"Genre(s): Role-Playing, General",N/A,tbd,Dragoon Entertainment Ltd.,PlayStation Vita,"Jun 6, 2017",N/A
SKYLIGHT FREERANGE 2: GACHDUINE,"After a powerful biotechnology was legalized in 2048 in Canada, the Cult of the Symbiote forced their way in as regulators in the Maritimes. Despite their presentation as protectors and healers, the Cult has ruined many lives with their ambitions. As tensions escalate and boiling points are reached, lines will blur, gray areas will clash, and the shadow group Gachduine will make choices that have a very real impact for Nova Scotia. [Playstation.com]","Genre(s): Role-Playing, General",N/A,tbd,Dragoon Entertainment,PlayStation Vita,"Sep 20, 2016",N/A
SLAIN: BACK FROM HELL,Slain: Back from Hell. A heavy metal inspired arcade combat with puzzle elements and gore galore. Stunning visuals and true old school gameplay accompanied by the most metal soundtrack you've ever heard.,"Genre(s): Action, Platformer, 2D",N/A,tbd,Wolf Brew Games,PlayStation Vita,"Nov 22, 2016",N/A
SLAYAWAY CAMP: BUTCHER'S CUT,"A killer puzzle game where you control Skullface, an adorably demented murderer, across hundreds of isometric puzzle levels in a darkly comic homage to 80s horror movies.","Genre(s): Puzzle, Action",N/A,tbd,Blue Wizard Digital,PlayStation Vita,"Nov 20, 2018",M
SLICE NINJA,N/A,"Genre(s): Action, Platformer, Platformer, 2D, 2D",N/A,tbd,WIZARDSOFT Corporation,PlayStation Vita,"May 29, 2013",N/A
SLOW-MO DODGERS,N/A,"Genre(s): Action, Platformer, 2D",N/A,tbd,E_Shi_games,PlayStation Vita,"Sep 2, 2014",N/A
SLY COOPER COLLECTION,"Also known as The Sly Trilogy. The Sly Collection features three PlayStation 2 action-packed classic hits (Sly Cooper and the Thievius Racconus, Sly 2: Band of Thieves and Sly 3: Honor Among Thieves).","Genre(s): Miscellaneous, Compilation",80,7.9,Sanzaru Games,PlayStation Vita,"May 27, 2014",E10+
SLY COOPER: THIEVES IN TIME,"Sly Cooper Thieves in Time continues to chronicle the adventures of the Sly Cooper gang from where Sly 3: Honor Among Thieves concluded. After completing their latest heist, Sly carries on with a case of alleged amnesia and dances off with gal pal Carmelita, leaving Bentley as the keeper of the treasured Thievius Raccoonus, The Cooper family’s ancient book of master thievery. When Bentley discovers that pages of the book have begun to disappear in front of his eyes, he must round up the gang and save the Cooper Clan legacy from being destroyed forever.","Genre(s): Action Adventure, Fantasy, General, Fantasy",75,8.0,Sanzaru Games,PlayStation Vita,"Feb 5, 2013",E10+
SMART AS...,Smart As is a logic puzzle game that utilizes the various features of the PlayStation VITA.,"Genre(s): Miscellaneous, Puzzle, Puzzle, Logic, Logic",72,7.2,XDEV,PlayStation Vita,"Oct 23, 2012",N/A
SNAKE,N/A,"Genre(s): Action, General, General",N/A,tbd,Carrot Creations,PlayStation Vita,"Mar 27, 2013",N/A
SNOW MATERIAL,N/A,"Genre(s): Adventure, 3D, First-Person",N/A,tbd,slapsticKsoftware,PlayStation Vita,"Mar 10, 2015",N/A
SOCCERSTAR,N/A,"Genre(s): Sports, Team, Soccer, Arcade",N/A,tbd,FalconStar Limited,PlayStation Vita,"Mar 31, 2015",N/A
SOKOBAN NEXT,N/A,"Genre(s): Puzzle, Action",N/A,tbd,PalmStorm Kft.,PlayStation Vita,"Nov 1, 2017",N/A
SOLA CALENDAR,N/A,"Genre(s): Miscellaneous, General",N/A,tbd,ZHANG BO,PlayStation Vita,"Feb 4, 2014",N/A
SOLA CHATROOM,N/A,"Genre(s): Miscellaneous, General",N/A,tbd,ZHANG BO,PlayStation Vita,"Mar 4, 2014",N/A
SOLA DISK,N/A,"Genre(s): Miscellaneous, General",N/A,tbd,ZHANG BO,PlayStation Vita,"Feb 4, 2014",N/A
SOLA GALLERY,N/A,"Genre(s): Miscellaneous, General",N/A,tbd,ZHANG BO,PlayStation Vita,"Mar 4, 2014",N/A
SOLA NOTE,N/A,"Genre(s): Miscellaneous, General",N/A,tbd,ZHANG BO,PlayStation Vita,"Jan 7, 2014",N/A
SOLA TIMER,N/A,"Genre(s): Miscellaneous, General",N/A,tbd,ZHANG BO,PlayStation Vita,"Feb 4, 2014",N/A
SOLA WEATHER,N/A,"Genre(s): Miscellaneous, General",N/A,tbd,ZHANG BO,PlayStation Vita,"Jan 7, 2014",N/A
SOLACALCULATOR,N/A,"Genre(s): Miscellaneous, General",N/A,tbd,ZHANG BO,PlayStation Vita,"Jan 28, 2014",N/A
SOLBRAIN I - VILLAGE,N/A,"Genre(s): Action, General",N/A,1.8,Lightning Game Studios,PlayStation Vita,"Sep 16, 2014",N/A
SOLBRAIN III - SNOW,N/A,"Genre(s): Action, General",N/A,tbd,Lightning Game Studios,PlayStation Vita,"Oct 7, 2014",N/A
SOLBRAIN IV - STORM,N/A,"Genre(s): Action, General",N/A,tbd,Lightning Game Studios,PlayStation Vita,"Nov 4, 2014",N/A
SOLBRAIN IX - FOREST,N/A,"Genre(s): Action, General",N/A,tbd,Lightning Game Studios,PlayStation Vita,"Nov 25, 2014",N/A
SOLBRAIN V - TECH,N/A,"Genre(s): Action, General",N/A,tbd,Lightning Game Studios,PlayStation Vita,"Nov 4, 2014",N/A
SOLBRAIN VI - DESERT,N/A,"Genre(s): Action, General",N/A,tbd,Lightning Game Studios,PlayStation Vita,"Nov 4, 2014",N/A
SOLBRAIN VII - DUNGEON,N/A,"Genre(s): Action, General",N/A,tbd,Lightning Game Studios,PlayStation Vita,"Jan 13, 2015",N/A
SOLBRAIN VIII - GARDEN,N/A,"Genre(s): Action, General",N/A,tbd,Lightning Game Studios,PlayStation Vita,"Nov 25, 2014",N/A
SOLBRAIN X - DARK,N/A,"Genre(s): Action, General",N/A,tbd,Lightning Game Studios,PlayStation Vita,"Dec 16, 2014",N/A
SOLBRAIN XI - ISLAND,N/A,"Genre(s): Action, General",N/A,tbd,Lightning Game Studios,PlayStation Vita,"Dec 23, 2014",N/A
SOLBRAIN XII - STORM,N/A,"Genre(s): Action, General",N/A,tbd,Lightning Game Studios,PlayStation Vita,"Feb 10, 2015",N/A
SOLBRAIN XIII - WIND,N/A,"Genre(s): Action, General",N/A,tbd,Lightning Game Studios,PlayStation Vita,"Feb 3, 2015",N/A
SOLDNER-X 2: FINAL PROTOTYPE,"In Soldner-X 2: Final Prototype, you will return to Gota IV as part of the Soldner-X defense force. Mankind will once more rely on your battle against new mysterious powers. Staged across seven unique action-loaded levels accompanied with an adrenaline pumping soundtrack, Soldner-X 2: Final Prototype combines traditional 2D gameplay with detailed high definition graphics and a taste of fresh innovations.","Genre(s): Action, Shooter, Scrolling, Shoot-'Em-Up, Vertical, Horizontal",71,6.9,SideQuest Studios,PlayStation Vita,"Mar 17, 2015",N/A
SOLITAIREZERO,N/A,"Genre(s): Miscellaneous, Board / Card Game",N/A,tbd,MairCode,PlayStation Vita,"Feb 3, 2015",N/A
SON OF SCOREGASM,"Only you can destroy the evil space baddies and rescue the King of the Earth’s beloved biscuit tin! Blast your way through 28 varied levels full of enemies, traps, lasers, and explosions.","Genre(s): Action, Shooter, Shoot-'Em-Up, Top-Down",75,8.3,Charlie's Games,PlayStation Vita,"Oct 11, 2017",E
SONIC & ALL-STARS RACING TRANSFORMED,"Sonic and the All-Stars cast battle for supremacy across land, water and air in transforming vehicles that change from cars to boats to planes mid-race.","Genre(s): Driving, Racing, Arcade, Kart, Other, Kart, Automobile",75,7.8,Sumo Digital,PlayStation Vita,"Dec 18, 2012",E10+
