title,description,genres,meta_score,user_score,developer,platform,release_date,rating
DUNGEON TRAVELERS 2: THE ROYAL LIBRARY & THE MONSTER SEAL,"There once was an era in which the earth was inhabited by gods, humans, and an evil deity from the underworld known as the Demon God. Under the flag of the holy maiden Vitoria, humans fought against the spirits, or monsters, who worked as the Demon’s pawns for ages. – God's Era, Year 395. A technique for capturing monsters into a magical tome called a Sealbook was invented by the first royal alchemist, Siegdrad. A new, special class called Libras handled this sealing magic, and they garnered tremendous results in regard to monster suppression. Thanks to their efforts, the monsters’ population plummeted, and eventually the Demon God herself was sealed away. The world began to operate under the rule of humanity. Then came the King’s Era, Year 1. Vitoria had achieved continental unification through the hard work of mankind, and succeeded the throne as First Queen of the Kingdom of Romulea. [Atlus]","Genre(s): Role-Playing, Western-Style",73,8.5,Aqua Plus,PlayStation Vita,"Aug 18, 2015",M
DUSTFORCE,"In Dustforce, players stylishly flow through precarious environments, sweeping up dust, leaves, trash and slime. The cleaners face off against the fourSprites who are determined to make a mess of the whole world","Genre(s): Action, Platformer, 2D",73,6.9,Hitbox,PlayStation Vita,"Feb 4, 2014",E10+
DYING: REBORN,"DYING: Reborn is a dark, horror-themed puzzle game that creates a unique first-person room escape experience.","Genre(s): Adventure, 3D, First-Person",N/A,5.0,Nekcom,PlayStation Vita,"Mar 14, 2017",M
DYNAMIC VISUAL ACUITY TEST,N/A,"Genre(s): Miscellaneous, General",N/A,tbd,toshinori tamashihiro,PlayStation Vita,"Jul 17, 2013",N/A
DYNAMITE DUDE,N/A,"Genre(s): Action, Arcade",N/A,tbd,Kelvin Moreaux,PlayStation Vita,"Jun 9, 2015",N/A
DYNASTY WARRIORS 8 EMPIRES,"DYNASTY WARRIORS 8 Empires is the latest installment of the ""Empires"" series, in which you aim to conquer ancient China using both strategy and the one warrior versus one thousand tactical action the WARRIORS series is known for. The player becomes a hero from Three Kingdoms era, with the goal of unifying all of ancient China under their rule via strategy and battles! You can also import save data from Free Alliances Version into DYNASTY WARRIORS 8 Empires!","Genre(s): Action, Beat-'Em-Up, 3D",70,7.5,Omega Force,PlayStation Vita,"Nov 24, 2015",T
DYNASTY WARRIORS 8: XTREME LEGENDS COMPLETE EDITION,"'Dynasty Warriors 8: Xtreme Legends' introduces entirely new levels of fun to the refreshing gameplay vanquishing swarms of enemies with mighty warriors found in 'Dynasty Warrors 8.' In story mode, where you can immerse yourself in the vivid tales of the Romance of the Three Kingdoms, it is now possible to play as the mighty warrior 'Lu Bu,' and embark on a journey that depicts his way of life. Additionally, many new hypothetical scenarios to existing Romance of the Three Kingdoms battles have been added, as well as new playable characters, weapons types, growth/speedrun elements, and more! What's more, a revamped Ambition Mode and completely new Challenge Mode offer whole new ways to enjoy the 'Dynasty Warriors 8' universe.","Genre(s): Action, Miscellaneous, Beat-'Em-Up, Compilation, 3D",65,7.8,Omega Force,PlayStation Vita,"Mar 25, 2014",T
DYNASTY WARRIORS NEXT,In this Tactical Action game players can enjoy the thrill of taking down thousands of enemies and become the greatest hero in Chinese history.,"Genre(s): Action, Beat-'Em-Up, Beat-'Em-Up, 3D",67,7.5,Koei,PlayStation Vita,"Feb 21, 2012",T
DYNASTY WARRIORS: GODSEEKERS,"The final days of the Later Han Period in China...
Political strife has led to unrest and the rise of rebelling peasants, known as the ""Yellow Turbans"", has brought ceaseless conflict to the land. Among this chaos, in the country of Changshan lives a young warrior known as Zhao Yun, who has a lore-master friend named Lei Bin.
One day, Lei Bin hears a rumor about a ""buried person"" discovered in a ""mysterious shrine"" by the remnants of the Yellow Turbans, and he convinces Zhao Yun to investigate it. While Zhao Yun is more interested in the danger the rebels could pose, Lei Bin can only think of the ""great historical discovery"" they might make. However, what they discover inside the cave is a young woman who appears to be frozen inside a column of ice.","Genre(s): Strategy, Turn-Based, Tactics",62,7.4,Omega Force,PlayStation Vita,"Jan 31, 2017",T
EARTH ASSAULT,N/A,"Genre(s): Action, General",N/A,tbd,Carlos Barcenas-Portillo,PlayStation Vita,"Nov 5, 2013",N/A
EARTH DEFENSE FORCE 2017 PORTABLE,"The completely remastered Earth Defense Force 2017 Portable features seven new levels and the fan favorite Pale Wing, which allows players to soar high over buildings in her jet pack and cause destruction from above.","Genre(s): Action, Shooter, Shooter, Third-Person, Sci-Fi, Sci-Fi, Arcade",68,7.6,Sandlot,PlayStation Vita,"Jan 8, 2013",N/A
EARTH DEFENSE FORCE 2: INVADERS FROM PLANET SPACE,"Earth Defense Force 2: Invaders from Planet Space is an expanded remake of the second entry in the acclaimed action series. Players take on the role of a ""Ranger"" military soldier armed with conventional weaponry, a ""Pale Wing"" special ops soldier equipped with a jetpack and armed with energy weapons, or new to this version, an ""Air Raider,"" who fights indirectly through the strategic placement and dispatch of trip mines, sentry guns, air strikes and more. Players must fend off the invaders in each mission area, either alone or with up to three friends, through frenetic real-time combat set in real-life locations. Helmed by the original developers at Sandlot, this is the definitive version of what fans typically consider to be the best EDF title.","Genre(s): Action, Shooter, Third-Person, Arcade",72,8.2,Sandlot,PlayStation Vita,"Dec 8, 2015",T
ECOFISH,"EcoFish is an underwater arcade experience where you have to clean the game scenarios from a toxic oil spill which has turned all your little friends into maniacs!

With a simple and accessible interface adapted to iOS, you'll have to solve this ocean mess through up to 90 levels and lots of enemies, obstacles and different graphic scenearios.

Will you be able to turn the beauty back to the depths of the ocean? Now it's your turn with EcoFish...","Genre(s): Miscellaneous, General, General",N/A,tbd,Eclipse Games,PlayStation Vita,"Dec 5, 2012",N/A
ECOLIBRIUM,"Bring harmony to a virtual ecosystem in this PS Vita gaming app.
-Create a balanced ecosystem by choosing different combinations of species, plants and artefacts.
-Acquire, collect and trade new plants and animals with other PS Vita owners.
-Collect new creatures using the GPS feature of the PS Vita 3G model and show them off to your friends on Facebook.
-Release unwanted creatures into the wild for other players to pick up using ""near"".
-Unlock new content by completing challenges.
-Download Ecolibrium for free from PlayStation Store.","Genre(s): Simulation, Miscellaneous, Virtual Life, Virtual, Virtual Life",61,5.5,SCEE,PlayStation Vita,"Feb 12, 2013",N/A
EDGE ESCAPE,N/A,"Genre(s): Action, Arcade",N/A,tbd,LostVision Gamestudio,PlayStation Vita,"Mar 24, 2015",N/A
EGA,N/A,"Genre(s): Action, General",N/A,tbd,Simone Serra,PlayStation Vita,"Dec 23, 2014",N/A
ELE-MENTAL,N/A,"Genre(s): Action, Arcade",N/A,tbd,Molexendor,PlayStation Vita,"Feb 3, 2015",N/A
ELEMENT4L,"Element4l is a moody and experimental platform game, with a strong focus on flow and smooth gameplay, wrapped in an exceptional soundtrack by MindTree

In Element4l, you control the state of your character to find your way through a dreamy underworld. Your only hindrances are nature and the sun. It takes a different, experimental approach to classic platform games and challenges you to rearrange your reflexes. The state-changing, physics-based gameplay invites all ages to think logically, and reveals that pressing the right button at the right time, is often more rewarding than mashing buttons. Just when you thought pressing the left button would make your character go left, Element4l crushes this doctrine.

Just don't expect an easy platformer. The first time you play element4l, you will struggle... just like the first time you've learned how to ride a bike.","Genre(s): Action, Platformer, 2D",62,4.8,i-illusions,PlayStation Vita,"Apr 7, 2015",N/A
EMERALD SHORES,"Emerald Shores is a challenging 16-bit platformer with a bunch of twists. Level up, take on rewarding sidequests, play unique minigames, unlock secret levels, raise a pet monster, fight an optional mega-leveled beast of a boss, and more.","Genre(s): Action, Platformer, 2D",N/A,tbd,Fordesoft,PlayStation Vita,"Dec 4, 2018",E
EMIL'S TASK,N/A,"Genre(s): Role-Playing, Action RPG",N/A,tbd,Inukage Games,PlayStation Vita,"Mar 24, 2015",N/A
EMMA: LOST IN MEMORIES,"Emma: Lost in Memories is a 2D puzzle platformer game in which all the platforms and walls start disappearing progressively as you touch them. Think, strategize, run, jump and feel in a surreal and poetic world where everything fades away.","Genre(s): Action, Platformer, 2D",N/A,tbd,SandBloom Studio,PlayStation Vita,"May 11, 2020",E
ENERGY BALANCE,During a mission your spaceship encounters an unknown anomaly and all systems fail. You have to balance the energy in order to get them running again and to get home safely. Energy Balance is a number puzzle. You have to swap power units in such a way that their sums form correct chains both vertically and horizontally.,"Genre(s): Puzzle, Logic",N/A,tbd,Sometimes You,PlayStation Vita,"Jul 12, 2017",N/A
ENERGY CYCLE,"A puzzle game from the developers of Energy Balance. When you click each cell on the game field, it changes color, and the colors of adjacent cells horizontally and vertically. Your task to bring all the cells to the same color. Sounds pretty easy — but try to do it.","Genre(s): Puzzle, Matching",N/A,tbd,Sometimes You,PlayStation Vita,"Jul 7, 2017",N/A
ENERGY CYCLE EDGE,"'Energy Cycle Edge' is the sequel to the puzzle game 'Energy Cycle'. The main idea is the same: when you activate each cell in the game field, it changes the colors of the cell and any adjacent cells in a straight line. Each cell switches between three different colors, and your task is to make them all match the same color.

In 'Energy Cycle Edge', most part of puzzles are three-dimensional, so you'll need to monitor the changes of colors within several linked layers, adding a new facet to the familiar gameplay.","Genre(s): Puzzle, General",N/A,tbd,Sometimes You,PlayStation Vita,"Dec 5, 2018",N/A
ENERGY INVASION,N/A,"Genre(s): Action, Arcade",N/A,tbd,Sometimes You,PlayStation Vita,"Jan 10, 2018",E
ENERGY SKATE,N/A,"Genre(s): Action, Platformer, 2D",N/A,tbd,ptt,PlayStation Vita,"Dec 2, 2014",N/A
ENTWINED,"Entwined is an action reflex game where you must learn to control two characters simultaneously and help them on their journey to become one with each other.
The Bird and the Fish you control represent two souls who are in love but can’t be together. As you guide them through 9 different lifetimes you will help them overcome obstacles of fate and ultimately set them free by transforming them into a soaring Dragon.
Through an innovative twin stick control scheme, accessible learning curve and awe-inspiring visuals you will be immersed in a rich and vibrant abstract world.","Genre(s): Action, General, Arcade",N/A,7.6,Pixel Opus,PlayStation Vita,"Jul 22, 2014",N/A
EP ALIEN ATTACK!,"News flash: all the alarms have been activated at the approach of an alien army from the planet Omicron Persei 8 ready to invade the Earth. They come loaded with lasers and are ready to strike. Now it's your turn...

Dare to test your aim and skill in a combat spaceship and become the hero that will save the planet Earth.

Let the adventure and the fun begin!","Genre(s): Action, General, Shooter, Shoot-'Em-Up, Vertical",N/A,tbd,EP Games,PlayStation Vita,"Jun 2, 2015",N/A
EP CHAIN REACTION,"It's raining shiny gems! Have you ever seen something like this? They turn into bright fireworks when they touch an explosion!

It will catch you. It will delight you. It will relax you.

Achieve the better score and invest the points on improving the size and duration of your explosions and break all the records. Are you ready to face the challenge?","Genre(s): Action, General, Arcade",N/A,tbd,"Desarrollos de Software Edad Perdida, S.L.",PlayStation Vita,"Oct 21, 2014",N/A
EP GEM HUNTER,"The classic Pac-Man improved to a higher level of fun with full HD graphics, 5 different maps, 3 awesome powerups and 4 fearsome monsters.

Join the brave Ayron in this exciting adventure where you should pick up all the shiny gems spread around the 5 maps. Be careful! A ghost, a mummy, a skeleton and a zombie are decided to prevent you get it.

A combination of elements that you'll love.","Genre(s): Action, General, Arcade",N/A,tbd,"Desarrollos de Software Edad Perdida, S.L.",PlayStation Vita,"Oct 7, 2014",N/A
EP SEARCH AND FIND,N/A,"Genre(s): Puzzle, General",N/A,tbd,EP Games,PlayStation Vita,"Jun 9, 2015",N/A
EP SOKOBAN CATZZLES,"Train your brain while you have fun with this new version of the Sokoban classic puzzle.

Help the cats to complete the 1000 puzzles.

What are you waiting for? Play it for FREE!","Genre(s): Puzzle, General",N/A,tbd,EP Games,PlayStation Vita,"Mar 3, 2015",N/A
EPIC WORD SEARCH COLLECTION,"Epic Word Search puzzles are huge!

Each puzzle contains over 1,500 words, hidden in a grid that's much too large to fit on screen!

To solve the word search you'll have to scroll around the puzzle looking for words. Use the D-Pad or Circle Pad to move the grid and touch with the stylus to highlight words.

This is a challenge like nothing you've ever seen before with many hours of gameplay in each enormous puzzle.

Jump straight in and get solving right away with this fast-loading game. Switch between puzzles at any time and share your progress with other players using StreetPass.

Epic Word Search Collection contains five gigantic puzzles!
-The Epic Food Word Search - munch your way from breakfast to dessert.
-The Epic Movie Word Search - find words about sixteen classic movies.
-The Epic Rock Word Search - rock out to some classic anthems.
-The Epic Sports Word Search - football, baseball, fishing and more.
-The Epic TV Word Search - words from more than a dozen popular TV shows.","Genre(s): Puzzle, Logic",N/A,tbd,Lightwood Games,PlayStation Vita,"Mar 17, 2020",E
EPIC WORD SEARCH COLLECTION 2,"Epic Word Search puzzles are huge - and they're back in this second epic collection!

The Epic America Word Search - Celebrate the very best of America - with fireworks!

The Epic Ancient Word Search - By Zeus, it's historic! Visit Greece, Rome, Egypt and Stonehenge!

The Epic Animals Word Search - The furriest word search you'll ever meet and want to tickle the tummy of!

The Epic Journeys Word Search - Fasten your seatbelt as you travel in luxury or go an epic expedition.

The Epic Shakespeare Word Search - Friends, Romans, countrymen, find me some words!

Each epic puzzle contains over 1,500 words, hidden in a grid that's much too large to fit on screen! It takes many hours of gameplay to solve each one. Scroll with the D-Pad or Circle Pad, then touch with the stylus to highlight words.

Jump straight in and get solving right away with this fast-loading game. Switch between puzzles at any time and share your progress with other players using StreetPass.","Genre(s): Puzzle, Logic",N/A,tbd,Lightwood Games,PlayStation Vita,"Jul 21, 2020",E
ESCAPE,N/A,"Genre(s): Action, General",N/A,tbd,Adam De Broeck,PlayStation Vita,"Apr 1, 2014",N/A
ESCAPE FROM HELL,N/A,"Genre(s): Action, Platformer, 2D",N/A,tbd,Iasagi Strife,PlayStation Vita,"Sep 2, 2014",N/A
ESCAPE HERO,N/A,"Genre(s): Action, Platformer, 2D",N/A,tbd,Orgesta,PlayStation Vita,"Mar 17, 2015",N/A
ESCAPE PLAN,"From the producers behind Fat Princess, comes an original new experience -- Escape Plan. Escape Plan takes advantage of the Vita system's multi-touch display, rear touch panel, swipe interfaces and motion sensor, putting the fate of the hapless heroes in the palm of your hand. Players can swipe, squeeze, poke and slap Lil and Laarg to manipulate the characters and interact with the diverse environments. Only you can help them survive each deadly room before their captor and nemesis, Bakuki, recycles them and turns them into his minions... or sheep. [Sony]","Genre(s): Miscellaneous, Puzzle, Action, General, Puzzle, General",71,7.3,Fun Bits,PlayStation Vita,"Feb 14, 2012",N/A
ESCAPE PLAN: DIRECTOR'S CUT,N/A,"Genre(s): Miscellaneous, Puzzle, Action, General, Puzzle, General",N/A,tbd,Fun Bits,PlayStation Vita,"Oct 2, 2012",N/A
ESCAPE PLAN: THE ASYLUM,"The Asylum delivers a ton of crazy content, including the Lil and Laarg Dressing Room where fans can check out the God and Luchadore Super Pack costumes, with the Poindexter and Super Hero costumes unlockable by playing through all of the 18 Asylum levels.","Genre(s): Miscellaneous, Puzzle, Action, General, Puzzle, General",N/A,8.0,Fun Bits,PlayStation Vita,"Jun 12, 2012",T
ESCAPE PLAN: UNDERGROUND PACK,The Underground brings an entirely new labyrinth of 19 puzzles and death traps to the Escape Plan.,"Genre(s): Miscellaneous, Puzzle, Action, General, Puzzle, General",N/A,tbd,Fun Bits,PlayStation Vita,"Jul 31, 2012",N/A
ESCAPEVEKTOR,"Vektor has been trapped inside the CPU for what feels like an eternity and you are his only hope of escape. As he travels through the CPU, help him recover his memories and destroy the different enemy types sent to hunt him. But be careful, the further Vektor gets, the more devious the CPU becomes! There is a whole world to uncover within your CPU! Hiding away are 150 levels (nodes), 27 worlds (zones) and 4 unique abilities to unlock and upgrade. With Vektor providing you with Detonate to destroy enemies, Boost and Super Boost to out run them and Boostenate to smash your way through, you are sure to be able to help him escape! Online leaderboards allow you to compete against your friends, those in your location and those closest to you in score. Use wildcards to double your score in each level and boost your standing in the leaderboards!","Genre(s): Miscellaneous, Puzzle, Action, Puzzle, Action",N/A,tbd,Nnooo,PlayStation Vita,"Jan 22, 2013",N/A
ETERNAL INTERCEPTOR,N/A,"Genre(s): Action, Shooter, Scrolling, Shoot-'Em-Up, Vertical",N/A,tbd,Team_Redherring,PlayStation Vita,"Sep 30, 2014",N/A
ETERNAL INTERCEPTOR BIT,N/A,"Genre(s): Action, Shooter, Scrolling, Shoot-'Em-Up, Vertical",N/A,tbd,Team_Redherring,PlayStation Vita,"Dec 16, 2014",N/A
ETERNIBEAT,N/A,"Genre(s): Action, Platformer, 2D",N/A,tbd,James McGowan,PlayStation Vita,"Nov 18, 2014",N/A
ETHAN: METEOR HUNTER,"'Ethan: Meteor Hunter' is a single-player genre mixing game that blends the very best of platform- and puzzle-gaming. The game features Ethan, a rat with an attitude, who was hit on the head by a meteorite giving him supernatural powers! You, yes you, must guide our rodent hero through 50 levels of challenging fun across 3 unique worlds. Getting struck by space trash does have its advantages! For example, our hero has the power of telekinesis and the ability to freeze time, enabling him to move objects around while the world is on hold; a truly unique feature you will need to overcome a number of difficult puzzles and obstacles.
With its themed levels, expressive art style, addictive gameplay, realistic physics, awesome graphics, mind-bending puzzles, and multiple ways of completing the game, 'Ethan: Meteor Hunter' will quickly immerse you in its enthralling world!","Genre(s): Action, Platformer, 2D",54,6.2,Seaven Studio,PlayStation Vita,"Apr 15, 2014",N/A
EUFLORIA ADVENTURES,N/A,"Genre(s): Action, General",N/A,tbd,Omni Systems Limited,PlayStation Vita,"Apr 15, 2014",N/A
EUFLORIA HD,"Eufloria is an ambient game of space exploration and conquest that employs surprising themes of plant growth and bio mechanical evolution. The game allows the player to explore a beautifully realized universe rendered in a style that is both unique and compelling. Eufloria's aesthetics are reminiscent of children's books like ""the little prince"" and the gameplay is supported by an original ambient soundtrack by Brian Grainger. Gameplay revolves around conquering asteroids in space and using their resources to literally grow and nurture new semi-organic plants and creatures to do the player's bidding. The player is pitched again several teams of AI opponents that all vie for the same resources and can offer fierce opposition.","Genre(s): Strategy, General, General",69,6.8,Rudolf Kremers,PlayStation Vita,"Dec 17, 2013",N/A
EVERYBODY'S ARCADE,N/A,"Genre(s): Action, General, General",N/A,4.5,SCEI,PlayStation Vita,"Oct 3, 2012",N/A
EXILE'S END,"When the scion of the most powerful corporation in the galaxy goes missing on a remote mining planet, a team of mercenaries is dispatched to investigate. Among them is Jameson, an old soldier with a dark past. Inspired by early ’90s “cinematic platformers,’ Exile’s End plays out as an exploration-driven side-scrolling adventure through a massive mining complex on a moody, lonely alien world. [Playstation.com]","Genre(s): Action, Platformer, 2D",46,tbd,MagneticRealms,PlayStation Vita,"Oct 25, 2016",N/A
EXIST ARCHIVE: THE OTHER SIDE OF THE SKY,"An RPG in which Kanata and others have been imbued with pieces of the dark god Yamatoga’s soul, and are sent to Protolexa, for reasons unbeknownst to them. Battle enemies and the armies of Chasseur as you search out for your other teammates, complete quests and side events, and learn the truth of why you have been chosen. [Playstation.com]","Genre(s): Role-Playing, Japanese-Style",68,8.1,Tri-Ace,PlayStation Vita,"Oct 18, 2016",N/A
EXPLOSIVE JAKE,"Explosive Jake - classic arade game. Not only humans afraid of dark and deep dungeons. Our hero - a little skeleton with unhealthy crave of explosions, which trying to escape from castle dungeons. Help him to avoid enemies and explode his way out.","Genre(s): Puzzle, Action",N/A,tbd,Pigeon Dev Games,PlayStation Vita,"Mar 18, 2020",E10+
F1 2011,"Compete on the go with F1 2011 The official game of FORMULA ONE includes all the cars, stars and circuits from the 2011 FIA FORMULA ONE WORLD CHAMPIONSHIP. Go for motorsport's ultimate prize across a full season, enter individual GRAND PRIX, or get a quick FORMULA ONE fix with Time Trials and Challenge mode. Then race sport's fastest racing cars in F1 2011's multiplayer modes including four player races and an innovative 2 vs. 2 co-op mode. [Sony]","Genre(s): Driving, Racing, Simulation, Formula One, Formula One, Automobile",66,6.6,Codemasters,PlayStation Vita,"Feb 15, 2012",N/A
FACTOTUM 90,You find yourself in deep space and something has collided with your ship. Main power is offline and you’re trapped. It’s fortunate you have access to this terminal. It’s a little old but with these two robots and some clever thinking you might be able to get power back online and save the day.,"Genre(s): Puzzle, Action",N/A,tbd,TACS Games,PlayStation Vita,"Sep 19, 2017",N/A
FAIRUNE,"An action-puzzler RPG with a retro feel!

The scourge is back with a vengeance! Seal him off for good! Collect the three Spirit Icons to lead the way to victory!

- How to play -

* Use the D-Pad to move and select items.
* Open the inventory window with the right button.
* The left button brings up the pause/save menu.","Genre(s): Role-Playing, Action RPG",N/A,tbd,Flyhigh Works,PlayStation Vita,"Apr 11, 2017",N/A
FALLEN LEGION: FLAMES OF REBELLION,Fallen Legion: Flames of Rebellion is an intense action RPG where every battle is a heart-pounding fight and each gut-wrenching choice impacts the realm.,"Genre(s): Role-Playing, Action RPG",N/A,3.0,YummyYummyTummy,PlayStation Vita,"Jul 18, 2017",N/A
FANNY PIXEL PAINT,N/A,"Genre(s): Miscellaneous, General",N/A,tbd,mufti1975,PlayStation Vita,"Dec 23, 2014",N/A
FANTASY HERO: UNSIGNED LEGACY,"The game is an action Role-Playing Game through which your character scraps with monsters that have overtaken the globe. The game features local co-op and features 4 assumable characters, each sporting a unqiue play style.","Genre(s): Role-Playing, Action RPG",59,tbd,Arc System Works,PlayStation Vita,"Dec 2, 2014",N/A
FARMFURY!,N/A,"Genre(s): Action, General",N/A,tbd,Akie Nakao,PlayStation Vita,"Jan 28, 2014",N/A
FARMING SIMULATOR,"Farming Simulator 2013 keeps all the ingredients that make the staple of virtual farming, while incorporating many new machines, vehicles, crops, animals, and environments. Farming Simulator 2013 features equipment from the top 20 vehicle manufacturers. Dozens of new machines have found their way into the game, such as the notable brand Case IH, as well as some gigantic farming machines, soon to be unveiled at Gamescom Cologne.","Genre(s): Simulation, General, General, Virtual, Career",59,7.5,Giants Software,PlayStation Vita,"Jul 2, 2013",N/A
FARMING SIMULATOR 14,"With a new refined look and twice the available equipment as its predecessor, Farming Simulator 14 gives you control of an extensive range of authentic farm machines from agricultural manufacturers, including Case IH, Deutz-Fahr, Lamborghini, Kuhn, Amazone and Krone.

Assign your team of agricultural workers to grow, harvest crops and generate virtual revenue from corn, canola, and wheat. Turn a profit on your harvest and invest it in new tools available in the machinery store.","Genre(s): Simulation, General, Virtual, Career",N/A,tbd,Giants Software,PlayStation Vita,"Jun 24, 2014",E
FARMING SIMULATOR 16,Manage your own farm and drive massive machines in an open world!,"Genre(s): Action, Simulation, General, Virtual, Career",53,4.5,Giants Software,PlayStation Vita,"Oct 6, 2015",E
