title,description,genres,meta_score,user_score,developer,platform,release_date,rating
MAGIC PLANET SNACK DELUXE,"In Magic Planet Snack Deluxe, Players take on the role of a wizard who has cast an unfortunate spell upon himself, turning into a giant space worm. Travel through the cosmos to devour wizards in other worlds for points and gather orbs to power up your hyper gauge. Be sure to avoid things like trolls, lava and satellites and look to make some key allies along the way!","Genre(s): Action, General, General",N/A,tbd,Wolfgame,PlayStation Vita,"Aug 21, 2013",N/A
MAGICAL BEAT,"Combines Drop-Down Puzzle with Beats. The main BGM is composed by the Nico Nico celebrity and sound creator, ‘Kikuo’. Last but not least, don’t forget the thirteen colorful pixel-art characters to take you through the game.","Genre(s): Action, Miscellaneous, Rhythm, Music",67,6.9,Arc System Works,PlayStation Vita,"Jun 17, 2014",N/A
MAHJAH,Mahjong-solitaire like matching 3D time killer game.Find matching cubes. Faster you find mathces - more scores you earn.ControlsSelecting a cube: Short tap on cube.Camera rotation: Swipe with one finger.Camera zoom: Pinch to zoom out and spread to zoom in.Scoring1000 points for every found matching cubes.Time-Bonus score: if matching cubes was found in 5 seconds after last.Extra combo bonus begins after second Time-Bonus.,"Genre(s): Miscellaneous, Board Games, Board / Card Game",N/A,tbd,Dmitriy Prikhodko,PlayStation Vita,"Nov 25, 2014",N/A
MAHJONG CARNIVAL,The Countess wants to travel the globe in search of remarkable and collectible masks. You are her guest of honor. Join her on a lively quest to clear the tiles and reveal exquisite finds.,"Genre(s): Miscellaneous, Puzzle, General, Matching, Board / Card Game",N/A,tbd,8Floor,PlayStation Vita,"Sep 21, 2015",N/A
MAHJONG GOLD,All hands on deck! Land ahoy!Take part in the search for Long John Silver's treasure. Uncover the secrets of the old pirate. Remove Mah-jong tokens and travel around a distant island.- A sea voyage in a Mahjong world!- 120 unique levels and more than 6 hours of game-play- A real treasure island!- Beat the game with new rules- The pirate's treasure awaits you!,"Genre(s): Miscellaneous, Board Games, Board / Card Game",N/A,tbd,8Floor,PlayStation Vita,"Sep 2, 2014",N/A
MAHJONG MAHJONG,N/A,"Genre(s): Miscellaneous, Puzzle, General, Board / Card Game",N/A,tbd,Rocking Pocket Games,PlayStation Vita,"Mar 11, 2014",N/A
MAHJONG ROYAL TOWERS,"Play Mahjong Royal Towers and experience royal generosity for yourself! Complete over 100 unique Mahjong levels in 6 locations, earning points and trophies. Visit different parts of the royal castle, from the Garden and the Armory all the way to the Throne Room! Climb the achievement ladder and the royal treasury will fling its doors open!","Genre(s): Miscellaneous, Board Games, Board / Card Game",N/A,tbd,8Floor,PlayStation Vita,"Dec 10, 2013",N/A
MAHJONG WORLD CONTEST,"Take part in a Mahjong contest. Complete over 100 unique levels of different difficulty and dynamics to gain experience and earn points. Plunge yourself into the myriads of golden tiles! Improve your rank and progress through the game hierarchy.The main protagonist, who is a real fan of Mahjong, decides to take part in a world tournament Modern Mahjong Puzzle. The tournament is split into several qualifying rounds. To take part in each round, you will have to achieve a certain rank.The objective of each level is to remove all of the golden tiles from the game board. There are many such tiles in Mahjong World Contest, which makes the game even more entertaining and adds variety to the level design (e.g. levels with floating golden titles).Levels are balanced according to the number of suits: there are classic layouts with the full set of 7 suits and there are also levels that can be completed faster due to the limited number of suits.","Genre(s): Miscellaneous, Board Games, Board / Card Game",N/A,tbd,8Floor,PlayStation Vita,"Apr 1, 2014",N/A
MAISON KANRAKU,N/A,"Genre(s): Action, General",N/A,tbd,Tchagata Games,PlayStation Vita,"Mar 31, 2015",N/A
MALDITA CASTILLA EX: CURSED CASTILLA,"For the Glory of the Arcade Times!

The tears of a young witch have been turned into a key by a demon to open a gateway to hell. In Cursed Castilla, one takes the role of Don Ramiro, a knight appointed by King Alphonse VI, to fight and banish the evil invading the lands of Tolomera.

Don Ramiro will face mouras, ojáncanos, nuberus and malismos: creatures from the European folklore, as well as from chivalric romances such as Amadís de Gaula.

For that, one will use a different range of weapons to defeat the enemies, in a pure classic arcade action style.

Cursed Castilla is an acclaimed modern arcade both by critics and players with a 81 Metascore.

Features

- Explore Tolomera del Rey in depth through 8 game stages
- Fight against more than 48 types of enemies and 19 final bosses
- Depending on the mission success, meet 1 of the 4 different possible endings
- Know all the myths featured in the game with the illustrated bestiary
- Brag about your combat skills with 17 unlockable achievements
- Yell your battle cry with the songs of the original soundtrack
- Revive the glory of the Arcade Times with 3 different view modes
- Exclusive coin-op mode for consoles of the Nintendo 3DS handhelds
- Stereoscopic 3D effect","Genre(s): Action, Platformer, 2D",N/A,8.4,Locomalito,PlayStation Vita,"Nov 9, 2017",T
MALICIOUS REBIRTH,N/A,"Genre(s): Action, General, General",N/A,7.9,Alvion,PlayStation Vita,"Oct 8, 2013",N/A
MALIYA,N/A,"Genre(s): Miscellaneous, Board / Card Game",N/A,tbd,Arrayansoft,PlayStation Vita,"Mar 29, 2016",N/A
MAN!AHDERE 20S,N/A,"Genre(s): Action, General",N/A,tbd,ZHANG BO,PlayStation Vita,"Apr 1, 2014",N/A
MAPCACHE OFFLINE MAPS,N/A,"Genre(s): Miscellaneous, General",N/A,tbd,Nostatic Software,PlayStation Vita,"May 29, 2013",N/A
MARRY THE PRINCESS,N/A,"Genre(s): Action, Platformer, 2D",N/A,tbd,FalconStar Limited,PlayStation Vita,"Mar 3, 2015",N/A
MARY SKELTER: NIGHTMARES,"Escape from the living prison jail in Mary Skelter: Nightmares for the PlayStation Vita system. The Nightmare monster actively stalks the player as you run through the dungeon, so you must use the dungeons' gimmicks to impede its movements. This dungeon RPG features a turn- based battle system that includes class change, a strategic blood-licking transform system, and a blood-rubbing system to power up your party. As you solve the dungeons' mysteries and satisfy the prison's desires, you just might make it out alive.

FEATURES:

Walking Nightmares - The dungeon-crawling RPG genre gets a twist when special enemies can chase you through the dungeons. Lay traps to make your escape, or try to face them down.

Blood-drenched Transformations - Characters can transform with stronger stats and extra skills, but if they fight too much they may enter Blood Skelter Mode, where they go completely berserk.

Everyone's got a Job - Strategise your dungeon battles by assigning different classes to your characters, unlocking new skills, stats, and character portraits.","Genre(s): Role-Playing, Action RPG, Roguelike",76,8.7,Compile Heart,PlayStation Vita,"Sep 19, 2017",M
MASSIVE CLEAVAGE VS ZOMBIES,"Your mission is to find BBQ sauce for your people and bring it back to them. Fighting off thousands of zombies with only your massive cleaver and equally massive cleavage.

The game is played with simple arcade mechanics (move left, move right, high attack, low attack), and it starts you off with an easy amount of zombies to re-kill. But each level adds more and more zombies, and eventually dogs that will chew your face off in a couple seconds","Genre(s): Action, General, Shooter, Beat-'Em-Up, 2D, Shoot-'Em-Up, Top-Down",N/A,tbd,Awesome Enterprises,PlayStation Vita,"Mar 17, 2015",N/A
MATCH,N/A,"Genre(s): Puzzle, Matching",N/A,tbd,Lightning Game Studios,PlayStation Vita,"Mar 10, 2015",N/A
MATH RUNNING,N/A,"Genre(s): Miscellaneous, Edutainment, Edutainment",N/A,tbd,NebulaDreams,PlayStation Vita,"May 29, 2013",N/A
MATH SWATTER,N/A,"Genre(s): Miscellaneous, Edutainment",N/A,tbd,CelleC Games,PlayStation Vita,"Jan 20, 2015",N/A
MATHTEST,N/A,"Genre(s): Action, Miscellaneous, General, Edutainment",N/A,tbd,Plunge Interactive,PlayStation Vita,"Feb 11, 2014",N/A
MAZE IN SPACE,N/A,"Genre(s): Action, Arcade",N/A,tbd,Maxim Fefilov,PlayStation Vita,"Apr 27, 2015",N/A
MAZING,N/A,"Genre(s): Action, Arcade",N/A,tbd,MMA,PlayStation Vita,"Apr 27, 2015",N/A
MECHHIT,N/A,"Genre(s): Action, General, General",N/A,tbd,"HorngYeuan Digital Co., Ltd.",PlayStation Vita,"Jul 10, 2013",N/A
MECHO TALES,"An all-new adventure in the world of Mecho Wars! Run and shoot through platforming levels filled with spikes, bottomless pits, and an army of deadly robots.","Genre(s): Action, Platformer, 2D",N/A,tbd,Arcade Distillery,PlayStation Vita,"Sep 19, 2017",N/A
MECHO WARS: DESERT ASHES,"In the aftermath of a great flood, a vengeful leader threatens to conquer the world with the aid of a once lost technology, and only a small but determined army stands in their path.

Mecho Wars: Desert Ashes is the definitive release of the 2009 turn-based strategy classic, Mecho Wars. Fully remastered in high definition, it features new hand painted art, new visual effects, an expanded single-player campaign and six previously unreleased multiplayer maps.

Features an easy to learn turn-based combat system, balancing air, sea and land units. Further customize your play with perks unlocked by completing challenges and compete with others locally or online.","Genre(s): Strategy, Turn-Based, General",N/A,tbd,Arcade Distillery,PlayStation Vita,"Nov 20, 2018",E10+
MEDIEVAL DEFENDERS,"Defend your ancestral castle and show the invaders who's boss in Medieval Defenders! Build towers, upgrade spells and your enemy will be vanquished. Defend your castle against the incursions of your warlike neighbors! You have cannon towers, effective spells and your own strategic reasoning at your disposal. The course of the battle depends on you!","Genre(s): Strategy, Real-Time, Defense",N/A,tbd,8Floor,PlayStation Vita,"Apr 14, 2015",N/A
MEGA TAP TAP,N/A,"Genre(s): Action, Arcade",N/A,tbd,LostVision Gamestudio,PlayStation Vita,"Jan 20, 2015",N/A
MEGABLAST,N/A,"Genre(s): Action, Shooter, Shooter, Static, Static, Shoot-'Em-Up, Top-Down",N/A,tbd,Super Icon,PlayStation Vita,"May 22, 2013",N/A
MEGATAGMENSION BLANC + NEPTUNE VS ZOMBIES,"The prestigious Gamicademi — an academy of fading glory. To put it back in the spotlight, Blanc and friends decide to film a zombie flick on campus. All’s quiet on the set until real zombies start crawling out of the woodwork! Now they’ve got to send these zombies to detention in this hack ‘n’ slash — or else be history. [Playstation.com]","Genre(s): Action, Beat-'Em-Up, 3D",61,6.4,Compile Heart,PlayStation Vita,"May 10, 2016",T
MEIQ: LABYRINTH OF DEATH,"First, the winds stopped. Then, birds vanished from the skies. Finally, the sun set...And an eternal night fell upon the world. The reason was quickly identified. It was a story told of in legends. The world had ceased hundreds of years ago as well. But there was a legendary mage who had managed to restart it.","Genre(s): General, Role-Playing, Japanese-Style",56,7.4,Compile Heart,PlayStation Vita,"Sep 13, 2016",T
MEKABOLT,"Players take the role of a theme park technician that needs to collect batteries to repair the haywire robots. With your handy Mekabolt, use the out of control robots to your advantage to overcome obstacles and obtain the batteries across 100 puzzle platforming challenges.

Shoot your trusty Mekabolt to deactivate the robots, use them as platforms, ride them to new heights, and burn pesky underbrush to reach the battery at the end of the stage. The robots can be manipulated to help you reach your goal. Watch out for dangerous traps, waiting to impede your progress. Only you can save the day!","Genre(s): Action, Platformer, 2D",N/A,tbd,Somepx,PlayStation Vita,"Aug 20, 2019",E
MEKORAMA,"Challenge your puzzle solving expectations to save a robot lost on a strange planet!

Guide the adorable robot ""B"" (because he looks like a Bee) to safety after he crash lands on a strange cubic planet.

Explore each level, rotating it in 3D to see all sides, looking for a way through to the goal. Make use of lifts and slide platforms to get around while looking out for dangers.

Think outside of the box to find solutions sometimes in unconventional ways to find a way forward. You'll be amazed at what's possible (and necessary!) and before long captivated to get to the end.","Genre(s): Puzzle, Action, General",N/A,tbd,Martin Magni,PlayStation Vita,"Mar 26, 2020",E
MELTDOWN MOON,Action! Puzzles! Moons! Jetpacks! Explosions! Avatars! Save the world from all of the above. Crazy high score grabbing action. Meltdown Many Moons today!,"Genre(s): Miscellaneous, Puzzle, Action, Puzzle, Action",N/A,tbd,Thomas Hopper,PlayStation Vita,"Jan 16, 2013",N/A
MEN'S ROOM MAYHEM,In Men's Room Mayhem you're hired as the janitor of your very own chaotic men's room.,"Genre(s): Action, General, General",67,5.1,Sawfly Studios,PlayStation Vita,"May 21, 2013",T
MERCENARY KINGS: RELOADED EDITION,"Craft your arsenal to avenge your fallen comrades and save the world from the fearsome forces of CLAW.

Save the world

In this frantic 2D action game, you are part of the Mercenary Kings, the most skilled team of warriors-for-hire on Earth. When your comrades have fallen and the fearsome forces of CLAW have seized an island-wide top secret Laboratory Base, you must do what it takes to stop them.

But you're not going in unprepared - as backup you've got a crew of rogue geniuses and experts in their field. Able to craft and customize guns'n'blades or upgrade your body armour, you've never been this ready to join the fight.","Genre(s): Action, Shooter, Scrolling, Shoot-'Em-Up, Vertical, Horizontal",N/A,8.5,Tribute Games,PlayStation Vita,"Feb 6, 2018",T
MERRY CHRISTMAS LADY SANTA,N/A,"Genre(s): Action, Shooter, Third-Person, Arcade",N/A,tbd,Pachyene Studio,PlayStation Vita,"Jun 9, 2015",N/A
MERUM,N/A,"Genre(s): Miscellaneous, General, General",N/A,tbd,SeazDevelop,PlayStation Vita,"May 15, 2013",N/A
METAGAL,"Players are thrown into the shoes of 'Meta,' a cyborg girl, in her quest to rescue her Creator 'Dr Ray' from the hands of 'General Creeper,' the evil leader of a rogue army!

To make matters worse, Metagal's sisters were also kidnapped by Creeper and he's turned them all into battle cyborgs, in order to use their powers so that he can at last, rule the world!! With no other option, Meta must face her sisters, free them, and copy their abilities, if she wishes to take down save those she loves and the world.","Genre(s): Action, Platformer, 2D",N/A,tbd,RetroRevolution,PlayStation Vita,"Mar 26, 2019",E10+
METAL GEAR SOLID 2: SONS OF LIBERTY HD EDITION,"Snake returns in the stealthy action title, Metal Gear Solid 2: Sons of Liberty. Take on the role of a one-man army determined to stop a deadly high-tech weapon from falling into the hands of a highly elite resistance group called Dead Cell. Encounter familiar faces including Revolver Ocelot and battle the new war machine, Metal Gear Ray. This time around, enemies are more aware and agile, so you must use your skills in stealth, weaponry, and counter-terrorism to fight off the competing powers.","Genre(s): Action Adventure, Modern, General, Modern",N/A,7.1,Armature Studio,PlayStation Vita,"Aug 21, 2012",N/A
METAL GEAR SOLID 3: SNAKE EATER HD EDITION,"In the third installment in the Metal Gear Solid series, you reprise your role as Solid Snake, an elite tactical soldier. This time, you are sent on a dangerous mission to both infiltrate enemy territory and uncover the secrets behind a newly created weapon of mass destruction. Survival within the jungle environments and its unpredictable settings requires basic animal instincts, as well as advanced combat and hunting skills. Set in the 1960s, the game features different types of camouflage, open-ended environments, and an array of new weapons and moves.","Genre(s): Action Adventure, Modern, General, Modern",N/A,7.9,Armature Studio,PlayStation Vita,"Aug 21, 2012",N/A
METAL GEAR SOLID HD COLLECTION,"From the critically acclaimed director, Hideo Kojima, Metal Gear Solid HD Collection offers a handful of the most popular Metal Gear Solid titles from the past in true HD for the first time ever. Featuring three complete games, Metal Gear Solid 2: Sons of Liberty, Metal Gear Solid: Snake Eater and Metal Gear Solid: Peace Walker, the HD Collection offers old and new fans a chance to experience the epic game play, design and storytelling of the MGS franchise. The ""Metal Gear Solid (MGS)"" series is the seminal work of Hideo Kojima, Japan's master game creator, and the progenitor of the stealth action game genre. The series has become a global phenomenon, with over 27 million copies sold worldwide. The player controls a secret agent from an elite special forces unit who is sent on solo sneaking missions through enemy installations, vast jungles, and sometimes even the thick of battle. Alone and surrounded by the enemy, even a special forces agent will find it tough to come out alive. But that is the secret behind the series' popularity-the cerebral challenge of figuring out how to avoid combat, and the thrill of sneaking through enemy territory undetected.The MGS series is also known for its storyline, which blends seamlessly with the gameplay. The scenarios are based on extensive research and incorporate the drama of actual developments in society. These elements have made MGS what it is today: a mature work of entertainment that transcends national borders and the confines of video games, and one of the leading products of the Japanesecontent business.","Genre(s): Miscellaneous, Action Adventure, Modern, Compilation, Compilation",81,8.5,Armature Studio,PlayStation Vita,"Jun 12, 2012",M
METAL SLUG 3,"Marco, Tarma, Eri, and Fio, the four veterans of the elite Sparrows Unit are back in METAL SLUG 3! The popular action shooting series is in its glory, with gorgeous graphics and all the run-and-gun action you can handle. There is no time for indecision. General Morden is on the warpath and you must prevent him from creating the New World Order. Stop the Rebel Army!","Genre(s): Action, Shooter, Shoot-'Em-Up, Vertical, Horizontal",N/A,tbd,Code Mystics Inc.,PlayStation Vita,"Mar 24, 2015",T
METRICO,"Dutch indie developer Digital Dreams makes its console debut with Metrico, a unique infographic puzzle action game. Set in a world filled with infographics, Metrico challenges players through 6 worlds filled with bar charts, line diagrams and pie charts, each of which directly react to the player’s movements, actions and input. For example, one bar diagram might grow with each step a player takes to the left, while another might decline with every jump. Players must explore Metrico and carefully analyze every move to see how they affect the world and what will help them advance. This game mechanic, called “Input Morphing”, forces players to think about actions that they normally wouldn’t consider in a video game. Metrico is a combination of exploration, skill, experimentation, but above all: thinking outside of the box. [Plan of Attack]","Genre(s): General, Miscellaneous, Puzzle, Action, General",68,5.8,Digital Dreams,PlayStation Vita,"Aug 5, 2014",N/A
METROPOLIS: LUX OBSCURA,This city has become rotten to the core. You can’t even tell night from day in this hell in which big money dictates everything. And the best way to prove you’re right is with brute force.,"Genre(s): Puzzle, Matching",N/A,tbd,Ktulhu Solutions,PlayStation Vita,"Apr 4, 2018",M
MICHAEL JACKSON THE EXPERIENCE HD,"Michael Jackson, one of the most widely beloved entertainers and the most popular global icons of all time, leaves an indelible imprint on popular music and culture. During his extraordinary career Jackson sold an estimated 750 million records worldwide, released 13 No.1 singles and became one of a handful of artists to be inducted twice into the Rock and Roll Hall of Fame. He won 13 Grammy Awards and received the American Music Award's Artist of the Century Award. His album ""Thriller"" is the world's best-selling album of all time with more than 110 million copies sold.","Genre(s): Action, Miscellaneous, Rhythm, Dancing, Dancing",57,6.5,Ubisoft,PlayStation Vita,"Feb 15, 2012",N/A
MICROBE CHAIN,"An extremely addicting avoider game.
Control the microbe. Try to keep it inside the circle. The chain behind you slowly grows, making you easier to hit and get knocked out.
Catch the various power ups like increase your weight, slow motion, bigger circle, smaller chain and split chain.","Genre(s): Action, General",N/A,tbd,Mid Atlantic Engineering,PlayStation Vita,"Nov 18, 2014",N/A
MIDNIGHT DELUXE,"In this golf-like game with a perpetual darkness setting, your task is to guide a little square-shaped fairy, named Midnight.","Genre(s): Puzzle, Action",N/A,tbd,Petite Games,PlayStation Vita,"Mar 6, 2018",E
MIKO GAKKOU MONOGATARI: KAEDE EPISODE,N/A,"Genre(s): Role-Playing, Japanese-Style",N/A,tbd,xinoro,PlayStation Vita,"Jun 9, 2015",N/A
MIKO GAKKOU MONOGATARI: SANAE EPISODE,N/A,"Genre(s): Adventure, General, General",N/A,tbd,xinoro,PlayStation Vita,"Jun 19, 2013",N/A
MIKO GAKKOU: SECOND YEAR,N/A,"Genre(s): Action, General",N/A,tbd,xinoro,PlayStation Vita,"Oct 29, 2013",N/A
MILES & KILO,"Race across a curious island in this fast-paced, light-hearted platformer

Miles and Kilo have been attacked by a mischievous specter! With their plane in pieces and a gang of thieving scoundrels running off with the important parts, the unfortunate duo's only hope of escape is to embark on a thrilling chase across a haunted island.

Miles & Kilo is a super tough, fast-paced action platformer. Each of the game's 36 levels can be cleared without stopping, making it a perfect choice for fans of speedrunning!

Both Miles and Kilo have their own diverse sets of moves and abilities. Miles can wall-jump, slide, punch, and toss fruit at pesky critters whereas Kilo can somersault through breakable walls and dash through the air to pounce on nearby baddies.

A special Time Attack mode is unlocked after beating Story Mode. Can you finish the game with the fastest possible time and the fewest deaths?

- A fast-paced, lovingly-crafted platformer from the creators of Kid Tripp
- 36 super-challenging levels, including 5 exciting boss fights
- Achievements and an unlockable time attack mode, offering loads of replayability
- A fun, light-hearted story told with a retro flair
- A totally rad chiptune soundtrack by Chris Kukla","Genre(s): Action, Platformer, 2D",N/A,tbd,Michael Burns,PlayStation Vita,"Oct 29, 2019",E
MILLION SHELLS -THE FIRST ENCOUNT-,N/A,"Genre(s): Strategy, Real-Time, Defense",N/A,tbd,N.Kobayashi,PlayStation Vita,"Jun 23, 2015",N/A
MILO'S QUEST,"Milo's Quest is a 2D top-down adventure game about a dog, lots of ghosts and puzzles. Featuring colorful pixelated graphics and chiptune music.

Milo is a very smart and brave dog! Help him to save the world from the ghostly armies of King Old Skull, an ancient evil, who was freed, let's say, by accident, and now wants to rule all the world and turn everyone into ghosts!!

During the way, Milo will find some special items, called Relics, which will help him on his quest by granting new skills. There is also many more other helpful and powerful items scattered throught the lands that awaits you to explore. Solve puzzles, defeat enemies, find items, improve yourself and save the world!","Genre(s): Action Adventure, General",N/A,tbd,Ratalaika Games,PlayStation Vita,"Jan 28, 2020",E
MIND MAZE,"MIND MAZE - is a logical competitive game based on capturing of the playing field. Put a walls, build a labyrinth, capture cells of playing field. Do not let the appearance of closed corners to avoid being captured by enemy. Calculate the moves to build a strategy, create a logical trap for opponent. Be cunning, force your opponent to make a mistake and cover the field like rapid avalanche, carrying you to victory. Play the single-player campaign or compete with players online.","Genre(s): Strategy, Puzzle, Turn-Based, Logic, General",N/A,tbd,Sometimes You,PlayStation Vita,"Jul 20, 2021",N/A
MIND ZERO,"Mind Zero is a first-person dungeon crawler where you fight with your MINDs (literally and figuratively). Kei is a typical high school student until his life is turned upside down when he forms a contract with a MIND, a weapon/being with deadly powers. With the government and other forces trailing him and his friends, Kei will need to discover the secret behind MIND before it’s too late.","Genre(s): Role-Playing, First-Person, General, Japanese-Style, Western-Style",59,6.7,Zerodiv,PlayStation Vita,"May 27, 2014",N/A
MINECRAFT: PLAYSTATION VITA EDITION,"The game involves players creating and destroying various types of blocks in a three dimensional environment. The player takes an avatar that can destroy or create blocks, forming fantastic structures, creations and artwork across the various multiplayer servers in multiple game modes.","Genre(s): Action Adventure, Adventure, 3D, Sandbox, First-Person, Fantasy, Fantasy",84,7.3,4J Studios,PlayStation Vita,"Oct 14, 2014",E10+
MINERS OF THE SKY: BATTLEFRONT,N/A,"Genre(s): Strategy, Real-Time, Defense",N/A,tbd,S3FR0,PlayStation Vita,"Mar 10, 2015",N/A
MINESWEEPER,N/A,"Genre(s): Miscellaneous, Puzzle, Puzzle, Logic, Logic",N/A,tbd,HEART ART,PlayStation Vita,"Jun 5, 2013",N/A
