title,url
Hail to the Chimp (PS3),https://www.metacritic.com/game/playstation-3/hail-to-the-chimp
Hakuoki: Stories of the Shinsengumi (PS3),https://www.metacritic.com/game/playstation-3/hakuoki-stories-of-the-shinsengumi
Hakuoki: Stories of the Shinsengumi - A Festive Night (PS3),https://www.metacritic.com/game/playstation-3/hakuoki-stories-of-the-shinsengumi---a-festive-night
Hakuoki: Stories of the Shinsengumi - A Meeting of Demons (PS3),https://www.metacritic.com/game/playstation-3/hakuoki-stories-of-the-shinsengumi---a-meeting-of-demons
Hakuoki: Stories of the Shinsengumi - Memories: Content Under the Blossoms (PS3),https://www.metacritic.com/game/playstation-3/hakuoki-stories-of-the-shinsengumi---memories-content-under-the-blossoms
Hakuoki: Stories of the Shinsengumi - Memories: Fading Autumn Leaves (PS3),https://www.metacritic.com/game/playstation-3/hakuoki-stories-of-the-shinsengumi---memories-fading-autumn-leaves
Hakuoki: Stories of the Shinsengumi - Memories: Fateful Moonless Night (PS3),https://www.metacritic.com/game/playstation-3/hakuoki-stories-of-the-shinsengumi---memories-fateful-moonless-night
Hakuoki: Stories of the Shinsengumi - Memories: For Good or Ill (PS3),https://www.metacritic.com/game/playstation-3/hakuoki-stories-of-the-shinsengumi---memories-for-good-or-ill
Hakuoki: Stories of the Shinsengumi - Memories: Like a Flower Blooming Madly (PS3),https://www.metacritic.com/game/playstation-3/hakuoki-stories-of-the-shinsengumi---memories-like-a-flower-blooming-madly
Hakuoki: Stories of the Shinsengumi - Memories: Madness (PS3),https://www.metacritic.com/game/playstation-3/hakuoki-stories-of-the-shinsengumi---memories-madness
Hakuoki: Stories of the Shinsengumi - Memories: Never Boring (PS3),https://www.metacritic.com/game/playstation-3/hakuoki-stories-of-the-shinsengumi---memories-never-boring
Hakuoki: Stories of the Shinsengumi - Memories: Something Important (PS3),https://www.metacritic.com/game/playstation-3/hakuoki-stories-of-the-shinsengumi---memories-something-important
Hakuoki: Stories of the Shinsengumi - Memories: The First Snow (PS3),https://www.metacritic.com/game/playstation-3/hakuoki-stories-of-the-shinsengumi---memories-the-first-snow
Hakuoki: Stories of the Shinsengumi - Memories: The Waxing and Waning of the Moon (PS3),https://www.metacritic.com/game/playstation-3/hakuoki-stories-of-the-shinsengumi---memories-the-waxing-and-waning-of-the-moon
Hakuoki: Stories of the Shinsengumi - The Life and Times of Yukimura the Page (PS3),https://www.metacritic.com/game/playstation-3/hakuoki-stories-of-the-shinsengumi---the-life-and-times-of-yukimura-the-page
Hamilton's Great Adventure (PS3),https://www.metacritic.com/game/playstation-3/hamiltons-great-adventure
Hamsterball (PS3),https://www.metacritic.com/game/playstation-3/hamsterball
Handball 16 (PS3),https://www.metacritic.com/game/playstation-3/handball-16
Handball 17 (PS3),https://www.metacritic.com/game/playstation-3/handball-17
Hannah Montana: The Movie (PS3),https://www.metacritic.com/game/playstation-3/hannah-montana-the-movie
Happy Feet Two: The Videogame (PS3),https://www.metacritic.com/game/playstation-3/happy-feet-two-the-videogame
Hard Corps: Uprising (PS3),https://www.metacritic.com/game/playstation-3/hard-corps-uprising
"Harry Potter and the Deathly Hallows, Part 1 (PS3)",https://www.metacritic.com/game/playstation-3/harry-potter-and-the-deathly-hallows-part-1
"Harry Potter and the Deathly Hallows, Part 2 (PS3)",https://www.metacritic.com/game/playstation-3/harry-potter-and-the-deathly-hallows-part-2
Harry Potter and the Half-Blood Prince (PS3),https://www.metacritic.com/game/playstation-3/harry-potter-and-the-half-blood-prince
Harry Potter and the Order of the Phoenix (PS3),https://www.metacritic.com/game/playstation-3/harry-potter-and-the-order-of-the-phoenix
Hasbro Family Game Night (PS3),https://www.metacritic.com/game/playstation-3/hasbro-family-game-night
Hasbro Family Game Night 3 (PS3),https://www.metacritic.com/game/playstation-3/hasbro-family-game-night-3
Hatsune Miku: Project Diva F (PS3),https://www.metacritic.com/game/playstation-3/hatsune-miku-project-diva-f
Hatsune Miku: Project Diva F 2nd (PS3),https://www.metacritic.com/game/playstation-3/hatsune-miku-project-diva-f-2nd
Haze (PS3),https://www.metacritic.com/game/playstation-3/haze
Heavenly Sword (PS3),https://www.metacritic.com/game/playstation-3/heavenly-sword
Heavy Fire: Afghanistan (PS3),https://www.metacritic.com/game/playstation-3/heavy-fire-afghanistan
Heavy Fire: Shattered Spear (PS3),https://www.metacritic.com/game/playstation-3/heavy-fire-shattered-spear
Heavy Rain (PS3),https://www.metacritic.com/game/playstation-3/heavy-rain
Heavy Rain Chronicles Episode 1: The Taxidermist (PS3),https://www.metacritic.com/game/playstation-3/heavy-rain-chronicles-episode-1-the-taxidermist
Heavy Rain: Move Edition (PS3),https://www.metacritic.com/game/playstation-3/heavy-rain-move-edition
Heavy Weapon: Atomic Tank (PS3),https://www.metacritic.com/game/playstation-3/heavy-weapon-atomic-tank
Hell Yeah! Pimp My Rabbit Pack (PS3),https://www.metacritic.com/game/playstation-3/hell-yeah!-pimp-my-rabbit-pack
Hell Yeah! Virtual Rabbit Missions (PS3),https://www.metacritic.com/game/playstation-3/hell-yeah!-virtual-rabbit-missions
Hell Yeah! Wrath of the Dead Rabbit (PS3),https://www.metacritic.com/game/playstation-3/hell-yeah!-wrath-of-the-dead-rabbit
Hellboy: The Science of Evil (PS3),https://www.metacritic.com/game/playstation-3/hellboy-the-science-of-evil
Helldivers (PS3),https://www.metacritic.com/game/playstation-3/helldivers
Heroes Over Europe (PS3),https://www.metacritic.com/game/playstation-3/heroes-over-europe
High Stakes on the Vegas Strip: Poker Edition (PS3),https://www.metacritic.com/game/playstation-3/high-stakes-on-the-vegas-strip-poker-edition
High Velocity Bowling (PS3),https://www.metacritic.com/game/playstation-3/high-velocity-bowling
High Velocity Bowling: Move Edition (PS3),https://www.metacritic.com/game/playstation-3/high-velocity-bowling-move-edition
History Legends of War: Patton (PS3),https://www.metacritic.com/game/playstation-3/history-legends-of-war-patton
Hitman 2: Silent Assassin HD (PS3),https://www.metacritic.com/game/playstation-3/hitman-2-silent-assassin-hd
Hitman HD Trilogy (PS3),https://www.metacritic.com/game/playstation-3/hitman-hd-trilogy
Hitman: Absolution (PS3),https://www.metacritic.com/game/playstation-3/hitman-absolution
Hitman: Blood Money HD (PS3),https://www.metacritic.com/game/playstation-3/hitman-blood-money-hd
Hitman: Contracts HD (PS3),https://www.metacritic.com/game/playstation-3/hitman-contracts-hd
Hitman: Sniper Challenge (PS3),https://www.metacritic.com/game/playstation-3/hitman-sniper-challenge
Hitogata Happa (PS3),https://www.metacritic.com/game/playstation-3/hitogata-happa
Hoard (PS3),https://www.metacritic.com/game/playstation-3/hoard
Hohokum (PS3),https://www.metacritic.com/game/playstation-3/hohokum
Hollywood Squares (PS3),https://www.metacritic.com/game/playstation-3/hollywood-squares
Homefront (PS3),https://www.metacritic.com/game/playstation-3/homefront
Homefront: Fire Sale (PS3),https://www.metacritic.com/game/playstation-3/homefront-fire-sale
Homefront: The Rock Map Pack (PS3),https://www.metacritic.com/game/playstation-3/homefront-the-rock-map-pack
Hot Shots Golf: Out of Bounds (PS3),https://www.metacritic.com/game/playstation-3/hot-shots-golf-out-of-bounds
Hot Shots Golf: World Invitational (PS3),https://www.metacritic.com/game/playstation-3/hot-shots-golf-world-invitational
Hot Shots Golf: World Invitational - Mar Cielo Course (PS3),https://www.metacritic.com/game/playstation-3/hot-shots-golf-world-invitational---mar-cielo-course
Hot Shots Golf: World Invitational - Mt. Sakura Course (PS3),https://www.metacritic.com/game/playstation-3/hot-shots-golf-world-invitational---mt-sakura-course
Hot Shots Golf: World Invitational - Northern Fox Course (PS3),https://www.metacritic.com/game/playstation-3/hot-shots-golf-world-invitational---northern-fox-course
Hot Wheels: World's Best Driver (PS3),https://www.metacritic.com/game/playstation-3/hot-wheels-worlds-best-driver
Hotline Miami (PS3),https://www.metacritic.com/game/playstation-3/hotline-miami
Hotline Miami 2: Wrong Number (PS3),https://www.metacritic.com/game/playstation-3/hotline-miami-2-wrong-number
How to Survive (PS3),https://www.metacritic.com/game/playstation-3/how-to-survive
Hunted: The Demon's Forge (PS3),https://www.metacritic.com/game/playstation-3/hunted-the-demons-forge
Hunter's Trophy 2 - America (PS3),https://www.metacritic.com/game/playstation-3/hunters-trophy-2---america
Hunter's Trophy 2 - Australia (PS3),https://www.metacritic.com/game/playstation-3/hunters-trophy-2---australia
Hustle Kings (PS3),https://www.metacritic.com/game/playstation-3/hustle-kings
Hustle Kings: Carom and U.K. Billiards Pack (PS3),https://www.metacritic.com/game/playstation-3/hustle-kings-carom-and-uk-billiards-pack
Hustle Kings: Crazy Table Pack - Basement Crazy (PS3),https://www.metacritic.com/game/playstation-3/hustle-kings-crazy-table-pack---basement-crazy
Hustle Kings: Crazy Table Pack - Hex Crazy (PS3),https://www.metacritic.com/game/playstation-3/hustle-kings-crazy-table-pack---hex-crazy
Hustle Kings: Snooker Game Pack (PS3),https://www.metacritic.com/game/playstation-3/hustle-kings-snooker-game-pack
Hustle Kings: Trickshot Pack (PS3),https://www.metacritic.com/game/playstation-3/hustle-kings-trickshot-pack
Hydrophobia: Prophecy (PS3),https://www.metacritic.com/game/playstation-3/hydrophobia-prophecy
Hyper Void (PS3),https://www.metacritic.com/game/playstation-3/hyper-void
Hyperballoid HD (PS3),https://www.metacritic.com/game/playstation-3/hyperballoid-hd
Hyperdimension Neptunia (PS3),https://www.metacritic.com/game/playstation-3/hyperdimension-neptunia
Hyperdimension Neptunia mk2 (PS3),https://www.metacritic.com/game/playstation-3/hyperdimension-neptunia-mk2
Hyperdimension Neptunia mk2: Armored Dragoon (PS3),https://www.metacritic.com/game/playstation-3/hyperdimension-neptunia-mk2-armored-dragoon
Hyperdimension Neptunia mk2: Cave's License (PS3),https://www.metacritic.com/game/playstation-3/hyperdimension-neptunia-mk2-caves-license
Hyperdimension Neptunia mk2: Concocted Goddesses (PS3),https://www.metacritic.com/game/playstation-3/hyperdimension-neptunia-mk2-concocted-goddesses
Hyperdimension Neptunia mk2: CPU...Candidate? (PS3),https://www.metacritic.com/game/playstation-3/hyperdimension-neptunia-mk2-cpucandidate
Hyperdimension Neptunia mk2: Dogoo Special Combo (PS3),https://www.metacritic.com/game/playstation-3/hyperdimension-neptunia-mk2-dogoo-special-combo
Hyperdimension Neptunia mk2: Draconic Legend (PS3),https://www.metacritic.com/game/playstation-3/hyperdimension-neptunia-mk2-draconic-legend
Hyperdimension Neptunia mk2: Dream Resident (PS3),https://www.metacritic.com/game/playstation-3/hyperdimension-neptunia-mk2-dream-resident
Hyperdimension Neptunia mk2: Falcom's License (PS3),https://www.metacritic.com/game/playstation-3/hyperdimension-neptunia-mk2-falcoms-license
Hyperdimension Neptunia mk2: Farmer's Training (PS3),https://www.metacritic.com/game/playstation-3/hyperdimension-neptunia-mk2-farmers-training
Hyperdimension Neptunia mk2: Full Metal Body (PS3),https://www.metacritic.com/game/playstation-3/hyperdimension-neptunia-mk2-full-metal-body
Hyperdimension Neptunia mk2: Game Hero Legend (PS3),https://www.metacritic.com/game/playstation-3/hyperdimension-neptunia-mk2-game-hero-legend
Hyperdimension Neptunia mk2: Gamindustri Mascot (PS3),https://www.metacritic.com/game/playstation-3/hyperdimension-neptunia-mk2-gamindustri-mascot
Hyperdimension Neptunia mk2: Gamindustri Memories (PS3),https://www.metacritic.com/game/playstation-3/hyperdimension-neptunia-mk2-gamindustri-memories
Hyperdimension Neptunia mk2: Goddess of Anotherworld (PS3),https://www.metacritic.com/game/playstation-3/hyperdimension-neptunia-mk2-goddess-of-anotherworld
Hyperdimension Neptunia mk2: Goddess of Misery (PS3),https://www.metacritic.com/game/playstation-3/hyperdimension-neptunia-mk2-goddess-of-misery
Hyperdimension Neptunia mk2: Hellfire Grotto (PS3),https://www.metacritic.com/game/playstation-3/hyperdimension-neptunia-mk2-hellfire-grotto
Hyperdimension Neptunia mk2: Impure Intentions (PS3),https://www.metacritic.com/game/playstation-3/hyperdimension-neptunia-mk2-impure-intentions
Hyperdimension Neptunia mk2: Makers (PS3),https://www.metacritic.com/game/playstation-3/hyperdimension-neptunia-mk2-makers
Hyperdimension Neptunia mk2: Metal Instrument (PS3),https://www.metacritic.com/game/playstation-3/hyperdimension-neptunia-mk2-metal-instrument
Hyperdimension Neptunia mk2: Netherworld Messenger (PS3),https://www.metacritic.com/game/playstation-3/hyperdimension-neptunia-mk2-netherworld-messenger
Hyperdimension Neptunia mk2: Obituary Star (PS3),https://www.metacritic.com/game/playstation-3/hyperdimension-neptunia-mk2-obituary-star
Hyperdimension Neptunia mk2: Oblivion Ruins (PS3),https://www.metacritic.com/game/playstation-3/hyperdimension-neptunia-mk2-oblivion-ruins
Hyperdimension Neptunia mk2: Skill Pack (PS3),https://www.metacritic.com/game/playstation-3/hyperdimension-neptunia-mk2-skill-pack
Hyperdimension Neptunia mk2: The CPU Dances Alone (PS3),https://www.metacritic.com/game/playstation-3/hyperdimension-neptunia-mk2-the-cpu-dances-alone
Hyperdimension Neptunia mk2: Trinity Steppe (PS3),https://www.metacritic.com/game/playstation-3/hyperdimension-neptunia-mk2-trinity-steppe
Hyperdimension Neptunia mk2: Way of Saburai (PS3),https://www.metacritic.com/game/playstation-3/hyperdimension-neptunia-mk2-way-of-saburai
Hyperdimension Neptunia Victory (PS3),https://www.metacritic.com/game/playstation-3/hyperdimension-neptunia-victory
Hyperdimension Neptunia Victory: 1st Level Cap Break (PS3),https://www.metacritic.com/game/playstation-3/hyperdimension-neptunia-victory-1st-level-cap-break
Hyperdimension Neptunia Victory: 2nd Level Cap Break (PS3),https://www.metacritic.com/game/playstation-3/hyperdimension-neptunia-victory-2nd-level-cap-break
Hyperdimension Neptunia Victory: 3rd Level Cap Break (PS3),https://www.metacritic.com/game/playstation-3/hyperdimension-neptunia-victory-3rd-level-cap-break
Hyperdimension Neptunia Victory: Asic Arfoire (PS3),https://www.metacritic.com/game/playstation-3/hyperdimension-neptunia-victory-asic-arfoire
Hyperdimension Neptunia Victory: Child CPU (PS3),https://www.metacritic.com/game/playstation-3/hyperdimension-neptunia-victory-child-cpu
Hyperdimension Neptunia Victory: CPU Candidates (PS3),https://www.metacritic.com/game/playstation-3/hyperdimension-neptunia-victory-cpu-candidates
Hyperdimension Neptunia Victory: Dangerous Monster Mash (PS3),https://www.metacritic.com/game/playstation-3/hyperdimension-neptunia-victory-dangerous-monster-mash
Hyperdimension Neptunia Victory: Gamindustri Memories (PS3),https://www.metacritic.com/game/playstation-3/hyperdimension-neptunia-victory-gamindustri-memories
Hyperdimension Neptunia Victory: Gamindustri's Mascot (PS3),https://www.metacritic.com/game/playstation-3/hyperdimension-neptunia-victory-gamindustris-mascot
Hyperdimension Neptunia Victory: Get the treasure!! (PS3),https://www.metacritic.com/game/playstation-3/hyperdimension-neptunia-victory-get-the-treasure!!
Hyperdimension Neptunia Victory: Ghost Fighter (PS3),https://www.metacritic.com/game/playstation-3/hyperdimension-neptunia-victory-ghost-fighter
Hyperdimension Neptunia Victory: Justice Is Huge (PS3),https://www.metacritic.com/game/playstation-3/hyperdimension-neptunia-victory-justice-is-huge
"Hyperdimension Neptunia Victory: Level Cap [IF, Compa] (PS3)",https://www.metacritic.com/game/playstation-3/hyperdimension-neptunia-victory-level-cap-if-compa
Hyperdimension Neptunia Victory: Madness and CPU Memories (PS3),https://www.metacritic.com/game/playstation-3/hyperdimension-neptunia-victory-madness-and-cpu-memories
Hyperdimension Neptunia Victory: National Entrance Exams!? (PS3),https://www.metacritic.com/game/playstation-3/hyperdimension-neptunia-victory-national-entrance-exams!
Hyperdimension Neptunia Victory: New Character 'Marvelous AQL' (PS3),https://www.metacritic.com/game/playstation-3/hyperdimension-neptunia-victory-new-character-marvelous-aql
Hyperdimension Neptunia Victory: New Party Member 'Broccoli' (PS3),https://www.metacritic.com/game/playstation-3/hyperdimension-neptunia-victory-new-party-member-broccoli
Hyperdimension Neptunia Victory: New Party Member 'CC2' (PS3),https://www.metacritic.com/game/playstation-3/hyperdimension-neptunia-victory-new-party-member-cc2
Hyperdimension Neptunia Victory: New Party Member 'Compa' (PS3),https://www.metacritic.com/game/playstation-3/hyperdimension-neptunia-victory-new-party-member-compa
Hyperdimension Neptunia Victory: New Party Member 'Falcom' (PS3),https://www.metacritic.com/game/playstation-3/hyperdimension-neptunia-victory-new-party-member-falcom
Hyperdimension Neptunia Victory: New Party Member 'IF' (PS3),https://www.metacritic.com/game/playstation-3/hyperdimension-neptunia-victory-new-party-member-if
Hyperdimension Neptunia Victory: New Party Member 'MAGES.' (PS3),https://www.metacritic.com/game/playstation-3/hyperdimension-neptunia-victory-new-party-member-mages
Hyperdimension Neptunia Victory: New Party Member 'Tekken' (PS3),https://www.metacritic.com/game/playstation-3/hyperdimension-neptunia-victory-new-party-member-tekken
Hyperdimension Neptunia Victory: Panes of Glass (PS3),https://www.metacritic.com/game/playstation-3/hyperdimension-neptunia-victory-panes-of-glass
Hyperdimension Neptunia Victory: Sack o' Scouts (PS3),https://www.metacritic.com/game/playstation-3/hyperdimension-neptunia-victory-sack-o-scouts
"Hyperdimension Neptunia Victory: Shampuru, Puru! (PS3)",https://www.metacritic.com/game/playstation-3/hyperdimension-neptunia-victory-shampuru-puru!
Hyperdimension Neptunia Victory: Super Brawling Characters (PS3),https://www.metacritic.com/game/playstation-3/hyperdimension-neptunia-victory-super-brawling-characters
Hyperdimension Neptunia Victory: Super Iron Knight (PS3),https://www.metacritic.com/game/playstation-3/hyperdimension-neptunia-victory-super-iron-knight
Hyperdimension Neptunia Victory: The Green CPU & The Black CPU (PS3),https://www.metacritic.com/game/playstation-3/hyperdimension-neptunia-victory-the-green-cpu-the-black-cpu
Hyperdimension Neptunia Victory: The Pedigree of Justice (PS3),https://www.metacritic.com/game/playstation-3/hyperdimension-neptunia-victory-the-pedigree-of-justice
Hyperdimension Neptunia Victory: The Seven Sages (PS3),https://www.metacritic.com/game/playstation-3/hyperdimension-neptunia-victory-the-seven-sages
Hyperdimension Neptunia Victory: The White and Purple CPUs (PS3),https://www.metacritic.com/game/playstation-3/hyperdimension-neptunia-victory-the-white-and-purple-cpus
Hyperdimension Neptunia Victory: Trial Period? (PS3),https://www.metacritic.com/game/playstation-3/hyperdimension-neptunia-victory-trial-period
Hyperdimension Neptunia Victory: Ultradimension CPU (PS3),https://www.metacritic.com/game/playstation-3/hyperdimension-neptunia-victory-ultradimension-cpu
Hyperdimension Neptunia: 5pb Events (PS3),https://www.metacritic.com/game/playstation-3/hyperdimension-neptunia-5pb-events
Hyperdimension Neptunia: 99 Knights (PS3),https://www.metacritic.com/game/playstation-3/hyperdimension-neptunia-99-knights
Hyperdimension Neptunia: A Goddess' Memory (PS3),https://www.metacritic.com/game/playstation-3/hyperdimension-neptunia-a-goddess-memory
Hyperdimension Neptunia: Alchemy Helper (PS3),https://www.metacritic.com/game/playstation-3/hyperdimension-neptunia-alchemy-helper
Hyperdimension Neptunia: Bourne Hazard (PS3),https://www.metacritic.com/game/playstation-3/hyperdimension-neptunia-bourne-hazard
Hyperdimension Neptunia: Dragon with a Blue Shadow (PS3),https://www.metacritic.com/game/playstation-3/hyperdimension-neptunia-dragon-with-a-blue-shadow
Hyperdimension Neptunia: Gamindustri Memories (PS3),https://www.metacritic.com/game/playstation-3/hyperdimension-neptunia-gamindustri-memories
Hyperdimension Neptunia: Giant Bull Awakens (PS3),https://www.metacritic.com/game/playstation-3/hyperdimension-neptunia-giant-bull-awakens
Hyperdimension Neptunia: Glistening Memorial (PS3),https://www.metacritic.com/game/playstation-3/hyperdimension-neptunia-glistening-memorial
Hyperdimension Neptunia: Gust Battle Ticket (PS3),https://www.metacritic.com/game/playstation-3/hyperdimension-neptunia-gust-battle-ticket
Hyperdimension Neptunia: Level Cap +200 (PS3),https://www.metacritic.com/game/playstation-3/hyperdimension-neptunia-level-cap-+200
Hyperdimension Neptunia: Level Cap +200 [2] (PS3),https://www.metacritic.com/game/playstation-3/hyperdimension-neptunia-level-cap-+200-2
Hyperdimension Neptunia: Level Cap +200 [3] (PS3),https://www.metacritic.com/game/playstation-3/hyperdimension-neptunia-level-cap-+200-3
Hyperdimension Neptunia: Level Cap +300 (PS3),https://www.metacritic.com/game/playstation-3/hyperdimension-neptunia-level-cap-+300
Hyperdimension Neptunia: Lost Employee (PS3),https://www.metacritic.com/game/playstation-3/hyperdimension-neptunia-lost-employee
Hyperdimension Neptunia: Nisa Battle Ticket (PS3),https://www.metacritic.com/game/playstation-3/hyperdimension-neptunia-nisa-battle-ticket
Hyperdimension Neptunia: Out-of-Control Robot (PS3),https://www.metacritic.com/game/playstation-3/hyperdimension-neptunia-out-of-control-robot
Hyperdimension Neptunia: Planeptune Reconstruction (PS3),https://www.metacritic.com/game/playstation-3/hyperdimension-neptunia-planeptune-reconstruction
Hyperdimension Neptunia: Quality Certification (PS3),https://www.metacritic.com/game/playstation-3/hyperdimension-neptunia-quality-certification
Hyperdimension Neptunia: Red Events (PS3),https://www.metacritic.com/game/playstation-3/hyperdimension-neptunia-red-events
Hyperdimension Neptunia: Request from an Overlord (PS3),https://www.metacritic.com/game/playstation-3/hyperdimension-neptunia-request-from-an-overlord
Hyperdimension Neptunia: Revenge for the Betrayal (PS3),https://www.metacritic.com/game/playstation-3/hyperdimension-neptunia-revenge-for-the-betrayal
Hyperdimension Neptunia: Revenge of the Seven Dragons (PS3),https://www.metacritic.com/game/playstation-3/hyperdimension-neptunia-revenge-of-the-seven-dragons
Hyperdimension Neptunia: World's Labyrinth (PS3),https://www.metacritic.com/game/playstation-3/hyperdimension-neptunia-worlds-labyrinth
