title,url
Kameo: Elements of Power (X360),https://www.metacritic.com/game/xbox-360/kameo-elements-of-power
Kane & Lynch 2: Dog Days (X360),https://www.metacritic.com/game/xbox-360/kane-lynch-2-dog-days
Kane & Lynch: Dead Men (X360),https://www.metacritic.com/game/xbox-360/kane-lynch-dead-men
Karaoke (X360),https://www.metacritic.com/game/xbox-360/karaoke
Karaoke Revolution (X360),https://www.metacritic.com/game/xbox-360/karaoke-revolution
Karaoke Revolution Glee: Volume 3 (X360),https://www.metacritic.com/game/xbox-360/karaoke-revolution-glee-volume-3
Karaoke Revolution Presents: American Idol Encore (X360),https://www.metacritic.com/game/xbox-360/karaoke-revolution-presents-american-idol-encore
Karaoke Revolution Presents: American Idol Encore 2 (X360),https://www.metacritic.com/game/xbox-360/karaoke-revolution-presents-american-idol-encore-2
Karateka (X360),https://www.metacritic.com/game/xbox-360/karateka
Kengo: Legend of the 9 (X360),https://www.metacritic.com/game/xbox-360/kengo-legend-of-the-9
Kick-Ass 2 (X360),https://www.metacritic.com/game/xbox-360/kick-ass-2
Killer Is Dead (X360),https://www.metacritic.com/game/xbox-360/killer-is-dead
Kinect Adventures! (X360),https://www.metacritic.com/game/xbox-360/kinect-adventures!
Kinect Fun Labs (X360),https://www.metacritic.com/game/xbox-360/kinect-fun-labs
Kinect Googly Eyes (X360),https://www.metacritic.com/game/xbox-360/kinect-googly-eyes
Kinect Joy Ride (X360),https://www.metacritic.com/game/xbox-360/kinect-joy-ride
Kinect Me (X360),https://www.metacritic.com/game/xbox-360/kinect-me
Kinect Nat Geo TV (X360),https://www.metacritic.com/game/xbox-360/kinect-nat-geo-tv
Kinect Party (X360),https://www.metacritic.com/game/xbox-360/kinect-party
Kinect Playfit (X360),https://www.metacritic.com/game/xbox-360/kinect-playfit
Kinect Rush: A Disney-Pixar Adventure (X360),https://www.metacritic.com/game/xbox-360/kinect-rush-a-disney-pixar-adventure
Kinect Sesame Street TV (X360),https://www.metacritic.com/game/xbox-360/kinect-sesame-street-tv
Kinect Sparkler (X360),https://www.metacritic.com/game/xbox-360/kinect-sparkler
Kinect Sports (X360),https://www.metacritic.com/game/xbox-360/kinect-sports
Kinect Sports Gems: Boxing Fight (X360),https://www.metacritic.com/game/xbox-360/kinect-sports-gems-boxing-fight
Kinect Sports Gems: Field Goal Contest (X360),https://www.metacritic.com/game/xbox-360/kinect-sports-gems-field-goal-contest
Kinect Sports: 10 Frame Bowling (X360),https://www.metacritic.com/game/xbox-360/kinect-sports-10-frame-bowling
Kinect Sports: Calorie Challenge (X360),https://www.metacritic.com/game/xbox-360/kinect-sports-calorie-challenge
Kinect Sports: Penalty Saver (X360),https://www.metacritic.com/game/xbox-360/kinect-sports-penalty-saver
Kinect Sports: Ping Pong (X360),https://www.metacritic.com/game/xbox-360/kinect-sports-ping-pong
Kinect Sports: Season Two (X360),https://www.metacritic.com/game/xbox-360/kinect-sports-season-two
Kinect Sports: Season Two - Basketball Challenge Pack (X360),https://www.metacritic.com/game/xbox-360/kinect-sports-season-two---basketball-challenge-pack
Kinect Sports: Season Two - Challenge Pack #1 (X360),https://www.metacritic.com/game/xbox-360/kinect-sports-season-two---challenge-pack-1
Kinect Sports: Season Two - Challenge Pack #2 (X360),https://www.metacritic.com/game/xbox-360/kinect-sports-season-two---challenge-pack-2
Kinect Sports: Season Two - Maple Lakes Golf Pack (X360),https://www.metacritic.com/game/xbox-360/kinect-sports-season-two---maple-lakes-golf-pack
Kinect Sports: Season Two - Midnight Mountain Ski Pack (X360),https://www.metacritic.com/game/xbox-360/kinect-sports-season-two---midnight-mountain-ski-pack
Kinect Sports: Ultimate Collection (X360),https://www.metacritic.com/game/xbox-360/kinect-sports-ultimate-collection
Kinect Star Wars (X360),https://www.metacritic.com/game/xbox-360/kinect-star-wars
Kinect: Disneyland Adventures (X360),https://www.metacritic.com/game/xbox-360/kinect-disneyland-adventures
Kinectimals (X360),https://www.metacritic.com/game/xbox-360/kinectimals
Kinectimals: Now with Bears! (X360),https://www.metacritic.com/game/xbox-360/kinectimals-now-with-bears!
King's Quest Chapter 1: A Knight to Remember (X360),https://www.metacritic.com/game/xbox-360/kings-quest-chapter-1-a-knight-to-remember
King's Quest Chapter 2: Rubble Without a Cause (X360),https://www.metacritic.com/game/xbox-360/kings-quest-chapter-2-rubble-without-a-cause
King's Quest Chapter 3: Once Upon a Climb (X360),https://www.metacritic.com/game/xbox-360/kings-quest-chapter-3-once-upon-a-climb
King's Quest Chapter 4: Snow Place Like Home (X360),https://www.metacritic.com/game/xbox-360/kings-quest-chapter-4-snow-place-like-home
King's Quest Chapter 5: The Good Knight (X360),https://www.metacritic.com/game/xbox-360/kings-quest-chapter-5-the-good-knight
King's Quest Collection (X360),https://www.metacritic.com/game/xbox-360/kings-quest-collection
King's Quest: The Complete Collection (X360),https://www.metacritic.com/game/xbox-360/kings-quest-the-complete-collection
Kingdom Under Fire: Circle of Doom (X360),https://www.metacritic.com/game/xbox-360/kingdom-under-fire-circle-of-doom
Kingdoms of Amalur: Reckoning (X360),https://www.metacritic.com/game/xbox-360/kingdoms-of-amalur-reckoning
Kingdoms of Amalur: Reckoning - House of Valor (X360),https://www.metacritic.com/game/xbox-360/kingdoms-of-amalur-reckoning---house-of-valor
Kingdoms of Amalur: Reckoning - Teeth of Naros (X360),https://www.metacritic.com/game/xbox-360/kingdoms-of-amalur-reckoning---teeth-of-naros
Kingdoms of Amalur: Reckoning - The Legend of Dead Kel (X360),https://www.metacritic.com/game/xbox-360/kingdoms-of-amalur-reckoning---the-legend-of-dead-kel
Knights Contract (X360),https://www.metacritic.com/game/xbox-360/knights-contract
KOF Sky Stage (X360),https://www.metacritic.com/game/xbox-360/kof-sky-stage
Konami Classics Vol. 1 (X360),https://www.metacritic.com/game/xbox-360/konami-classics-vol-1
Konami Classics Vol. 2 (X360),https://www.metacritic.com/game/xbox-360/konami-classics-vol-2
KrissX (X360),https://www.metacritic.com/game/xbox-360/krissx
Kung Fu Panda: Kaboom of Doom (X360),https://www.metacritic.com/game/xbox-360/kung-fu-panda-kaboom-of-doom
Kung Fu Strike: The Warrior's Rise (X360),https://www.metacritic.com/game/xbox-360/kung-fu-strike-the-warriors-rise
Kung-Fu High Impact (X360),https://www.metacritic.com/game/xbox-360/kung-fu-high-impact
